title,article,link,day,month,year,word,subjetivity,polarity,date
Russian journalist Maria Ponomarenko jailed for highlighting Mariupol killings - BBC News,"Russian journalist Maria Ponomarenko jailed for highlighting Mariupol killings - BBC NewsBBC HomepageSkip to contentAccessibility HelpYour accountHomeNewsSportReelWorklifeTravelFutureMore menuMore menuSearch BBCHomeNewsSportReelWorklifeTravelFutureCultureMusicTVWeatherSoundsClose menuBBC NewsMenuHomeWar in UkraineCoronavirusClimateVideoWorldUKBusinessTechScienceMoreStoriesEntertainment & ArtsHealthWorld News TVIn PicturesReality CheckNewsbeatLong ReadsWorldAfricaAsiaAustraliaEuropeLatin AmericaMiddle EastUS & CanadaRussian journalist Maria Ponomarenko jailed for highlighting Mariupol killingsPublished15 FebruaryShareclose panelShare pageCopy linkAbout sharingRelated TopicsRussia-Ukraine warImage source, RusNewsImage caption, Maria Ponomarenko addressed the court before she was sentencedBy Paul KirbyBBC NewsRussian journalist Maria Ponomarenko has been jailed for six years for posting on social media about a deadly attack by Russian warplanes on a theatre in Ukraine.The court in Barnaul in Siberia found her guilty of spreading ""fake news"", under laws introduced aimed at stifling dissent about the invasion of Ukraine.She was also barred from activities as a journalist for five years.Hundreds of civilians died when the Mariupol theatre was bombed last March.Ponomarenko was detained last April, weeks after the bombing, for posting that Russian warplanes had carried out the attack even though the Russian defence ministry had denied it.She is one of a growing number of Russian dissidents jailed for criticising the war in Ukraine.Rosenberg: Facing 10 years in jail for an Instagram storySome 1,200 civilians were seeking shelter inside the theatre when it was bombed by Russian fighter jets. Ukrainian authorities believe 300 people were killed but an Associated Press investigation said the number was closer to 600. Many of the bodies were found in the basement.Amnesty International said it was a war crime carried out by Russian forces and the international monitoring group OSCE said it had not received any indication to back up Russian allegations that a Ukrainian battalion had blown up the theatre.Prosecutors said Maria Ponomarenko had committed a criminal offence brought in within days of the invasion of spreading ""knowingly false information"" about the Russian armed forces.Image source, ReutersImage caption, Residents had written the Russian word for ""children"" outside the theatre in an attempt to stop Russian airstrikesAddressing the court ahead of her sentence she stressed that under Russia´s constitution she had done nothing wrong: ""Had I committed a real crime then it would be possible to ask for leniency, but again, due to my moral and ethical qualities, I would not do this.""Declaring herself a patriotic, opposition pacifist, she ended her address by saying: ""No totalitarian regime has ever been as strong as before its collapse.""The journalist and activist, who has two young children, has suffered mental health problems in jail, according to her lawyer, and last year compared her conditions in pre-trial detention to torture.Last summer, Moscow councillor Alexei Gorinov was jailed for seven years after he was filmed speaking out against Russia´s war in Ukraine in a city council meeting. Earlier this week a UN working group called for his release, concluding that his detention was arbitrary and contravened the Universal Declaration of Human Rights.In December one of Russia´s most prominent opposition figures, Ilya Yashin, was jailed for eight-and-a-half years for spreading ""fake news"" about the military after he went on YouTube to condemn the killing of hundreds of Ukrainian civilians by Russian occupying forces in Bucha, near Kyiv. Related TopicsRussia-Ukraine warRussia",https://www.bbc.co.uk/news/world-europe-64647267,15,2,2023,"['ponomarenko', 'jailed', 'ukraine', 'journalist', 'maria', 'years', 'theatre', 'mariupol', 'court', 'spreading', 'civilians', 'war', 'ukrainian', 'forces', 'russia', 'highlighting', 'posting', 'attack', 'warplanes', 'found']",0.28593749999999996,-0.02621527777777778,15/2/2023
Putin promotes Russian escalation in annual speech - BBC News,"Putin promotes Russian escalation in annual speech - BBC NewsBBC HomepageSkip to contentAccessibility HelpYour accountHomeNewsSportReelWorklifeTravelFutureMore menuMore menuSearch BBCHomeNewsSportReelWorklifeTravelFutureCultureMusicTVWeatherSoundsClose menuBBC NewsMenuHomeWar in UkraineCoronavirusClimateVideoWorldUKBusinessTechScienceMoreStoriesEntertainment & ArtsHealthWorld News TVIn PicturesReality CheckNewsbeatLong ReadsWorldAfricaAsiaAustraliaEuropeLatin AmericaMiddle EastUS & CanadaPutin promotes Russian escalation in annual speechPublished21 FebruaryShareclose panelShare pageCopy linkAbout sharingRelated TopicsRussia-Ukraine warImage source, ShuttershockImage caption, Vladimir Putin has said Russia is ready to resume nuclear weapons testing during his annual state of the nation addressBy Steve RosenbergRussia editor, MoscowEscalation. It´s become President Putin´s watchword.And we saw more of it today.""Russia suspends its participation in the New Start treaty,"" announced the Kremlin leader in his state of the nation address. As usual he blamed the West.New Start is the last remaining nuclear arms control treaty between Russia and America. It limits the nuclear arsenals of the two countries. But there was more. The Russian president announced that he had signed a decree on ""putting new ground-based strategic complexes on combat standby duty"". He warned that Russia was ready to resume nuclear weapons testing.""Of course, we will not do it first,"" President Putin added. ""But if the US conducts tests, we will do it as well.""New Start had been in trouble. Last month Washington had accused Moscow of violating the agreement by refusing to allow inspection activities on its territory. Moscow´s suspension of its participation in the treaty raises the stakes.""This is more about nuclear blackmail, but it is extremely dangerous,"" believes Andrei Kolesnikov of the Carnegie Endowment for International Peace, ""because we cannot predict how Putin will behave in the future and what is in his mind.""In order to avoid nuclear war, it´s better to have a framework,"" he added.""By losing this framework we are witnessing the real threat of a nuclear war.""What is the New Start treaty?Image source, AFPImage caption, A Russian RS-24 Yars strategic nuclear missileSigned in 2010 by two then presidents - Barack Obama and Dmitry Medvedev - the New Start treaty was designed to prevent nuclear war. It limits the number of strategic nuclear warheads that both sides can deploy, and gives each country the power to inspect the other.The arrangement came into force in 2011 and was extended 10 years later - although weapons inspections were disrupted by the Covid pandemic.Each side´s limit is 1,550 long-range nuclear warheads, a lower number than under the previous Start deal.Between them, the two former Cold War rivals account for almost all of the world´s nuclear weapons. Russia had previously said it wanted to keep the treaty running - despite hostile rhetoric on both sides during the Ukraine war.We´re also witnessing a Kremlin leader who expresses no remorse or regret for his decision to invade Ukraine. His ""special military operation"" has not gone at all according to plan, bringing misery to Ukraine, heavy military casualties for Russia and forcing President Putin to draft hundreds of thousands of Russians into the army. So, was the invasion a huge mistake? A giant miscalculation? You won´t hear Putin admit to one of those. He continues to push the false narrative that the West is to blame for the war.""I want to repeat,"" he said. ""They [the West] started the war. And we used force and are using force to stop it.""""The Western elites do not conceal their goals to bring Russia a strategic defeat. What does it mean? It means to end us, once and for all. It means they plan to turn a local conflict into a global confrontation. We understand it exactly like that. We will react to it accordingly. This is because in this case it is about the very existence of our country."" President Putin exuded confidence that Russia could survive international sanctions and - despite Western support for Ukraine - emerge victorious. No hint of compromise. No sign he´s looking for an off-ramp.""He thinks he has reserves for continuing the war and confrontation. It´s a bad sign,"" Mr Kolesnikov concludes."" He has disrupted any connection with Western countries. He is not ready to finish this disaster right now. He will continue.""Related TopicsRussia-Ukraine warRussiaVladimir PutinUkraine",https://www.bbc.co.uk/news/world-europe-64720695,21,2,2023,"['nuclear', 'putin', 'russia', 'war', 'ukraine', 'start', 'treaty', 'president', 'weapons', 'strategic', 'annual', 'ready', 'west', 'force', 'western', 'promotes', 'escalation', 'resume', 'state', 'nation']",0.3256946285007509,0.023037591660040643,21/2/2023
Biden says tanks are not offensive threat to Russia - BBC News,"Biden says tanks are not offensive threat to Russia - BBC NewsBBC HomepageSkip to contentAccessibility HelpYour accountHomeNewsSportReelWorklifeTravelFutureMore menuMore menuSearch BBCHomeNewsSportReelWorklifeTravelFutureCultureMusicTVWeatherSoundsClose menuBBC NewsMenuHomeWar in UkraineCoronavirusClimateVideoWorldUKBusinessTechScienceMoreStoriesEntertainment & ArtsHealthWorld News TVIn PicturesReality CheckNewsbeatLong ReadsWorldAfricaAsiaAustraliaEuropeLatin AmericaMiddle EastUS & CanadaBiden says tanks are not offensive threat to RussiaThis video can not be playedTo play this video you need to enable JavaScript in your browser.Biden says tanks are not offensive threat to RussiaCloseUS President Joe Biden announced that the US would be sending tanks to Ukraine and that the war would end today if only Russian troops would return to Russia.Published25 JanuarySectionBBC NewsSubsectionUS & CanadaShareclose panelShare pageCopy linkAbout sharingRead descriptionExplore moreBiden says tanks are not offensive threat to Russia. Video, 00:01:38Biden says tanks are not offensive threat to RussiaPublished25 JanuarySubsectionUS & Canada1:38Up Next. Biden praises Zelensky and Ukrainian people. Video, 00:01:12Biden praises Zelensky and Ukrainian peoplePublished21 December 2022SubsectionWorldUp Next1:12Zelensky greeted by Biden at the White House. Video, 00:01:08Zelensky greeted by Biden at the White HousePublished21 December 2022SubsectionWorld1:08Archive video shows Chris Parry and Andrew Bagshaw. Video, 00:00:31Archive video shows Chris Parry and Andrew BagshawPublished24 JanuarySubsectionUK0:31Editor´s recommendationsThe Lineker tweet row - in 90 seconds. Video, 00:01:29The Lineker tweet row - in 90 secondsPublished21 hours agoSubsectionUK1:29Video appears to show Hamburg suspect firing through window. Video, 00:01:18Video appears to show Hamburg suspect firing through windowPublished1 day agoSubsectionEurope1:18Watch: On the ground at Israel´s mass protests. Video, 00:01:04Watch: On the ground at Israel´s mass protestsPublished1 day agoSubsectionMiddle East1:04Sliding cars and snowball fights amid Spring flurry. Video, 00:00:41Sliding cars and snowball fights amid Spring flurryPublished1 day agoSubsectionUK0:41Tearful Marine describes Afghan withdrawal ´catastrophe´ Video, 00:02:31Tearful Marine describes Afghan withdrawal ´catastrophe´Published2 days agoSubsectionUS & Canada2:31Watch: China´s leader and his two teacup power move. Video, 00:00:59Watch: China´s leader and his two teacup power movePublished2 days agoSubsectionChina0:59One-minute World News. Video, 00:01:01One-minute World NewsPublished7 hours agoSectionBBC News1:01What you need to know on Eurovision UK entry in 61 seconds. Video, 00:01:01What you need to know on Eurovision UK entry in 61 secondsPublished2 days agoSubsectionEntertainment & Arts1:01The ex-RAF base used in WWII that could house migrants. Video, 00:00:47The ex-RAF base used in WWII that could house migrantsPublished3 days agoSubsectionEngland0:47Rare ´snow tornado´ spotted by Shetland crofter. Video, 00:00:36Rare ´snow tornado´ spotted by Shetland crofterPublished2 days agoSubsectionScotland0:36HomeNewsSportReelWorklifeTravelFutureCultureMusicTVWeatherSoundsTerms of UseAbout the BBCPrivacy PolicyCookiesAccessibility HelpParental GuidanceContact the BBCGet Personalised NewslettersWhy you can trust the BBCAdvertise with usAdChoices / Do Not Sell My Info© 2023 BBC. The BBC is not responsible for the content of external sites. Read about our approach to external linking",https://www.bbc.co.uk/news/world-us-canada-64394857,25,1,2023,"['biden', 'tanks', 'offensive', 'threat', 'days', 'zelensky', 'watch', 'russia', 'house', 'day', 'canada', 'praises', 'ukrainian', 'greeted', 'white', 'archive', 'shows', 'chris', 'parry', 'andrew']",0.375,-0.17,25/1/2023
Ukraine war: Russian reservists fighting with shovels - UK defence ministry - BBC News,"Ukraine war: Russian reservists fighting with shovels - UK defence ministry - BBC NewsBBC HomepageSkip to contentAccessibility HelpYour accountHomeNewsSportReelWorklifeTravelFutureMore menuMore menuSearch BBCHomeNewsSportReelWorklifeTravelFutureCultureMusicTVWeatherSoundsClose menuBBC NewsMenuHomeWar in UkraineCoronavirusClimateVideoWorldUKBusinessTechScienceMoreStoriesEntertainment & ArtsHealthWorld News TVIn PicturesReality CheckNewsbeatLong ReadsWorldAfricaAsiaAustraliaEuropeLatin AmericaMiddle EastUS & CanadaUkraine war: Russian reservists fighting with shovels - UK defence ministryPublished5 days agoShareclose panelShare pageCopy linkAbout sharingRelated TopicsRussia-Ukraine warImage source, Getty ImagesImage caption, The MPL-50 is particularly mythologised in Russia, the UK defence ministry said (stock photo)Russian reservists could be using ""shovels"" for ""hand-to-hand"" combat in Ukraine due to a shortage of ammunition, the UK´s Ministry of Defence says.In late February, reservists described being ordered to assault a Ukrainian position ""armed with only ´firearms and shovels´"", the ministry said in its latest intelligence update.It mentioned a shovel known as MPL-50.The tool was designed in 1869 and had changed little, the ministry said.It has been part of the Russian reservist army kit for decades.""The lethality of the standard-issue MPL-50 entrenching tool is particularly mythologised in Russia,"" the ministry said.The continued use of the shovel ""as a weapon highlights the brutal and low-tech fighting which has come to characterise much of the war"", it said.One of the reservists described being ""neither physically nor psychologically"" prepared for the action, the update added.""Recent evidence suggests an increase in close combat in Ukraine,"" it said. ""This is probably a result of the Russian command continuing to insist on offensive action largely consisting of dismounted infantry, with less support from artillery fire because Russia is short of munitions.""The BBC has been unable to independently verify these reports. The ministry did not give information on where such battles were taking place.Analysts say that although there is indeed an ammunition shortage, the situation is more complex than the intelligence update suggests, with Russian forces still using twice as much ammunition as the Ukrainian side.Is Russia’s stock of weapons running low?Meanwhile Russian forces appear to have secured a sufficient positional advantage in the besieged city of Bakhmut, the Institute for the Study of War (ISW) said.Bakhmut has seen months of fighting, as Russia tries to take control of the small city, where around 4,000 civilians remain. Taking the city would be a rare battlefield success in recent months for Russia, but the city´s strategic value has been questioned.The ISW said Russia´s positional advantage could allow a ""turning movement"" in the city. The purpose of a turning movement is to force the enemy to abandon prepared defensive positions, and is different from the aim of an encirclement, which is to trap and destroy enemy forces, the ISW says. ""The Russians may have intended to encircle Ukrainian forces in Bakhmut, but the Ukrainian command has signalled that it will likely withdraw rather than risk an encirclement,"" the ISW said.However, the Ukrainian military said on Sunday that it had no intention of withdrawing from Bakhmut.A statement by the Armed Forces General Staff acknowledged that Russian forces were still trying to surround the city, but said more than 100 attacks had been repelled in the eastern Donbas region in the past 24 hours. Thousands of Russian troops have died trying to take Bakhmut, which had a pre-war population of around 75,000.Related TopicsRussia-Ukraine warRussiaUkraine",https://www.bbc.co.uk/news/world-europe-64855760,6,3,2023,"['ministry', 'russia', 'forces', 'city', 'ukraine', 'war', 'reservists', 'ukrainian', 'bakhmut', 'fighting', 'shovels', 'defence', 'isw', 'mpl', 'ammunition', 'update', 'mythologised', 'stock', 'hand', 'combat']",0.32220376522702104,-0.0013150609080841643,6/3/2023
How MI5 caught UK embassy spy selling secrets to Russia - BBC News,"How MI5 caught UK embassy spy selling secrets to Russia - BBC NewsBBC HomepageSkip to contentAccessibility HelpYour accountHomeNewsSportReelWorklifeTravelFutureMore menuMore menuSearch BBCHomeNewsSportReelWorklifeTravelFutureCultureMusicTVWeatherSoundsClose menuBBC NewsMenuHomeWar in UkraineCoronavirusClimateVideoWorldUKBusinessTechScienceMoreStoriesEntertainment & ArtsHealthWorld News TVIn PicturesReality CheckNewsbeatLong ReadsUKEnglandN. IrelandScotlandWalesIsle of ManGuernseyJerseyPoliticsLocal NewsHow MI5 caught UK embassy spy selling secrets to RussiaThis video can not be playedTo play this video you need to enable JavaScript in your browser.How MI5 caught UK embassy spy selling secrets to RussiaCloseA spy at Berlin´s British embassy, who sold secrets to Russia and was caught in an undercover MI5 sting, has been jailed for 13 years and two months.David Smith, 58, tried to damage Britain´s interests by passing on details of the embassy and its staff for cash payments, a judge found after the spy pleaded guilty.The BBC´s Home Affairs correspondent Tom Symonds explains what Mr Smith did, and how he was stopped.Video by Mattea Bubalo & James McFaddenPublished17 FebruarySectionBBC NewsSubsectionUKShareclose panelShare pageCopy linkAbout sharingRead descriptionExplore moreHow MI5 caught UK embassy spy selling secrets to Russia. Video, 00:01:27How MI5 caught UK embassy spy selling secrets to RussiaPublished17 FebruarySubsectionUK1:27Up Next. WATCH: Smith captured on hidden embassy camera. Video, 00:00:19WATCH: Smith captured on hidden embassy cameraPublished17 FebruarySubsectionUKUp Next0:19Judge delivers sentence in embassy spy case. Video, 00:01:20Judge delivers sentence in embassy spy casePublished17 FebruarySubsectionUK1:20Editor´s recommendationsThe Lineker tweet row - in 90 seconds. Video, 00:01:29The Lineker tweet row - in 90 secondsPublished21 hours agoSubsectionUK1:29Video appears to show Hamburg suspect firing through window. Video, 00:01:18Video appears to show Hamburg suspect firing through windowPublished1 day agoSubsectionEurope1:18Watch: On the ground at Israel´s mass protests. Video, 00:01:04Watch: On the ground at Israel´s mass protestsPublished1 day agoSubsectionMiddle East1:04Sliding cars and snowball fights amid Spring flurry. Video, 00:00:41Sliding cars and snowball fights amid Spring flurryPublished1 day agoSubsectionUK0:41Tearful Marine describes Afghan withdrawal ´catastrophe´ Video, 00:02:31Tearful Marine describes Afghan withdrawal ´catastrophe´Published2 days agoSubsectionUS & Canada2:31Watch: China´s leader and his two teacup power move. Video, 00:00:59Watch: China´s leader and his two teacup power movePublished2 days agoSubsectionChina0:59One-minute World News. Video, 00:01:01One-minute World NewsPublished7 hours agoSectionBBC News1:01What you need to know on Eurovision UK entry in 61 seconds. Video, 00:01:01What you need to know on Eurovision UK entry in 61 secondsPublished2 days agoSubsectionEntertainment & Arts1:01The ex-RAF base used in WWII that could house migrants. Video, 00:00:47The ex-RAF base used in WWII that could house migrantsPublished3 days agoSubsectionEngland0:47Rare ´snow tornado´ spotted by Shetland crofter. Video, 00:00:36Rare ´snow tornado´ spotted by Shetland crofterPublished2 days agoSubsectionScotland0:36HomeNewsSportReelWorklifeTravelFutureCultureMusicTVWeatherSoundsTerms of UseAbout the BBCPrivacy PolicyCookiesAccessibility HelpParental GuidanceContact the BBCGet Personalised NewslettersWhy you can trust the BBCAdvertise with usAdChoices / Do Not Sell My Info© 2023 BBC. The BBC is not responsible for the content of external sites. Read about our approach to external linking",https://www.bbc.co.uk/news/uk-64684371,17,2,2023,"['embassy', 'spy', 'mi', 'caught', 'secrets', 'watch', 'selling', 'days', 'smith', 'russia', 'judge', 'day', 'februarysubsectionuk', 'captured', 'hidden', 'delivers', 'sentence', 'lineker', 'row', 'seconds']",0.37962962962962965,-0.22592592592592592,17/2/2023
UK falls silent to mark one-year anniversary of Russian invasion of Ukraine - BBC News,"UK falls silent to mark one-year anniversary of Russian invasion of Ukraine - BBC NewsBBC HomepageSkip to contentAccessibility HelpYour accountHomeNewsSportReelWorklifeTravelFutureMore menuMore menuSearch BBCHomeNewsSportReelWorklifeTravelFutureCultureMusicTVWeatherSoundsClose menuBBC NewsMenuHomeWar in UkraineCoronavirusClimateVideoWorldUKBusinessTechScienceMoreStoriesEntertainment & ArtsHealthWorld News TVIn PicturesReality CheckNewsbeatLong ReadsUKEnglandN. IrelandScotlandWalesIsle of ManGuernseyJerseyPoliticsLocal NewsUK falls silent to mark one-year anniversary of Russian invasion of UkraineThis video can not be playedTo play this video you need to enable JavaScript in your browser.UK falls silent to mark one-year anniversary of Russian invasion of UkraineCloseA minute´s silence has been observed in several location across the UK to mark the first anniversary of the Russian invasion of Ukraine.British Prime Minister Rishi Sunak led the nation in silence from Downing Street.Published24 FebruarySectionBBC NewsSubsectionUKShareclose panelShare pageCopy linkAbout sharingRead descriptionExplore moreUK falls silent to mark anniversary of invasion. Video, 00:00:43UK falls silent to mark anniversary of invasionPublished24 FebruarySubsectionUK0:43Up Next. WATCH: One year of war in Ukraine in 87 seconds. Video, 00:01:27WATCH: One year of war in Ukraine in 87 secondsPublished23 FebruarySubsectionEuropeUp Next1:27Helen Mirren tears up reciting poem at Ukraine vigil. Video, 00:01:06Helen Mirren tears up reciting poem at Ukraine vigilPublished23 FebruarySubsectionUK1:06Latvian MP swears at Russia during protest walkout. Video, 00:00:32Latvian MP swears at Russia during protest walkoutPublished23 FebruarySubsectionEurope0:32Putin and Biden´s speeches compared in under a minute. Video, 00:00:53Putin and Biden´s speeches compared in under a minutePublished21 FebruarySubsectionEurope0:53Editor´s recommendationsThe Lineker tweet row - in 90 seconds. Video, 00:01:29The Lineker tweet row - in 90 secondsPublished21 hours agoSubsectionUK1:29Video appears to show Hamburg suspect firing through window. Video, 00:01:18Video appears to show Hamburg suspect firing through windowPublished1 day agoSubsectionEurope1:18Watch: On the ground at Israel´s mass protests. Video, 00:01:04Watch: On the ground at Israel´s mass protestsPublished1 day agoSubsectionMiddle East1:04Sliding cars and snowball fights amid Spring flurry. Video, 00:00:41Sliding cars and snowball fights amid Spring flurryPublished1 day agoSubsectionUK0:41Tearful Marine describes Afghan withdrawal ´catastrophe´ Video, 00:02:31Tearful Marine describes Afghan withdrawal ´catastrophe´Published2 days agoSubsectionUS & Canada2:31Watch: China´s leader and his two teacup power move. Video, 00:00:59Watch: China´s leader and his two teacup power movePublished2 days agoSubsectionChina0:59One-minute World News. Video, 00:01:01One-minute World NewsPublished7 hours agoSectionBBC News1:01What you need to know on Eurovision UK entry in 61 seconds. Video, 00:01:01What you need to know on Eurovision UK entry in 61 secondsPublished2 days agoSubsectionEntertainment & Arts1:01The ex-RAF base used in WWII that could house migrants. Video, 00:00:47The ex-RAF base used in WWII that could house migrantsPublished3 days agoSubsectionEngland0:47Rare ´snow tornado´ spotted by Shetland crofter. Video, 00:00:36Rare ´snow tornado´ spotted by Shetland crofterPublished2 days agoSubsectionScotland0:36HomeNewsSportReelWorklifeTravelFutureCultureMusicTVWeatherSoundsTerms of UseAbout the BBCPrivacy PolicyCookiesAccessibility HelpParental GuidanceContact the BBCGet Personalised NewslettersWhy you can trust the BBCAdvertise with usAdChoices / Do Not Sell My Info© 2023 BBC. The BBC is not responsible for the content of external sites. Read about our approach to external linking",https://www.bbc.co.uk/news/uk-64759077,24,2,2023,"['mark', 'anniversary', 'ukraine', 'watch', 'falls', 'silent', 'invasion', 'days', 'minute', 'seconds', 'secondspublished', 'day', 'silence', 'februarysubsectionuk', 'war', 'helen', 'mirren', 'tears', 'reciting', 'poem']",0.21078431372549017,-0.08529411764705884,24/2/2023
