title,article,link,day,month,year,word,subjetivity,polarity,date
Ukraine: US sanctions Chinese firm helping Russia's Wagner Group - BBC News,"Ukraine: US sanctions Chinese firm helping Russia´s Wagner Group - BBC NewsBBC HomepageSkip to contentAccessibility HelpYour accountHomeNewsSportReelWorklifeTravelFutureMore menuMore menuSearch BBCHomeNewsSportReelWorklifeTravelFutureCultureMusicTVWeatherSoundsClose menuBBC NewsMenuHomeWar in UkraineCoronavirusClimateVideoWorldUKBusinessTechScienceMoreStoriesEntertainment & ArtsHealthWorld News TVIn PicturesReality CheckNewsbeatLong ReadsAsiaChinaIndiaUkraine: US sanctions Chinese firm helping Russia´s Wagner GroupPublished27 JanuaryShareclose panelShare pageCopy linkAbout sharingRelated TopicsRussia-Ukraine warImage source, ReutersImage caption, Wagner is a key partner in Russia´s war effort, sending thousands of mercenary fighters to UkraineBy Kelly NgBBC NewsThe US has sanctioned a Chinese company for allegedly providing satellite imagery of Ukraine to support the mercenary Wagner Group´s combat operations for Russia.Changsha Tianyi Space Science and Technology Research Institute is among 16 entities slapped with curbs by the Treasury Department.The firm, also known as Spacety China, has offices in Beijing and Luxembourg.Wagner supplies Russia thousands of fighters in the Ukraine war.Spacety China had provided Terra Tech, a Russia-based technology firm, with synthetic aperture radar (SAR) satellite images of locations in Ukraine, the US Treasury Department´s Office of Foreign Assets Control said in a statement on Thursday.""These images were gathered in order to enable Wagner combat operations in Ukraine,"" it said. The department has also sanctioned Spacety´s Luxembourg-based subsidiary. Under the sanctions, there can be no transfer, payment, or export of any property or interests in the United States to the targeted entities.Spacety China has yet to respond to the move.China, a strategic partner of Russia, has attempted to position itself as a neutral party with regard to the Ukraine war. It has been criticised by the US and its allies for refusing to condemn Russia´s invasion of Ukraine.WATCH: Inside the Wagner groupRussia-supporting Wagner mercenary numbers soarOn its website, Spacety China describes itself as a ""pioneer"" in providing commercial SAR technology and says  it wants to ""make SAR imagery of every point on earth accessible and affordable"" to users all over the world.SAR is a type of radar technology that can deliver higher resolution images using shorter antennas.Its chief executive officer Yang Feng sits on China´s Ministry of Science and Technology´s panel of experts, according to the company´s website.The site also lists a number of working partners including state-owned enterprises China Aerospace Science and Industry Corporation and China Electronics Technology Group Corporation, as well as the University of Chinese Academy of Sciences.Image source, AFPImage caption, On its website, Spacety China describes itself as a ""pioneer"" in providing satellite technologyIn addition to Spacety China, 15 other entities, eight individuals and four aircraft - many of them based in Russia - that allegedly form part of Wagner´s global support network also received US sanctions.These include Sewa Security Services based in central Africa and Kratol Aviation based in the United Arab Emirates, which allegedly provided aircraft to move personnel and equipment between central Africa, Libya and Mali.Wagner now commands some 50,000 fighters in Ukraine, according to estimates from the White House. The organisation plays a key role in Russia´s war efforts, and has been heavily involved in attempts to capture Bakhmut, a city in eastern Ukraine.It is led by Yevgeny Prigozhin, a close ally of Russian president Vladimir Putin.""Today´s expanded sanctions on Wagner, as well as new sanctions on their associates and other companies enabling the Russian military complex, will further impede Putin´s ability to arm and equip his war machine,"" said US Treasury Secretary Janet Yellen.Related TopicsRussia-Ukraine warChinaRussiaUkraineRussia sanctions",https://www.bbc.co.uk/news/world-asia-china-64421915,27,1,2023,"['ukraine', 'wagner', 'russia', 'china', 'sanctions', 'spacety', 'technology', 'war', 'based', 'firm', 'sar', 'group', 'mercenary', 'fighters', 'allegedly', 'providing', 'satellite', 'science', 'entities', 'treasury']",0.2720170454545454,-0.01917613636363636,27/1/2023
Makiivka: Russia points fingers after deadliest Ukraine attack - BBC News,"Makiivka: Russia points fingers after deadliest Ukraine attack - BBC NewsBBC HomepageSkip to contentAccessibility HelpYour accountHomeNewsSportReelWorklifeTravelFutureMore menuMore menuSearch BBCHomeNewsSportReelWorklifeTravelFutureCultureMusicTVWeatherSoundsClose menuBBC NewsMenuHomeWar in UkraineCoronavirusClimateVideoWorldUKBusinessTechScienceMoreStoriesEntertainment & ArtsHealthWorld News TVIn PicturesReality CheckNewsbeatLong ReadsWorldAfricaAsiaAustraliaEuropeLatin AmericaMiddle EastUS & CanadaMakiivka: Russia points fingers after deadliest Ukraine attackPublished3 JanuaryShareclose panelShare pageCopy linkAbout sharingRelated TopicsRussia-Ukraine warImage source, ReutersImage caption, Local military commander´s wife Yekaterina Kolotovkina was among mourners in the centre of SamaraBy Paul KirbyBBC NewsThe deaths of dozens of Russian soldiers in a new year missile strike on a building in occupied eastern Ukraine have prompted recriminations among critics of the Russian military.Russia´s defence ministry has so far conceded that 89 people were killed in the Ukrainian attack on Makiivka at around midnight on New Year´s Eve.One commander´s wife accused the West of trying to destroy Russia.But elsewhere military leaders were accused of incompetence.Ukraine says as many as 400 people were killed or wounded at Makiivka, and numbers into the hundreds have been given by Russian nationalists on social media. However, there is no way of verifying how many soldiers were killed when US-made Himars missiles hit a vocational college packed with conscripts. Ammunition was also being stored close to the site, which was reduced to rubble. Whatever the number, this is the highest number of deaths acknowledged by Russia since it invaded Ukraine on 24 February 2022.Rallies were held in several cities in Russia´s south-western region of Samara, where governor Dmitry Azarov said many of the conscripts had lived.The biggest commemoration took place in the city of Samara itself, with at least 200 people taking part. Other official events were held in the industrial city of Tolyatti and in Syzran and Novokuybyshevsk.No criticism was reported at the Samara rally, where the main remarks came from Yekaterina Kolotovkina, who said ""neither we nor our husbands wanted war; the entire West united against us to eliminate us and our children"". Hers was very much an official voice as her husband, Lt Gen Andrei Kolotovkin, commands the 2nd Guards Combined Arms Army based in Samara.The commander´s wife´s remarks prompted anger on social media with independent journalist Dmitry Kolezev pointing out that her husband did not die in Makiivka. ""Could we have at least some evidence?"" he asked, in response to her claim that the West intended to kill Samara´s children. Another blogger condemned her comments as a ""pack of lies"".The governor of Samara met defence ministry officials in Moscow on Tuesday and was expected to visit some of the wounded in hospital in the city of Rostov-on-Don the next day.President Vladimir Putin has so far said nothing about the attack, but did sign a decree on Tuesday for families of National Guard soldiers killed in service to be paid 5m roubles (£57,000; $69,000).Image source, ReutersImage caption, The building housing the conscripts was all but flattened in the Ukrainian attackThe soldiers sent to Makiivka were among an estimated 300,000 men signed up by Russia´s military as part of the president´s ""partial mobilisation"" announced last September in the face of a string of setbacks in Ukraine.A number of voices have been highly critical of the military in the aftermath of the attack on Makiivka, a city adjacent to the main city of Donetsk and some distance from the front line.Pavel Gubarev, a former leading official in Russia´s proxy authority in Donetsk, condemned the decision to place a large number of soldiers in one building as ""criminal negligence"". Such mistakes were being made early in the war, he complained, and even if the conscripts did not realise the risk, the authorities should have. ""If no-one is punished for this, then it´ll only get worse,"" he warned.One theory promoted by local security officials was that Ukrainian forces had been able to detect the use of Russian mobile phones by servicemen arriving at the vocational college on New Year´s Eve.The deputy speaker of Moscow´s local parliament, Andrei Medvedev, said it was predictable that the soldiers would be blamed - instead of the commander who made the original decision to position so many soldiers in one place.""History will certainly preserve the names of those who tried to keep silent about the trouble, and those who tried to blame the dead soldier for everything,"" he wrote on Telegram.Meanwhile, Ukraine´s armed forces said they killed or wounded 500 Russian troops in another attack on New Year´s Eve, on a village in the occupied southern region of Kherson. There was no independent verification of the attack at Chulakivka, some 20km south of the River Dnipro. Russian forces retreated across the Dnipro in November and Ukrainian officials have posted video of a flag being hoisted on an island between the eastern and western banks of the river.Ukraine´s southern military command has warned that it is too early to talk of Velykyi Potomkin island being completely liberated.Commander in chief Valerii Zaluzhny said on Monday that Ukraine had liberated 40% of the territories seized by Russia since last February, and 28% of all territories occupied by Russia since 2014.Related TopicsRussia-Ukraine warRussiaUkraine",https://www.bbc.co.uk/news/world-europe-64155859,3,1,2023,"['ukraine', 'russia', 'soldiers', 'makiivka', 'attack', 'military', 'samara', 'commander', 'killed', 'city', 'ukrainian', 'conscripts', 'number', 'local', 'wife', 'building', 'occupied', 'eve', 'west', 'wounded']",0.27064604377104384,0.008111471861471858,3/1/2023
Ukraine war: The friends who fought Russia's invasion - BBC News,"Ukraine war: The friends who fought Russia´s invasion - BBC NewsBBC HomepageSkip to contentAccessibility HelpYour accountHomeNewsSportReelWorklifeTravelFutureMore menuMore menuSearch BBCHomeNewsSportReelWorklifeTravelFutureCultureMusicTVWeatherSoundsClose menuBBC NewsMenuHomeWar in UkraineCoronavirusClimateVideoWorldUKBusinessTechScienceMoreStoriesEntertainment & ArtsHealthWorld News TVIn PicturesReality CheckNewsbeatLong ReadsWorldAfricaAsiaAustraliaEuropeLatin AmericaMiddle EastUS & CanadaUkraine war: The friends who fought Russia´s invasionPublished24 FebruaryShareclose panelShare pageCopy linkAbout sharingRelated TopicsRussia-Ukraine warImage source, BBC/Jeremy BowenImage caption, Dmytro Kisilenko (left) and Maxsym Lutsyk admit they felt fear when they joined the war one year agoBy Jeremy BowenBBC News, KyivWar transforms individuals, as well as nations. When the Russian army loomed over Ukraine at the end of February 2022, two university students, Maxsym Lutsyk and Dmytro Kisilenko, decided that they could not sit idle when their country was threatened. Maxsym was 19, Dmytro was 18. I met them at a volunteer centre in central Kyiv on the day they signed up to fight. They took their big step into the unknown dressed to go to a festival, not to war. Dmytro had a yoga mat to sleep on. The older volunteers, saying goodbye to wives and children, could barely raise a smile. Young men, not long out of school, not needing to shave much, were laughing and joking, full of bravado. I suspected they didn´t feel as brave as they wanted to look. Twelve months later, I caught up with Dmytro and Maxsym in the cold winter sun back at the volunteer centre. ""Well, actually there was a lot of fear,"" Dmytro admitted. ""I´m not going to lie because I hadn´t experienced anything like that before. There were a lot of pessimistic news and we were preparing for the worst. And it was mostly like a mixture of bravery… and in our guts we felt that not everything will be all right.""Image source, BBC/Jeremy BowenImage caption, Maxsym (left) and Dmytro (right) were students when they volunteered as recruits to fight for their countryMaxsym agreed, and many Ukrainians to whom I´ve spoken had the same sort of thoughts. ""A year ago, we had a lot of fear in our hearts and even in our brains. We understood that it will be pretty dangerous to became soldiers, to try to fight with guns. But we also had courage and we had some stupid bravery, and it helped us to overcome our fear.  ""We understood that it will be very bad for us to stay in some shelters, not act in the battle. And it will be bad for us if Russians would occupy Kyiv or other territories of Ukraine. They would kill us or put us in prison because of our political views.""They were not joining a winning army. The Americans and their allies were expecting a rapid Russian victory, followed by an insurgency that they were preparing to support. Their attitudes changed rapidly after Ukraine had shown how well it could fight with old Soviet-era weapons and a sprinkling of modern ones that Nato had supplied. Since then, Nato, led by the United States, has steadily broken its self-imposed limits on what it will supply. Main battle tanks are the latest upgrade. Ukraine wants modern warplanes next.  This video can not be playedTo play this video you need to enable JavaScript in your browser.Media caption, Watch: One year of war in Ukraine in 87 secondsDmytro sat in the cold sun outside the volunteer centre, marvelling at the change. ""The Russians have made their biggest mistake…  Everyone knows their enemy now. And not only it´s national unity, but it´s international unity… And it´s like someone told me two years ago that the United Kingdom, United States, all the European leaders will help us, and it´s the world, Ukraine will be spoken in every television news, I wouldn´t have imagined that."" The conflict forced the North Atlantic alliance to face up to the reality of a sharp and dangerous new division in Europe. The relationship with Moscow that had been under increasing strain for more than a decade snapped when President Putin ordered the invasion last February.With Ukraine, its people and Europe propelled into a new and dangerous era, the continent has come full circle from the hopeful years that followed the end of the Cold War. In 1989, six months before the Berlin Wall was toppled, the first President George Bush laid out the dream of a ""Europe whole and free"". It does not feel like that on the front lines in Donbas. But Kyiv today is a city transformed from the shuttered, apprehensive place it was in the first few weeks after the invasion. Snow swirled around the crowds that packed the platforms at the main railway station. Wind that felt as if it had come off the coldest part of the steppe cut into thousands of women and children, about to become refugees, who were pushing to get onto trains heading west, away from the Russians. Being there felt like watching a re-run of old newsreels from the 20th Century´s darkest times. Barriers were blocking roads, welders were making tank traps from steel girders, and thousands of bottles were being filled with petrol to make Molotov cocktails to throw at the Russian tanks everyone expected. At the moment, the capital has a veneer of normality. Shops are open, people with money can go to restaurants, and there is a rush hour. Of course, it is not normal, because the country is at war, and by mid-evening the streets are quiet. Image source, BBC/Jeremy BowenImage caption, Maxsym Lutsyk (left) and Dmytro Kisilenko (right) believe Russia has made its biggest mistakeThe contrast between Kyiv and the battered front line towns in the war zones in the east and south is huge. Dmytro and Maxsym fought in the battle that forced a Russian retreat at the end of March. Since then, the pressure has mostly been off the capital, compared to the nightmarish months since the Russian focus turned to the Donbas and the approaches to the Crimean Peninsula in the south.  Maxsym and Dmytro are volunteers, and as students they are allowed to claim an exemption from compulsory military service. Under pressure from his family, Dmytro decided after the Russian withdrawal from Kyiv to go back to university. Now he volunteers to help with supplies for Maxsym and his other former comrades. ""It was a really hard decision. But when all your battle buddies, or when all your comrades are going to the east, they continue, they are like away, and you just left this community, you feel a bit odd."" His decision does not seem to have affected their friendship. Maxsym stayed with their unit, and in the months since then has been in some of the heaviest fighting of the war, in the battles in Donbas. He looks noticeably older and is more assertive. I saw him in Bakhmut in the summer, as the Russians were starting to attack it. He had driven out of nearby Severodonetsk to get supplies for his unit. He went back that day, and not long before the town fell to the Russians, Maxsym was wounded.  Image source, BBC/Jeremy BowenImage caption, In May last year, three months after volunteering, Maxsym met the BBC in BakhmutIt was, he said, his worst moment of the war. His position was hit by a strike from Russian heavy artillery, a 203mm Pion. His commander, who received Ukraine´s highest award for valour, was killed. Maxsym was knocked cold and had severe concussion. The Ukrainian forces, outnumbered and outgunned, had to retreat across a river.  ""The Russians destroyed all the bridges, doing intelligence to find places where we are crossing the river and they shelled these places. So staying there for longer period of time was possible, but many guys died there. And if we stayed for a longer period, many more guys would have died in a few weeks.""Maxsym believes that Russian soldiers arrived in Ukraine a year ago swallowing Kremlin propaganda that they would be welcomed as liberators and protectors of Russian speakers. The last year of fighting, he says, on battlegrounds like Severodonetsk and Bakhmut, has wiped out any Russian illusions about what it would take to beat Ukraine. They understand, he said, that they don´t have friends waiting for them. ""They know that they will enter Bakhmut city only when they will destroy it, when they will kill every Ukrainian soldier who is defending it… They understand that they are fighting for territories and for some political reasons of their government.""Ukrainian soldiers who have served in the east do not have illusions either about an easy victory. The Russians have taken huge casualties. But they are still fighting, have capable electronic warfare and air defence systems and kill and wound many Ukrainians. The Kremlin´s appetite for a war of attrition has not slackened. Image source, EPAImage caption, Russian forces have spent months trying to capture the Ukrainian city of BakhmutDmytro and Maxsym see victory the same way as President Volodymyr Zelensky. Every piece of Ukraine needs to be recaptured. Nato has massively increased its support. But giving Ukraine decisive combat power carries too many risks, in American minds especially. A time may come when Ukraine´s allies push for negotiations.Dmytro was firm. ""Every inch of Ukrainian land which were recognized as Ukrainian in 1991 should be Ukrainian."" President Vladimir Putin believes Ukraine belongs to Russia. Ironically, the war he started is building the Ukrainian nation. ""We have a joke,"" Maxsym said. ""Putin will be made a hero of Ukraine for the job he´s done to unite Ukraine, to build our economy, to build our army, and to make the Ukrainian nation great.""Dmytro laughed. ""But yeah, the war is horrible, but it´s like the price for our unity and our country.""Related TopicsRussia-Ukraine warKyivRussiaUkraine",https://www.bbc.co.uk/news/world-europe-64733014,24,2,2023,"['ukraine', 'maxsym', 'war', 'dmytro', 'ukrainian', 'russians', 'months', 'jeremy', 'kyiv', 'russia', 'bowenimage', 'left', 'felt', 'fear', 'fight', 'cold', 'image', 'battle', 'president', 'fighting']",0.3953377986842554,0.022531785799502334,24/2/2023
Russia fires new waves of missiles at Ukraine and hits energy infrastructure - BBC News,"Russia fires new waves of missiles at Ukraine and hits energy infrastructure - BBC NewsBBC HomepageSkip to contentAccessibility HelpYour accountHomeNewsSportReelWorklifeTravelFutureMore menuMore menuSearch BBCHomeNewsSportReelWorklifeTravelFutureCultureMusicTVWeatherSoundsClose menuBBC NewsMenuHomeWar in UkraineCoronavirusClimateVideoWorldUKBusinessTechScienceMoreStoriesEntertainment & ArtsHealthWorld News TVIn PicturesReality CheckNewsbeatLong ReadsWorldAfricaAsiaAustraliaEuropeLatin AmericaMiddle EastUS & CanadaRussia fires new waves of missiles at Ukraine and hits energy infrastructurePublished15 JanuaryShareclose panelShare pageCopy linkAbout sharingRelated TopicsRussia-Ukraine warThis video can not be playedTo play this video you need to enable JavaScript in your browser.Media caption, Aftermath of missile strike in DniproBy Paul Adams in Dnipro and Alexandra Fouché in LondonBBC NewsRussia launched fresh waves of missile attacks across Ukraine on Saturday, killing at least 20 people in a strike on an apartment block in the eastern city of Dnipro.  A number of other cities, including Kyiv, Kharkiv and Odesa, were also hit.Much of Ukraine is now under an emergency blackout after missiles hit power infrastructure in several cities. Earlier, the UK said it would send Challenger 2 tanks to Ukraine to help the country´s defence.UK Prime Minister Rishi Sunak said the Challengers, the British army´s main battle tank, would help Kyiv´s forces ""push Russian troops back"".Russia responded by saying that providing more weapons to Ukraine would lead to intensified Russian operations and more civilian casualties.Later on Saturday - a day when Ukrainians celebrate the Old (or Orthodox) New Year - Ukrainian President Volodymyr Zelensky said Russian attacks on civilian targets could be stopped only if Ukraine´s Western partners supplied necessary weapons.""What is needed for this? Those weapons which are in the depots of our partners and which our soldiers are waiting for so much,"" he said in his nightly video address, adding that his forces shot down more than 20 out of 30 Russian missiles fired at Ukraine. Image source, STR/EPA-EFE/REX/ShutterstockImage caption, Rescue teams work in the rubble of the damaged residential building hit by shelling in DniproThe devastating strike in Dnipro hit the entrance of a nine-storey building, turning several floors into smouldering rubble, and leaving 73 injured, including 14 children, Ukrainian officials said, in what is likely to be the worst attack in months.A sizeable crowd gathered to watch the rescue effort at the site of the strike, while others joined rescue workers in a desperate search for survivors. There were urgent calls, human chains of volunteers clearing rubble and torch beams piercing thick clouds of dust and smoke.  In his address, Mr Zelensky said debris clearance in Dnipro would continue all night: ""We are fighting for every person, every life."" So far, 38 people have been rescued from the building, including six children, officials say.There is no information yet on why the apartment block was the object of such devastation, as it is some distance from the nearest power facility. On a day when Russia seemed intent, once again, on targeting Ukraine´s energy grid, this could have been one of the less accurate missiles in Russia´s arsenal, or something brought down by Ukraine´s air defences - although on the face of it, this seems a less likely explanation. It has been two weeks since the last wave of Russian attacks on Ukraine´s power grid. Mr Zelensky said of the energy infrastructure facilities hit on Saturday that the most difficult situation was in the Kharkiv and Kyiv regions.Ukrainian state energy company Ukrenergo earlier said round-the-clock consumption limits had been set for all regions until midnight local time.Officials, in the West and in Ukraine, had begun to wonder if Russia´s ""energy war"" might be coming to an end, due to a possible shortage of suitable missiles and the evident fact the strategy has yet to break Ukraine´s spirit. Saturday´s attacks suggest Moscow still thinks it is a tactic worth pursuing. Related TopicsRussia-Ukraine warVolodymyr ZelenskyRussiaUkraine",https://www.bbc.co.uk/news/world-europe-64278733,15,1,2023,"['ukraine', 'missiles', 'energy', 'russia', 'hit', 'strike', 'dnipro', 'attacks', 'saturday', 'waves', 'infrastructure', 'including', 'kyiv', 'power', 'weapons', 'ukrainian', 'zelensky', 'rescue', 'rubble', 'building']",0.41829570211923145,-0.00036640918993859317,15/1/2023
