title,article,link,day,month,year,word,subjetivity,polarity,date
Lviv buildings destroyed by Russian missile strike - BBC News,"Lviv buildings destroyed by Russian missile strike - BBC NewsBBC HomepageSkip to contentAccessibility HelpYour accountHomeNewsSportReelWorklifeTravelFutureMore menuMore menuSearch BBCHomeNewsSportReelWorklifeTravelFutureCultureMusicTVWeatherSoundsClose menuBBC NewsMenuHomeWar in UkraineCoronavirusClimateVideoWorldUKBusinessTechScienceMoreStoriesEntertainment & ArtsHealthWorld News TVIn PicturesReality CheckNewsbeatLong ReadsWorldAfricaAsiaAustraliaEuropeLatin AmericaMiddle EastUS & CanadaLviv buildings destroyed by Russian missile strikeThis video can not be playedTo play this video you need to enable JavaScript in your browser.Lviv buildings destroyed by Russian missile strikeCloseDrone footage released by a Ukrainian official reportedly shows the damage caused a Russian missile strike on Lviv.Governor Maksym Kozytskyy shared the footage on Telegram, and said five were killed in the Zolochiv district of the city.The BBC obtained this footage through the news agency Reuters, which has been unable to verify the location or the date it was taken.Published2 days agoSectionBBC NewsSubsectionEuropeShareclose panelShare pageCopy linkAbout sharingRead descriptionExplore moreDrone footage shows Lviv debris after Russian strike. Video, 00:00:23Drone footage shows Lviv debris after Russian strikePublished2 days agoSubsectionEurope0:23Up Next. WATCH: One year of war in Ukraine in 87 seconds. Video, 00:01:27WATCH: One year of war in Ukraine in 87 secondsPublished23 FebruarySubsectionEuropeUp Next1:27Russian minister laughed at for Ukraine war claims. Video, 00:00:35Russian minister laughed at for Ukraine war claimsPublished7 days agoSubsectionEurope0:35Latvian MP swears at Russia during protest walkout. Video, 00:00:32Latvian MP swears at Russia during protest walkoutPublished23 FebruarySubsectionEurope0:32Russia interrupts UN minute´s silence for Ukraine. Video, 00:01:06Russia interrupts UN minute´s silence for UkrainePublished24 FebruarySubsectionEurope1:06Editor´s recommendationsThe Lineker tweet row - in 90 seconds. Video, 00:01:29The Lineker tweet row - in 90 secondsPublished21 hours agoSubsectionUK1:29Video appears to show Hamburg suspect firing through window. Video, 00:01:18Video appears to show Hamburg suspect firing through windowPublished1 day agoSubsectionEurope1:18Watch: On the ground at Israel´s mass protests. Video, 00:01:04Watch: On the ground at Israel´s mass protestsPublished1 day agoSubsectionMiddle East1:04Sliding cars and snowball fights amid Spring flurry. Video, 00:00:41Sliding cars and snowball fights amid Spring flurryPublished1 day agoSubsectionUK0:41Tearful Marine describes Afghan withdrawal ´catastrophe´ Video, 00:02:31Tearful Marine describes Afghan withdrawal ´catastrophe´Published2 days agoSubsectionUS & Canada2:31Watch: China´s leader and his two teacup power move. Video, 00:00:59Watch: China´s leader and his two teacup power movePublished2 days agoSubsectionChina0:59One-minute World News. Video, 00:01:01One-minute World NewsPublished7 hours agoSectionBBC News1:01What you need to know on Eurovision UK entry in 61 seconds. Video, 00:01:01What you need to know on Eurovision UK entry in 61 secondsPublished2 days agoSubsectionEntertainment & Arts1:01The ex-RAF base used in WWII that could house migrants. Video, 00:00:47The ex-RAF base used in WWII that could house migrantsPublished3 days agoSubsectionEngland0:47Rare ´snow tornado´ spotted by Shetland crofter. Video, 00:00:36Rare ´snow tornado´ spotted by Shetland crofterPublished2 days agoSubsectionScotland0:36HomeNewsSportReelWorklifeTravelFutureCultureMusicTVWeatherSoundsTerms of UseAbout the BBCPrivacy PolicyCookiesAccessibility HelpParental GuidanceContact the BBCGet Personalised NewslettersWhy you can trust the BBCAdvertise with usAdChoices / Do Not Sell My Info© 2023 BBC. The BBC is not responsible for the content of external sites. Read about our approach to external linking",https://www.bbc.co.uk/news/world-europe-64899292,9,3,2023,"['days', 'watch', 'lviv', 'footage', 'ukraine', 'missile', 'war', 'russia', 'minute', 'buildings', 'destroyed', 'strike', 'shows', 'agosubsectioneurope', 'seconds', 'secondspublished', 'day', 'agosectionbbc', 'debris', 'minister']",0.22812500000000002,-0.06250000000000001,9/3/2023
MH17: Human rights court will hear Netherlands case against Russia - BBC News,"MH17: Human rights court will hear Netherlands case against Russia - BBC NewsBBC HomepageSkip to contentAccessibility HelpYour accountHomeNewsSportReelWorklifeTravelFutureMore menuMore menuSearch BBCHomeNewsSportReelWorklifeTravelFutureCultureMusicTVWeatherSoundsClose menuBBC NewsMenuHomeWar in UkraineCoronavirusClimateVideoWorldUKBusinessTechScienceMoreStoriesEntertainment & ArtsHealthWorld News TVIn PicturesReality CheckNewsbeatLong ReadsWorldAfricaAsiaAustraliaEuropeLatin AmericaMiddle EastUS & CanadaMH17: Human rights court will hear Netherlands case against RussiaPublished25 JanuaryShareclose panelShare pageCopy linkAbout sharingRelated TopicsMH17 plane crashImage source, ReutersImage caption, The wreckage of MH17 was painstakingly reassembled in the Netherlands and later inspected as part of the trialBy Anna Holligan in The Hague and Laura Gozzi in LondonBBC NewsThe European Court of Human Rights has confirmed it will hear a Dutch case against Russia over the downing of flight MH17 in 2014.All 298 people on the Malaysia Airlines flight from Amsterdam were killed when it was shot down by a missile fired by Moscow-backed Ukrainian separatists.The Dutch government argues that Russia´s disinformation about Moscow´s role in the incident is a violation of the relatives´ human rights. Russia denies the allegations.The Boeing 777 was flying from the Dutch capital to Kuala Lumpur when it was hit by a Russian-made surface-to-air missile in July 2014 during a conflict between pro-Russia rebels and Ukrainian forces in the Donbas region of Ukraine. The Netherlands argues that Russia played a key role in the air disaster and the case hinges on whether or not Moscow had ""effective control"" over the area of Ukraine where the missile was fired from.At this stage, the ECHR´s decision is only procedural and does not rule on the merits of the case, but it shows the court believes Russia can be held accountable for the human rights violations in the regions of Luhansk and Donetsk.It could be years before a ruling is issued, but if the ECHR issues a guilty verdict against Russia, Moscow could be obliged to pay damages to the victims´ relatives. Last September, Russia stopped being party to the European Convention on Human Rights, but the court can still deal with claims against Russia regarding actions up until that date.In November, a Dutch court at the Schiphol Judicial Complex found three men - two Russians and a Ukrainian - guilty of murder in absentia for their part in the downing of MH17. The court concluded that the missile had been fired deliberately to bring down a plane, even if the target had been military rather than civilian.The three men were sentenced to life in jail but are all thought to be in Russia. Since Moscow condemned the verdict as scandalous and politically motivated it is extremely unlikely that they will be handed over to face justice.Russia has repeatedly denied involvement in the attack. Related TopicsRussiaMH17 plane crash2014 Ukraine conflictNetherlands",https://www.bbc.co.uk/news/world-europe-64395406,25,1,2023,"['russia', 'court', 'human', 'rights', 'case', 'moscow', 'mh', 'netherlands', 'dutch', 'missile', 'hear', 'plane', 'fired', 'ukrainian', 'ukraine', 'part', 'european', 'downing', 'flight', 'argues']",0.3417777777777777,-0.06044444444444445,25/1/2023
New US sanctions for Russia on war anniversary - BBC News,"New US sanctions for Russia on war anniversary - BBC NewsBBC HomepageSkip to contentAccessibility HelpYour accountHomeNewsSportReelWorklifeTravelFutureMore menuMore menuSearch BBCHomeNewsSportReelWorklifeTravelFutureCultureMusicTVWeatherSoundsClose menuBBC NewsMenuHomeWar in UkraineCoronavirusClimateVideoWorldUKBusinessTechScienceMoreStoriesEntertainment & ArtsHealthWorld News TVIn PicturesReality CheckNewsbeatLong ReadsWorldAfricaAsiaAustraliaEuropeLatin AmericaMiddle EastUS & CanadaNew US sanctions for Russia on war anniversaryPublished24 FebruaryShareclose panelShare pageCopy linkAbout sharingRelated TopicsRussia-Ukraine warThis video can not be playedTo play this video you need to enable JavaScript in your browser.Media caption, Watch: One year of war in Ukraine in 87 secondsBy Antoinette Radford and Sam CabralBBC NewsThe US has marked a year since Russia invaded Ukraine by announcing a new range of sanctions against Russia and new military aid for Ukraine.The latest restrictions target more than 100 entities both within Russia and worldwide, including banks and suppliers of defence equipment.Specifically, the US said it wants to stop those helping Russia exploit loopholes to get sanctioned materials. The White House´s fresh round of aid for Ukraine is worth $2bn (£1.7bn).A further $550m (£459m) will be supplied to both Ukraine and neighbouring Moldova to strengthen their energy infrastructure.""One year on, the commitment of the United States, together with some 50 countries who have rallied to rush urgently needed assistance to Ukraine, has only strengthened,"" the Department of Defense said.Just how much money is the US spending on Ukraine?Moldova warns of Russian ´psy-ops´ as tensions riseIn a press release, the White House said the new measures were designed to disrupt Russian financial institutions, officials and authorities from ""illegitimately operating in Ukraine"".It comes four days after US President Joe Biden made a surprise visit to Kyiv, where he held talks with his Ukrainian counterpart, Volodymyr Zelensky. In its latest round of aid, the US government is providing Ukraine with new drone systems, high-mobility rocket systems, ammunition for artillery systems and communications gear. Earlier this week the US said China was considering supplying lethal weapons to Russia. They also claimed Chinese firms had already been supplying non-lethal dual-use technology - items which could have both civilian and military uses, such as drones and semi-conductors.China has strongly denied the allegations.Why China launched a charm offensive over UkraineA meeting of G7 leaders was held on Friday, where they created an enforcement team designed to stop Russia from finding sanctions loopholes.""G7 countries will continue to keep Russia´s sovereign assets immobilised until there is a resolution to the conflict"", the group said in a press release.The G7 - group of seven - is an organisation of the world´s seven largest ""advanced"" economies. They are Canada, France, Germany, Italy, Japan, the UK and the United States. It has so far committed $39b (£32b) to Ukraine´s war efforts for 2023. The US said G7 countries and allies would also impose sanctions on key economic sectors in Russia - including its metals and mining sector.""Our actions today with our G7 partners show that we will stand with Ukraine for as long as it takes,"" Treasury Secretary Janet Yellen said.The US added that it would provide Ukraine with electrical grid equipment to protect its energy supply from Russian strikes, and with generators to provide back-up power. The White House will provide Moldova, which borders Ukraine and heavily relies on Russian gas, with $300m (£250m) to help increase its local power generation.Moldova is Europe´s poorest country and has been heavily impacted by the war. Its leaders have warned for several weeks that Russia is plotting to seize power. Related TopicsRussia-Ukraine warUnited StatesUkraineRussia sanctionsG7",https://www.bbc.co.uk/news/world-us-canada-64756425,24,2,2023,"['ukraine', 'russia', 'sanctions', 'war', 'moldova', 'aid', 'white', 'house', 'countries', 'systems', 'china', 'provide', 'power', 'military', 'latest', 'including', 'equipment', 'stop', 'loopholes', 'round']",0.3635624538063562,0.08207686622320767,24/2/2023
Russia to cut oil production over price caps - BBC News,"Russia to cut oil production over price caps - BBC NewsBBC HomepageSkip to contentAccessibility HelpYour accountHomeNewsSportReelWorklifeTravelFutureMore menuMore menuSearch BBCHomeNewsSportReelWorklifeTravelFutureCultureMusicTVWeatherSoundsClose menuBBC NewsMenuHomeWar in UkraineCoronavirusClimateVideoWorldUKBusinessTechScienceMoreStoriesEntertainment & ArtsHealthWorld News TVIn PicturesReality CheckNewsbeatLong ReadsBusinessMarket DataNew EconomyNew Tech EconomyCompaniesTechnology of BusinessEconomyCEO SecretsGlobal TradeCost of LivingRussia to cut oil production over price capsPublished10 FebruarycommentsCommentsShareclose panelShare pageCopy linkAbout sharingRelated TopicsRussia-Ukraine warImage source, Getty ImagesRussia will reduce crude oil production by 500,000 barrels per day from March after major economies imposed a price cap on oil products. Oil prices rose after Russia´s deputy prime minister Alexander Novak announced the cut. The European Union, G7 nations and Australia have capped how much they will pay for oil and refined products.These are part of western sanctions designed to put pressure on Russia over its war in Ukraine.Russia is one of the largest oil producers in the world. Its planned cuts sent the price of Brent crude, the international benchmark for oil prices, up by 2.2% to $86 per barrel.Western countries have been introducing tougher oil sanctions on Russia as its invasion of Ukraine continues, as part of efforts to limit the Kremlin´s gain from sales and reduce its ability to finance the war.Most recently, an EU ban on seaborne imports from Russia of refined oil products, such as diesel, came into force this week. Traders who do not comply with these sanctions have access to tanker fleets and insurance markets restricted.In the case of the oil price cap, countries stopped the use of Western-supplied maritime insurance, finance and brokering for seaborne Russian oil priced above $60 per barrel from 5 December.In response, Russia has banned any deals involving the cap. Mr Novak said: ""As of today, we are fully selling the entire volume of oil produced, however, as stated earlier, we will not sell oil to those who directly or indirectly adhere to the principles of the ´price cap´.""In this regard, Russia will voluntarily reduce production by 500,000 barrels per day in March. This will contribute to the restoration of market relations.""So far, according to Mr Novak, Russia has been able to find buyers for all of its output, despite the sanctions.Industry sources told the BBC that hundreds of tankers have been acquired by companies in recent weeks, creating a so-called ""dark fleet"" prepared to carry Russian crude at higher prices. The last big fall in Russian oil output was in April last year, when it collapsed by nearly 9% following the introduction of Western sanctions over Ukraine.But since then, Russia has managed to set up logistics chains for its oil sales, mostly in Asia. Last year, Russian oil production rose by 2% to 10.7 million barrels per day.Related TopicsRussia-Ukraine warRussiaOilFuel",https://www.bbc.co.uk/news/business-64594715,10,2,2023,"['oil', 'russia', 'price', 'production', 'ukraine', 'sanctions', 'cap', 'western', 'cut', 'reduce', 'crude', 'barrels', 'day', 'products', 'prices', 'novak', 'rose', 'refined', 'part', 'war']",0.36406249999999996,0.020703125000000003,10/2/2023
Ukraine war: Russia fires hypersonic missiles in new barrage - BBC News,"Ukraine war: Russia fires hypersonic missiles in new barrage - BBC NewsBBC HomepageSkip to contentAccessibility HelpYour accountHomeNewsSportReelWorklifeTravelFutureMore menuMore menuSearch BBCHomeNewsSportReelWorklifeTravelFutureCultureMusicTVWeatherSoundsClose menuBBC NewsMenuHomeWar in UkraineCoronavirusClimateVideoWorldUKBusinessTechScienceMoreStoriesEntertainment & ArtsHealthWorld News TVIn PicturesReality CheckNewsbeatLong ReadsWorldAfricaAsiaAustraliaEuropeLatin AmericaMiddle EastUS & CanadaUkraine war: Russia fires hypersonic missiles in new barragePublished2 days agoShareclose panelShare pageCopy linkAbout sharingRelated TopicsRussia-Ukraine warThis video can not be playedTo play this video you need to enable JavaScript in your browser.Media caption, Watch: Wave of Russian strikes leaves destruction across UkraineBy Henri AstierBBC NewsAt least nine people have died in a new wave of strikes across Ukraine in which Russia used powerful weapons, including rare hypersonic missiles.Russia had reportedly not fired Kinzhal hypersonic missiles - which can evade air defences - since the early months of the conflict.The latest barrage was the most severe to hit Ukraine for weeks.It cut power to the Zaporizhzhia nuclear plant - Europe´s biggest - although it was later restored.On Thursday Russian defence ministry spokesman Igor Konashenkov said: ""High-precision long-range air, sea and land-based weapons, including the Kinzhal hypersonic missile system, hit key elements of Ukraine´s military infrastructure.""It was the biggest day of Russian strikes on Ukraine since the end of January,The Ukrainian military claimed it had successfully shot down 34 cruise missiles and four Iranian-made Shahed drones.But it also said it had been unable to intercept the six Kinzhal ballistic missiles - nor was it able to destroy older weapons, such as Kh-22 anti-ship missiles and S-300 anti-aircraft missiles.""This was a major attack and for the first time with so many different types of missiles,"" the Reuters news agency quoted a Ukrainian air force spokesperson as saying. ""It was like never before.""President Vladimir Putin has highlighted Russia´s investment in ballistic hypersonic missiles, which can travel at more than five times the speed of sound.How risky is stand-off over Ukraine´s nuclear plant?Ukraine in maps: Tracking the war with RussiaNuclear energy operator Energoatom said the strike at the Zaporizhzhia plant had cut off the link between the facility and the Ukrainian power system. For the sixth time since it was taken over by Russia a year ago, the facility operated on diesel generators until the link was restored later on Thursday.Electricity is needed for cooling radioactive material present at the plant. ""Today´s loss of all external power once again demonstrated how fragile and dangerous the situation is for the Zaporizhzhya Nuclear Power Plant,"" said Rafael Grossi, the head of the International Atomic Energy Agency (IAEA).Earlier on Thursday he had called for an international commitment to protect the plant, following a series of strikes since the invasion began.""Each time we are rolling a dice. And if we allow this to continue time after time then one day our luck will run out,"" Mr Grossi said.In the capital Kyiv, emergency services attended the scenes of blasts in western and southern districts.A missile also hit an energy facility in the port city of Odesa, triggering power cuts, its governor Maksym Marchenko said. Residential areas were also hit but no casualties were reported.Elsewhere, Ukraine´s military says it has pushed back intense Russian attacks on the embattled eastern city of Bakhmut despite Russian forces claiming to have taken control of its eastern half.Moscow has been trying to take Bakhmut for months, as both sides suffer heavy losses in a grinding war of attrition.""The enemy continued its attacks and has shown no sign of a let-up in storming the city of Bakhmut,"" the general staff of the Ukrainian armed forces said. ""Our defenders repelled attacks on Bakhmut and on surrounding communities.""Between 20,000 and 30,000 Russian troops have been killed or wounded in the battle for the Ukrainian city of Bakhmut since it began last summer, Western officials say. The figures cannot be verified independently.Related TopicsRussia-Ukraine warKyivRussiaZaporizhzhia nuclear power plantUkraine",https://www.bbc.co.uk/news/world-europe-64903202,9,3,2023,"['ukraine', 'missiles', 'russia', 'hypersonic', 'power', 'plant', 'ukrainian', 'bakhmut', 'war', 'strikes', 'hit', 'nuclear', 'city', 'weapons', 'kinzhal', 'air', 'thursday', 'military', 'energy', 'facility']",0.325731807874665,0.053728612657184066,9/3/2023
