title,article,link,day,month,year,word,subjetivity,polarity,date
Petrol below £1.50 a litre for first time since Russia invaded Ukraine - BBC News,"Petrol below £1.50 a litre for first time since Russia invaded Ukraine - BBC NewsBBC HomepageSkip to contentAccessibility HelpYour accountHomeNewsSportReelWorklifeTravelFutureMore menuMore menuSearch BBCHomeNewsSportReelWorklifeTravelFutureCultureMusicTVWeatherSoundsClose menuBBC NewsMenuHomeWar in UkraineCoronavirusClimateVideoWorldUKBusinessTechScienceMoreStoriesEntertainment & ArtsHealthWorld News TVIn PicturesReality CheckNewsbeatLong ReadsBusinessMarket DataNew EconomyNew Tech EconomyCompaniesTechnology of BusinessEconomyCEO SecretsGlobal TradeCost of LivingPetrol below £1.50 a litre for first time since Russia invaded UkrainePublished10 JanuarycommentsCommentsShareclose panelShare pageCopy linkAbout sharingImage source, Getty ImagesBy Katy Austin & Faarea MasudTransport correspondentAverage petrol prices have fallen below 150p a litre for the first time since Russia invaded Ukraine, the AA motoring group says. Pump prices hit 149.74p per litre on Monday, lower than last February and down from a record 191.53p in July.The AA said falling global oil prices were behind the drop, calling it ""a huge relief for drivers"".But it said diesel still cost more than last year at 172.21p a litre compared with 153.05p. AA spokesman Luke Bosdet said it now cost about £23 less to fill an average-sized 55-litre car with petrol than it did in July, at roughly £82.However, he said petrol prices were ""still historically way above"" what they should be and that the end of a temporary fuel duty cut this March could lead to fresh rises. Petrol stations in cities and towns are also charging up to 10p more for fuel than those in rural parts of the UK, he added. Filling a diesel car now costs a record £100Petrol prices drop from record highsFuel prices began to rise last year as countries ended Covid lockdowns but surged higher when Russia - a major oil producer - invaded Ukraine, sparking concerns about global supplies. By July last year, the cost of filling an average-sized car had hit £105.29, according to the RAC motoring group, while for diesel it was £109.47.The government has cut fuel duty by 5p a litre since February last year to help drivers, with the overall cut worth 6p when VAT is factored in, the AA says. However, the discount is scheduled to end in March. David Cox, an independent energy analyst, told the BBC that concerns over global oil supplies had subsided as countries had found alternatives to Russian crude, sending prices lower. However, he warned oil prices were likely to rise again as China eased its strict Covid rules and fully reopened its economy. ""I think the outlook [for oil and petrol prices] is it will go back up. We´re in for a prolonged period of higher prices.""Rising electric car costsThe news comes as the RAC said the cost of rapid-charging an electric car using a public charging network had increased by about 50% in the past eight months.It now costs an average of 70.32p per kilowatt hour to rapid charge on a pay-as-you-go basis, up from 44.55p last May and from 63.29p last September, the motoring group said.The rises - which are being driven by increasing energy costs - mean that drivers now pay £36 to charge a typical family-sized electric car with a 64kWh battery to the level required to cover around 188 miles, it said. However, it added that those who charged at home were still getting ""great value"", paying about half as much.  The RAC´s electric vehicles spokesman, Simon Williams, said cutting the level of VAT on electricity sold at public chargers to 5% to match what people pay at home would be one way of keeping prices under control.""It continues to be the case that those who can charge at home or at work and who don´t use the public rapid charging network very often get fantastic value - even given the relatively high domestic energy prices right now. ""Sadly, the same can´t be said for people who either can´t charge at home or at work, or who regularly make longer journeys beyond the range of their cars. There´s no question they have to pay far more, and in some cases more than petrol or diesel drivers do to fill up on a mile-for-mile basis.""Related TopicsCost of livingEfficient energy useFuel",https://www.bbc.co.uk/news/business-64222643,10,1,2023,"['prices', 'petrol', 'litre', 'car', 'oil', 'russia', 'invaded', 'aa', 'drivers', 'diesel', 'cost', 'charging', 'energy', 'electric', 'charge', 'pay', 'home', 'ukraine', 'motoring', 'group']",0.3364741447636184,0.04895015316067949,10/1/2023
Latvian MP swears at Russia in Ukraine protest walkout - BBC News,"Latvian MP swears at Russia in Ukraine protest walkout - BBC NewsBBC HomepageSkip to contentAccessibility HelpYour accountHomeNewsSportReelWorklifeTravelFutureMore menuMore menuSearch BBCHomeNewsSportReelWorklifeTravelFutureCultureMusicTVWeatherSoundsClose menuBBC NewsMenuHomeWar in UkraineCoronavirusClimateVideoWorldUKBusinessTechScienceMoreStoriesEntertainment & ArtsHealthWorld News TVIn PicturesReality CheckNewsbeatLong ReadsWorldAfricaAsiaAustraliaEuropeLatin AmericaMiddle EastUS & CanadaLatvian MP swears at Russia in Ukraine protest walkoutThis video can not be playedTo play this video you need to enable JavaScript in your browser.Latvian MP swears at Russia in Ukraine protest walkoutCloseLatvian MP Rihards Kols swore at the Russian delegate at a parliamentary session of the European security body in Vienna.During a meeting at the Organization for Security and Co-operation in Europe (OSCE), there was a mass walkout after a Russian representative was given the floor to speak.Published23 FebruarySectionBBC NewsSubsectionEuropeShareclose panelShare pageCopy linkAbout sharingRead descriptionExplore moreLatvian MP swears at Russia during protest walkout. Video, 00:00:32Latvian MP swears at Russia during protest walkoutPublished23 FebruarySubsectionEurope0:32Up Next. Putin and Biden´s speeches compared in under a minute. Video, 00:00:53Putin and Biden´s speeches compared in under a minutePublished21 FebruarySubsectionEuropeUp Next0:53Battle for the city of Bakhmut intensifies. Video, 00:00:45Battle for the city of Bakhmut intensifiesPublished12 FebruarySubsectionEurope0:45Watch: The Christmas ceasefire that never happened. Video, 00:01:17Watch: The Christmas ceasefire that never happenedPublished8 JanuarySubsectionEurope1:17Putin won´t surrender easily, says US diplomat. Video, 00:01:50Putin won´t surrender easily, says US diplomatPublished22 FebruarySubsectionUS & Canada1:50Editor´s recommendationsThe Lineker tweet row - in 90 seconds. Video, 00:01:29The Lineker tweet row - in 90 secondsPublished21 hours agoSubsectionUK1:29Video appears to show Hamburg suspect firing through window. Video, 00:01:18Video appears to show Hamburg suspect firing through windowPublished1 day agoSubsectionEurope1:18Watch: On the ground at Israel´s mass protests. Video, 00:01:04Watch: On the ground at Israel´s mass protestsPublished1 day agoSubsectionMiddle East1:04Sliding cars and snowball fights amid Spring flurry. Video, 00:00:41Sliding cars and snowball fights amid Spring flurryPublished1 day agoSubsectionUK0:41Tearful Marine describes Afghan withdrawal ´catastrophe´ Video, 00:02:31Tearful Marine describes Afghan withdrawal ´catastrophe´Published2 days agoSubsectionUS & Canada2:31Watch: China´s leader and his two teacup power move. Video, 00:00:59Watch: China´s leader and his two teacup power movePublished2 days agoSubsectionChina0:59One-minute World News. Video, 00:01:01One-minute World NewsPublished7 hours agoSectionBBC News1:01What you need to know on Eurovision UK entry in 61 seconds. Video, 00:01:01What you need to know on Eurovision UK entry in 61 secondsPublished2 days agoSubsectionEntertainment & Arts1:01The ex-RAF base used in WWII that could house migrants. Video, 00:00:47The ex-RAF base used in WWII that could house migrantsPublished3 days agoSubsectionEngland0:47Rare ´snow tornado´ spotted by Shetland crofter. Video, 00:00:36Rare ´snow tornado´ spotted by Shetland crofterPublished2 days agoSubsectionScotland0:36HomeNewsSportReelWorklifeTravelFutureCultureMusicTVWeatherSoundsTerms of UseAbout the BBCPrivacy PolicyCookiesAccessibility HelpParental GuidanceContact the BBCGet Personalised NewslettersWhy you can trust the BBCAdvertise with usAdChoices / Do Not Sell My Info© 2023 BBC. The BBC is not responsible for the content of external sites. Read about our approach to external linking",https://www.bbc.co.uk/news/world-europe-64752483,23,2,2023,"['mp', 'watch', 'swears', 'russia', 'protest', 'days', 'putin', 'latvian', 'ukraine', 'walkout', 'mass', 'minute', 'day', 'security', 'februarysubsectioneurope', 'biden', 'speeches', 'compared', 'battle', 'city']",0.40151515151515144,-0.07575757575757576,23/2/2023
Belarus opposition says it damaged Russian warplane - BBC News,"Belarus opposition says it damaged Russian warplane - BBC NewsBBC HomepageSkip to contentAccessibility HelpYour accountHomeNewsSportReelWorklifeTravelFutureMore menuMore menuSearch BBCHomeNewsSportReelWorklifeTravelFutureCultureMusicTVWeatherSoundsClose menuBBC NewsMenuHomeWar in UkraineCoronavirusClimateVideoWorldUKBusinessTechScienceMoreStoriesEntertainment & ArtsHealthWorld News TVIn PicturesReality CheckNewsbeatLong ReadsWorldAfricaAsiaAustraliaEuropeLatin AmericaMiddle EastUS & CanadaBelarus opposition says it damaged Russian warplanePublished27 FebruaryShareclose panelShare pageCopy linkAbout sharingRelated TopicsRussia-Ukraine warImage source, Getty ImagesImage caption, A Beriev A-50 early warning plane over Moscow (June 2020)By Antoinette RadfordBBC NewsExiled Belarusian opposition figures say a Russian military plane has been damaged in a drone attack near the capital, Minsk. Aliksandr Azarov, leader of Belarusian anti-government organisation BYPOL, claimed responsibility for the attack on Telegram.The Beriev A-50 early warning aircraft was struck by multiple blasts near the Machulishchy airbase.It comes amid increased cooperation between Minsk and Moscow. The strikes damaged front and central parts of the aircraft as well as its radar and antenna, BYPOL said on Telegram.""These were drones. The participants of the operation are Belarusian"", Mr Azarov said.Speaking to the BBC, Franak Viacorka, an adviser to Belarusian opposition leader, said the attack was ""creative"" and ""sophisticated"".""It was very brave because Belarusians are in a situation of the total terror"", he told BBC News. He added that the opposition party was ""definitely helped by locals, helped by military"" to cause damage to the plane.However, it is not possible to confirm the opposition´s account of what happened. Belarus leader: We´ll join Russia in war if attackedBelarus country profile Both the Russian and Belarusian departments of defence are yet to publicly comment on the incident. Separately, a prominent pro-Kremlin channel, Tsargrad TV, confirmed a drone attack on the airbase, but blamed it on the Ukrainian military. It also reported damage to the A-50, but did not give specific details.A Russian air defence expert, Yuri Knutov, told the channel that for some reason the airbase had not been protected by Russian Pantsir anti-aircraft missiles. He described the A-50 as an airborne command centre used for directing Russian air strikes.BYPOL, the Belarusian group that has claimed responsibility for the strike on the aircraft, consists of former law enforcement officers now opposed to President Alexander Lukashenko´s office. It has been listed as a terrorist organisation by Mr Lukashenko´s government. While Belarus has not directly become involved in the war in Ukraine, Mr Lukashenko allowed Russian troops to launch into Ukraine through Belarus.The two countries have also been participating in joint military training exercises over recent months. Related TopicsRussia-Ukraine warBelarusRussiaAlexander Lukashenko",https://www.bbc.co.uk/news/world-europe-64782626,27,2,2023,"['opposition', 'belarusian', 'belarus', 'damaged', 'ukraine', 'military', 'attack', 'aircraft', 'lukashenko', 'plane', 'leader', 'bypol', 'airbase', 'beriev', 'early', 'warning', 'moscow', 'drone', 'minsk', 'azarov']",0.3294270833333333,0.08906249999999999,27/2/2023
Ukraine war: Russia's Wagner Group commander requests Norway asylum - BBC News,"Ukraine war: Russia´s Wagner Group commander requests Norway asylum - BBC NewsBBC HomepageSkip to contentAccessibility HelpYour accountHomeNewsSportReelWorklifeTravelFutureMore menuMore menuSearch BBCHomeNewsSportReelWorklifeTravelFutureCultureMusicTVWeatherSoundsClose menuBBC NewsMenuHomeWar in UkraineCoronavirusClimateVideoWorldUKBusinessTechScienceMoreStoriesEntertainment & ArtsHealthWorld News TVIn PicturesReality CheckNewsbeatLong ReadsWorldAfricaAsiaAustraliaEuropeLatin AmericaMiddle EastUS & CanadaUkraine war: Russia´s Wagner Group commander requests Norway asylumPublished16 JanuaryShareclose panelShare pageCopy linkAbout sharingRelated TopicsRussia-Ukraine warImage source, Gulagu.netImage caption, Andrey Medvedev in uniform before defecting from WagnerBy Matt MurphyBBC NewsA former commander with the Russian paramilitary Wagner Group has claimed asylum in Norway after deserting from the mercenary outfit. Andrey Medvedev, 26, crossed the border into Norway last Friday, where he was detained by border guards. He is currently being held in the Oslo area where he faces charges of illegal entry to Norway, his lawyer Brynjulf Risnes told the BBC.Mr Risnes said his client left Wagner after witnessing war crimes in Ukraine. The Norwegian Border Guard confirmed to the BBC that a Russian man had been detained after crossing the country´s 198km (123 mile) long border with Russia, but said it could not comment further for ""reasons of security and privacy"". Tarjei Sirma-Tellefsen, police chief of staff in the Norwegian region of Finnmark, said a man had been detained by a border patrol and said he had applied for asylum. But the Russian human rights group Gulagu.net, who helped Mr Medvedev leave Russia, confirmed his identity. His escape is believed to be the first known instance of one of the group´s soldiers defecting to the West. Gulagu.net´s founder Vladimir Osechkin told the BBC that Mr Medvedev had joined the paramilitary group in July 2022 on a four-month contract, but had deserted after witnessing a host of human rights abuses and war crimes while serving in Ukraine. He said that Mr Medvedev is a former soldier in the Russian army and that he later served time in prison between 2017 and 2018 before joining the Wagner Group. He was placed in charge of a Wagner division in Ukraine, where the mercenary group supplied him with around 30-40 troops every week, Mr Osechkin said. In a video posted by Gulagu.net to its social media channels, Mr Medvedev said he fled Ukraine in November after being informed that the group intended to extend his contract indefinitely.What is Russia´s Wagner Group of mercenaries?Ukraine battle hints at rift in pro-Russian forcesAfter spending two months underground in Russia, he crossed the border into Norway last week. Mr Risnes said his client had also witnessed a host of war crimes while fighting in Ukraine, including seeing ""deserters being executed"" by the Wagner Group´s internal security service. ""In short he felt betrayed and wanted to leave as soon as possible,"" Mr Risnes said. He added that he believed Mr Medvedev had taken some evidence of war crimes with him to Norway and that he intends to share his information with groups investigating war crimes in the coming weeks. In response, the founder of the Wagner Group, Yevgeny Prigozhin, appeared to laugh off the allegations.In a press release from one of his companies, Prigozhin issued a sarcastic statement, linking Mr Medvedev to a non-existent Nordic mercenary unit and said he was a Norwegian citizen, in an apparent attempt to mock the man´s testimony.Prigozhin also accused him of ""mistreatment of prisoners"" and said that his former employee was ""very dangerous"". Mr Risnes told the BBC that the Wagner leader´s claims were not true. UK officials believe the Wagner Group makes up about 10% of Russia´s forces in Ukraine, and played a significant part in helping Moscow´s forces take the town of Soledar in eastern Donbas region last week. Thousands of its troops have been recruited from Russian prisons. Mr Prigozhin - a former convict himself - has promised recruits their freedom in exchange for six months service in Ukraine. Before the invasion of Ukraine, it had only a few thousand mercenaries. Most were believed to be experienced former soldiers, including some from Russia´s elite regiments and special forces.Since 2015, it is believed to have deployed troops to Syria, Libya, Mali and the Central African Republic. Related TopicsRussia-Ukraine warRussiaUkraine",https://www.bbc.co.uk/news/world-europe-64296979,16,1,2023,"['group', 'ukraine', 'wagner', 'russia', 'medvedev', 'war', 'norway', 'border', 'risnes', 'crimes', 'gulagu', 'believed', 'prigozhin', 'commander', 'asylum', 'mercenary', 'detained', 'norwegian', 'man', 'net']",0.2976984126984127,0.04134391534391535,16/1/2023
"Ukraine war: Russia must be defeated but not crushed, Macron says - BBC News","Ukraine war: Russia must be defeated but not crushed, Macron says - BBC NewsBBC HomepageSkip to contentAccessibility HelpYour accountHomeNewsSportReelWorklifeTravelFutureMore menuMore menuSearch BBCHomeNewsSportReelWorklifeTravelFutureCultureMusicTVWeatherSoundsClose menuBBC NewsMenuHomeWar in UkraineCoronavirusClimateVideoWorldUKBusinessTechScienceMoreStoriesEntertainment & ArtsHealthWorld News TVIn PicturesReality CheckNewsbeatLong ReadsUKEnglandN. IrelandScotlandWalesIsle of ManGuernseyJerseyPoliticsLocal NewsUkraine war: Russia must be defeated but not crushed, Macron saysPublished19 FebruaryShareclose panelShare pageCopy linkAbout sharingRelated TopicsRussia-Ukraine warImage source, EPAImage caption, In a speech to world leaders, Emmanuel Macron did not shy away from mentioning Russia-Ukraine peace talks as a final goalBy Phelan Chatterjee & Matt MurphyBBC NewsFrench President Emmanuel Macron has said he does not want to see Russia crushed by a defeat in Ukraine. Speaking to French media, Mr Macron urged Western nations to increase military support for Kyiv and said he was prepared for a protracted war.""I want Russia to be defeated in Ukraine, and I want Ukraine to be able to defend its position,"" he said.But he hit out against those who he said wanted to extend the war to Russia itself in a bid to ""crush"" the nation.The comments came as world leaders gathered at the Munich Security Conference, which saw promises to speed up the supply of weapons to Kyiv and impose tougher sanctions on Moscow.""I do not think, as some people do, that we must aim for a total defeat of Russia, attacking Russia on its own soil,"" Mr Macron told the paper Le Journal du Dimanche.""Those observers want to, above all else, crush Russia. That has never been the position of France and it will never be our position."" Addressing the conference in Munich on Friday, Mr Macron insisted that now was not the time for dialogue with Moscow.But he did not shy away from mentioning peace talks as a final goal.The president suggested that Ukrainian military efforts, supported by allies, were the only way to ""bring Russia back to the table and build a lasting peace"".He also dismissed the prospect of regime change in Russia, describing similar efforts around the world as a ""total failure"".Despite Mr Macron´s comments, negotiations are a faraway prospect for Ukraine´s leaders.On Friday, Foreign Minister Dmytro Kuleba welcomed the decision to not invite Moscow to the Munich conference.Russian leaders should not be invited to the table as long as the ""terrorist state kills, as long as it uses bombs, missiles and tanks as an argument for international politics"", he said.President Volodymyr Zelensky has ruled out immediate talks with his Russian counterpart, Vladimir Putin, insisting there was ""no trust"" between the parties. In an interview with the BBC earlier this week, he also dismissed the idea of giving up territory to strike a peace deal with Moscow.Mr Macron has previously been criticised by some Nato allies for sending what they believe are mixed messages on Ukraine.Last June, he was condemned by Mr Kuleba for saying it was vital that Russia was not ""humiliated over its invasion"".Mr Kuleba at the time responded that Russia - which was ""humiliating itself"" - needed to be put in its place.Related TopicsRussia-Ukraine warFranceVolodymyr ZelenskyRussiaEmmanuel MacronVladimir Putin",https://www.bbc.co.uk/news/uk-64693691,19,2,2023,"['russia', 'ukraine', 'macron', 'war', 'leaders', 'peace', 'moscow', 'defeated', 'crushed', 'talks', 'president', 'position', 'munich', 'conference', 'kuleba', 'emmanuel', 'shy', 'mentioning', 'final', 'defeat']",0.35555555555555557,0.026388888888888885,19/2/2023
