title,article,link,day,month,year
Profile: Gu Ailing: I'm not trying to keep everyone happy - People's Daily Online,"Profile: Gu Ailing: I'm not trying to keep everyone happy (Xinhua) 11:11, February 09, 2022BEIJING, Feb. 9 (Xinhua) -- Adding an Olympic gold in the maiden freeski big air event to eight World Cup victories and two world championship titles, Gu Ailing lived up to her pre-Games billing as one of the biggest stars of the Beijing Winter Olympics.Yet, besides her talent, what really sets the 18-year-old apart from most of her fellow Olympians at Beijing 2022 is her intricate connections to both China and the United States.Born in California, Unite States in 2003 to an American father and a Chinese mother, Gu started skiing when she was just ""a little pink ball of a toddler."" ""While other kids were busy crying and screaming, I'd already move on,"" Gu recalled.Ever since then, Gu started to sweep youth competitions and made rapid progress - the same upward trajectory as every single talented athlete has had.Gu seemed to have the wind at her back until 2019 when she announced to change her nationality from the USA to China, which triggered a wave of criticism from some western media.""I have decided to compete for China in the upcoming 2022 Winter Olympics. This was an incredibly tough decision for me to make... The opportunity to help inspire millions of young people where my mom was born, during the 2022 Beijing Olympic Winter Games is a once-in-a-lifetime opportunity to help to promote the sport I love,"" she wrote on social media.Despite discussions and even unpleasant comments about her decision, Gu had not been affected but gradually became a phenom stunning enough to create envy out of everywhere.This sentiment reached the peak when Gu claimed the historic Olympic gold with a 1620 performance she had never done before in the women´s freeski big air.When everyone thought she would settle for a podium finish before the third and final run, Gu made a phone call to her mom on top of the Big Air Shougang, asking if she should drop in her signature trick of double cork 1440 to secure a silver medal.But then she decided to ""whip out this random trick I'd never done before and go for gold.""""You have the final say. This is your race. I hope you enjoy,"" said her mom on the phone.With a deep breath, Gu slid down the ramp and shot herself into the air.One rotation, two, three, four... and another half - Gu stomped a left-side double cork 1620 with a safety grab to become the second female athlete ever to land the trick after Tess Ledeux.With a race-high 94.50 points, Gu jumped to first with a tiny lead of 0.75 points on Ledeux.As Ledeux failed to improve on her score with a flaw on the landing, Gu secured her biggest victory by far following her success at the Youth Olympic Games in 2020 and the World Cup this season.These girls expressed gratitude to each other after the race.""It is just a dream come true,"" said Ledeux. ""The level of competition was so strong and I am just so proud to be part of the podium.""""She [Ailing] has killed it today,"" the French girl admitted.""We are going through the emotions at the end,"" said Gu. ""I won because of them, because they had inspired me so much and made me who I am. I just wanted to express my gratitude. We are all out here to do this together.""""Lots of respect between these girls,"" said Mathilde Gremaud who took the bronze. ""Ailing and Tess are really strong and motivating. They are pushing me and I hope to be pushing them.""While the press conference could have been focused on the competition itself and the chemistry among the skiers, Gu faced questions regarding her nationality and identity, the answers to which showed why she could become one of the biggest names at Beijing 2022.""I'm not trying to keep everyone happy,"" she said. ""I'm an 18-year-old girl out here living my best life and having a great time. It doesn't really matter if other people are happy or not.""""I am doing my best. I'm enjoying the entire process and using my voice to create as much positive change I can for the voices who will listen to me in an area that is personal and relevant to myself.""""And in that sense, I'm not going to waste my time trying to placate people who are uneducated and probably are never going to experience the kind of joy, gratitude and love that I have the great fortune to experience on a daily basis.""""If people don't believe me and if people don't like me, then that´s their loss. They're never going win the Olympics.""Spending at least two months in China each year since she was two, Gu speaks fluent Mandarin with a Beijing accent. Peking duck and dumplings are her favorite foods.Gu´s natural and intimate bond with Beijing and her love for China and Chinese culture didn't appear to downplay the attention on her identity. But for herself, Gu has been very outspoken about her gratitude to both of the countries for making her the person who she is today.""My mission is to use sport as a force for unity, to use it as a former to foster interconnection between countries and not use it as a device of force. That benefits everyone,"" Gu said. ",http://english.people.com.cn/n3/2022/0209/c90000-9955282.html,09,2,2022
Ohio residents experience various symptoms after toxic train derailment: USA Today - People's Daily Online,"Ohio residents experience various symptoms after toxic train derailment: USA Today (Xinhua) 08:33, March 09, 2023Workers drain contaminated water on the site of the Feb. 3 derailment on the outskirts of the village of East Palestine, Ohio, the United States, on Feb. 14, 2023. (Photo by Phil Zhang/Xinhua)Nearly three-quarters, or 74 percent, of the participants, said they had experienced headaches since the derailment.NEW YORK, March 8 (Xinhua) -- Health assessment surveys from East Palestine, Ohio, have shown that the most common symptoms experienced by residents since last month´s toxic train derailment include headaches, coughing and anxiety, reported USA Today on Monday.Other common symptoms reported by residents were fatigue and irritation, pain, or burning of their skin, according to a statement from Ohio Governor Mike DeWine´s office.The findings of the survey, conducted by the Ohio Department of Health and the U.S. Department of Health and Human Services, were released last week.The ""After Chemical Exposure (ACE) Community"" survey was completed by 168 people who in the last two weeks have either gone to the state´s health assessment clinic or have been visited at home by federal officials. The median age of those surveyed was 57 and nearly all respondents are older than 18.Nearly three-quarters, or 74 percent, of the participants, said they had experienced headaches since the derailment. Six in ten reported coughing, and just over half said they had experienced irritation, pain, or burning of their skin. In addition, of the 168 respondents, 64 percent reported feeling anxiety and 58 percent said they felt fatigue or tiredness.DeWine´s office said that officials will use the information to ""better understand how the derailment incident may be impacting residents and determine appropriate public health response.""According to DeWine´s office, water sample results from private water systems of East Palestine homes ""continue to show no harmful levels of contaminants,"" and hazardous waste removal from the derailment is ongoing.On Tuesday, the U.S. National Transportation Safety Board announced ""a special investigation"" of Norfolk Southern Railway´s organization and safety culture, more than a month after the company´s freight train carrying hazardous materials derailed in East Palestine.",http://english.people.com.cn/n3/2023/0309/c90000-10219117.html,09,3,2023
U.S. Ski &Snowboard head coach Peter Foley accused of sexual misconduct - People's Daily Online,"U.S. Ski &Snowboard head coach Peter Foley accused of sexual misconduct (Xinhua) 12:58, February 12, 2022CHONGLI, Zhangjiakou, Feb. 12 (Xinhua) -- United States Ski &Snowboard has reportedly opened an investigation on allegations of sexual misconduct and inappropriate behavior on the U.S. snowboard team involving current head coach Peter Foley.The investigation came after Callan Chythlook-Sifsof, who competed for the U.S. in the 2010 Winter Olympics, wrote on social media that ""Peter Foley has taken naked photos of female athletes for over a decade.""According to USA Today, U.S. Ski &Snowboard spokesman Tom Horrocks said the organization is ""aware of the recent allegations"" against Foley.Foley, who is coaching at the Beijing 2022 Olympic Winter Games, has not responded or commented on the allegations publicly as the mixed snowboard cross competition takes place on Saturday. ",http://english.people.com.cn/n3/2022/0212/c90000-9956945.html,12,2,2022
"U.S. Black people far more likely to be shot, killed by police: article - People's Daily Online","U.S. Black people far more likely to be shot, killed by police: article (Xinhua) 13:30, March 07, 2023People walk on the frozen Lincoln Memorial Reflecting Pool in Washington, D.C., the United States, on Dec. 25, 2022. (Xinhua/Liu Jie)This is not to say that all who work in law enforcement are racist, but it suggests there is a deadly racial problem.NEW YORK, March 6 (Xinhua) -- In the 1,000 days since the murder of Black man George Floyd on May 25, 2020 in Minnesota, 618 Black folks have been shot and killed by U.S. police nationwide, according to an article published last week by The Daily Record, a Ohio-based daily newspaper and part of the USA Today Media Network.On average, police in the United States shoot and kill more than 1,000 people every year. Although half of the people shot and killed by police are White, Black Americans are shot at a disproportionate rate. They account for roughly 14 percent of the U.S. population and are killed by police at more than twice the rate of White Americans, according to a recent report of The Washington Post.""I have to think a lot of people wonder why this is still going on. What is the point? Quite simply, the problem of racial injustice is still huge,"" said the opinion piece.""This is not to say that all who work in law enforcement are racist, but it suggests there is a deadly racial problem,"" it said.This issue goes beyond policing. In health care, Black patients are assumed to have higher pain tolerance causing them to receive substandard care. Black Americans have a lower life expectancy, higher blood pressure and more instances of mental health strain such as anxiety, depression and stress due to living in a society that sees them as less than, according to the article.""While holding a sign doesn't immediately fix the problem, that, along with working with organizations like the NAACP and getting involved in local government, helps to bring about a better, more equitable world for all who live in it,"" said the article.",http://english.people.com.cn/n3/2023/0307/c90000-10217943.html,07,3,2023
Canada downs USA to regain crown in Olympic women's ice hockey - People's Daily Online,"Canada downs USA to regain crown in Olympic women´s ice hockey (Xinhua) 07:42, February 18, 2022Athletes of Canada and the United States compete during the ice hockey women´s gold medal game of Beijing 2022 Winter Olympics between Canada and the United States at Wukesong Sports Centre in Beijing, capital of China, Feb. 17, 2022. (Xinhua/Du Yu)BEIJING, Feb.17 (Xinhua) -- Canadian women´s ice hockey team took down the defending champion the United States 3-2 in the final to get their fifth Olympic title at the Beijing Winter Olympics on Thursday.Canada was hungry for revenge after a 3-2 shootout defeat to the U.S. in the final of the PyeongChang Winter Olympics in 2018 and they beat the Americans 4-2 in the preliminary round in Beijing.Canadian forward Sarah Nurse scored at 7:50, which was her fifth goal in Beijing, and 30-year-old captain Marie-Philip Poulin of Canada put the puck into the net at 15:02 to widen the lead to 2-0 in the first period.Poulin became the only hockey player, female or male, to score in four Olympic gold medal games after she scored in the finals in Vancouver 2010, Sochi 2014 and PyeongChang 2018.Poulin scored her sixth goal in Beijing at 29:08, before 32-year-old American forward Hilary Knight threw the puck into the net at 36:39 to cut the deficit to 3-1, which was the 2018 Olympic gold medalist´s sixth goal in Beijing.American forward Amanda Kessel scored their last goal at 59:47 in power play.The red Maple Leaf set a new scoring record of 57 goals in seven games in the Winter Olympics.Canada and the U.S. have won all the seven gold medals since the women´s ice hockey tournament entered Winter Olympics programme in 1998.The Canadians won the four games in the preliminary round and rolled over Sweden and Switzerland in the quarterfinals and semifinals respectively.The Americans had a 3-1 win-loss record in the preliminary round and took down the Czech Republic and Finland in the quarterfinals and semifinals to book a rematch against Canada in the final. Sarah Fillier (R) of Canada competes during the ice hockey women´s gold medal game of Beijing 2022 Winter Olympics between Canada and the United States at Wukesong Sports Centre in Beijing, capital of China, Feb. 17, 2022. (Xinhua/Li Ran)Goalkeeper Alex Cavallini of the United States tries to make a save during the ice hockey women´s gold medal game of Beijing 2022 Winter Olympics between Canada and the United States at Wukesong Sports Centre in Beijing, capital of China, Feb. 17, 2022. (Xinhua/Li An)Goalkeeper Alex Cavallini of the United States tries to make a save during the ice hockey women´s gold medal game of Beijing 2022 Winter Olympics between Canada and the United States at Wukesong Sports Centre in Beijing, capital of China, Feb. 17, 2022. (Xinhua/Li Ran)Abby Roque (L, top) of the United States shoots during the ice hockey women´s gold medal game of Beijing 2022 Winter Olympics between Canada and the United States at Wukesong Sports Centre in Beijing, capital of China, Feb. 17, 2022. (Xinhua/Li Ran)Jocelyne Larocque (R) of Canada competes during the ice hockey women´s gold medal game of Beijing 2022 Winter Olympics between Canada and the United States at Wukesong Sports Centre in Beijing, capital of China, Feb. 17, 2022. (Xinhua/Meng Yongmin)Jamie Lee Rattray (L) of Canada vies with Savannah Harmon of the United States during the ice hockey women´s gold medal game of Beijing 2022 Winter Olympics between Canada and the United States at Wukesong Sports Centre in Beijing, capital of China, Feb. 17, 2022. (Xinhua/Meng Yongmin)Athletes of Canada pose for photos during the awarding ceremony for the women´s ice hockey of Beijing 2022 Winter Olympics at Wukesong Sports Centre in Beijing, capital of China, Feb. 17, 2022. (Xinhua/Huang Zongzhi)Athletes of Canada celebrate during the awarding ceremony for the women´s ice hockey of Beijing 2022 Winter Olympics at Wukesong Sports Centre in Beijing, capital of China, Feb. 17, 2022. (Xinhua/Du Yu)Team Canada pose for photos during the awarding ceremony for the women´s ice hockey of Beijing 2022 Winter Olympics at Wukesong Sports Centre in Beijing, capital of China, Feb. 17, 2022. (Xinhua/Meng Yongmin)Team Canada attend the awarding ceremony for the women´s ice hockey of Beijing 2022 Winter Olympics at Wukesong Sports Centre in Beijing, capital of China, Feb. 17, 2022. (Xinhua/Meng Yongmin)Team Canada attend the awarding ceremony for the women´s ice hockey of Beijing 2022 Winter Olympics at Wukesong Sports Centre in Beijing, capital of China, Feb. 17, 2022. (Xinhua/Meng Yongmin)Team Finland attend the awarding ceremony for the women´s ice hockey of Beijing 2022 Winter Olympics at Wukesong Sports Centre in Beijing, capital of China, Feb. 17, 2022. (Xinhua/Meng Yongmin)Team USA attend the awarding ceremony for the women´s ice hockey of Beijing 2022 Winter Olympics at Wukesong Sports Centre in Beijing, capital of China, Feb. 17, 2022. (Xinhua/Meng Yongmin)Team Canada pose for photos during the awarding ceremony for the women´s ice hockey of Beijing 2022 Winter Olympics at Wukesong Sports Centre in Beijing, capital of China, Feb. 17, 2022. (Xinhua/Meng Yongmin)",http://english.people.com.cn/n3/2022/0218/c90000-9959556.html,18,2,2022
California works to rescue residents trapped by snow - People's Daily Online,"California works to rescue residents trapped by snow (Xinhua) 13:10, March 09, 2023Vehicles are seen along a road with the snow-covered mountains as the background in Southern California´s San Bernardino County, the United States, March 2, 2023. (Xinhua)California Governor Gavin Newsom declared a state of emergency in 13 counties last week, after brutal winter storms trapped residents with feet of snow, including in the hard-hit San Bernardino County.LOS ANGELES, March 8 (Xinhua) -- Search crews in California, the most populous state of the United States, are working to rescue residents stranded in the state´s mountain communities by recent heavy snow.After the latest round of winter weather, the average water equivalent in the snowpack covering California´s mountains ranges from 40 to 46 inches, almost double what the area typically sees this time of year, according to USA Today reports.California Governor Gavin Newsom declared a state of emergency in 13 counties last week, after brutal winter storms trapped residents with feet of snow, including in the hard-hit San Bernardino County.The heavy snowfall combined with high wind gusts have prompted avalanche warnings across parts of the central and southern Sierra Nevada.Officials knew the San Bernardino County mountains were going to be hit by a bad storm days before an unprecedented blizzard rolled in, but they found themselves unprepared for the historic amount of snow and the disruptions it would bring, said a report of Los Angeles Times.Forecasters said more snow and rain are expected to arrive in Northern California later this week, followed by potential flood concerns.",http://english.people.com.cn/n3/2023/0309/c90000-10219368.html,09,3,2023
Finland wins women's ice hockey bronze after beating Switzerland at Beijing 2022 - People's Daily Online,"Finland wins women´s ice hockey bronze after beating Switzerland at Beijing 2022 (Xinhua) 07:55, February 17, 2022Athletes of Finland celebrate after winning the ice hockey women´s bronze medal game of Beijing 2022 Winter Olympics at Wukesong Sports Centre in Beijing, Feb. 16, 2022. (Xinhua/Li Ran)Finland claimed its fourth Olympic bronze medal in the women´s ice hockey following a 4-0 victory over Switzerland.BEIJING, Feb. 16 (Xinhua) -- Women´s ice hockey giant Finland won the Olympic bronze medal at Beijing 2022 after defeating Switzerland 4-0 on Wednesday.Goals from Susanna Tapani, Nelli Laitinen and Michelle Karvinen in the third period, together with Viivi Vainikka´s opener in the first, give Finland their fourth Olympic bronze medal in the women´s ice hockey.""It feels really good, amazing,"" said Finland captain Jenni Hiirikoski, who got her third Olympic bronze medal in Beijing. ""Obviously, today Switzerland also played really well, and they made it really tough for us.""""We have some amazing athletes on this team,"" said Finland head coach Jusso Toivola. ""4-0 is a great result.""Elisa Holopainen (R) of Finland controls the puck during the ice hockey women´s bronze medal game of Beijing 2022 Winter Olympics. (Xinhua/Wang Jianwei)Finland showed great efficiency on power play in previous matches, and so did they in Wednesday´s bronze medal match. The Finns had four power play chances during the match, and made two goals out of them.Finland outshot the Swiss 13-5 in the first period. Vainikka hit the puck into the net on 11 minutes 38 seconds to award the Nordic side 1-0 lead.Both teams fought hard but the second period turned out to be goalless. Finland kept playing aggressively on the offensive side, leading 34-9 on shooting attempts in the first two periods.At the beginning of the final period, Tapani made full use of a turnover, beating Swiss defense through a fast-break attack to extend the advantage to 2-0. It was the sixth goal for the 28-year-old veteran at the 2022 Olympics.Michelle Karvinen (R) of Finland shoots to score during the ice hockey women´s bronze medal game of Beijing 2022 Winter Olympics. (Xinhua/Wang Jianwei)Switzerland had to put more attention on the offensive side, only to see Laitinen and Karvinen score to seal the victory.Switzerland beat Finland 3-2 last week in Group A match. However, Finland emerged as the better team on Wednesday.The gold-medal game between the USA and Canada will be contested on Thursday. ",http://english.people.com.cn/n3/2022/0217/c90000-9958996.html,17,2,2022
American Jackson wins women's 500m speed skating gold at Beijing 2022  - People's Daily Online,"American Jackson wins women´s 500m speed skating gold at Beijing 2022  (Xinhua) 08:37, February 14, 2022Erin Jackson of the United States poses after speed skating women´s 500m at the National Speed Skating Oval in Beijing, capital of China, Feb. 13, 2022. (Xinhua/Wang Jianwei)BEIJING, Feb. 13 (Xinhua) -- Erin Jackson of the United States notched the gold medal in the women´s 500m speed skating at the Beijing Winter Olympics here on Sunday.The 29-year-old clocked a winning time of 37.04 seconds to become the first American speed skater since 1994 to win the Olympic gold in the women´s 500m.""I wish I could describe how I feel. It is amazing. This medal means so much,"" said Jackson, who would miss the Beijing Games but for her friend Brittany Bowe.Bowe sacrificed her No.1 spot in 500m to Jackson who had slipped and finished third in the U.S. Olympic trials where top two finishers secured tickets to Beijing.Bowe, the 1,000m and 1,500m specialist, was able to compete over the distance along with Jackson with an additional quota given to Team USA in reallocation, and finished 16th eventually.""It has been a tough couple of years and a tough beginning for this year. For this to come around like this I am so happy,"" Jackson said.Miho Takagi of Japan grabbed the silver in 37.12 seconds, while Angelina Golikova of the Russian Olympic Committee finished third in 37.21 seconds.Also on Sunday, the men´s team pursuit quarterfinals saw Norway, the United States, the Russian Olympic Committee and the Netherlands advance into the semifinals. Canada and South Korea advance to Final C while Italy and China advance to Final D. Erin Jackson of the United States poses after speed skating women´s 500m at the National Speed Skating Oval in Beijing, capital of China, Feb. 13, 2022. (Xinhua/Wang Jianwei)Erin Jackson (C) of the United States, Takagi Miho (L) of Japan and Angelina Golikova of ROC pose after speed skating women´s 500m at the National Speed Skating Oval in Beijing, capital of China, Feb. 13, 2022. (Xinhua/Wang Jianwei)Erin Jackson of the United States poses after speed skating women´s 500m at the National Speed Skating Oval in Beijing, capital of China, Feb. 13, 2022. (Xinhua/Ding Xu)Erin Jackson of the United States celebrates after winning speed skating women´s 500m at the National Speed Skating Oval in Beijing, capital of China, Feb. 13, 2022. (Xinhua/Ding Xu)Erin Jackson of the United States reacts after speed skating women´s 500m at the National Speed Skating Oval in Beijing, capital of China, Feb. 13, 2022. (Xinhua/Ding Xu)Erin Jackson of the United States celebrates after winning speed skating women´s 500m at the National Speed Skating Oval in Beijing, capital of China, Feb. 13, 2022. (Xinhua/Wang Fei)Erin Jackson of the United States celebrates after winning speed skating women´s 500m at the National Speed Skating Oval in Beijing, capital of China, Feb. 13, 2022. (Xinhua/Wang Fei)Erin Jackson of the United States reacts after speed skating women´s 500m at the National Speed Skating Oval in Beijing, capital of China, Feb. 13, 2022. (Xinhua/Ding Xu)Erin Jackson of the United States reacts after speed skating women´s 500m at the National Speed Skating Oval in Beijing, capital of China, Feb. 13, 2022. (Xinhua/Ding Xu)Erin Jackson of the United States poses after speed skating women´s 500m at the National Speed Skating Oval in Beijing, capital of China, Feb. 13, 2022. (Xinhua/Wang Jianwei)Takagi Miho of Japan celebrates after speed skating women´s 500m at the National Speed Skating Oval in Beijing, capital of China, Feb. 13, 2022. (Xinhua/Ding Xu)Takagi Miho of Japan competes during speed skating women´s 500m at the National Speed Skating Oval in Beijing, capital of China, Feb. 13, 2022. (Xinhua/Wang Jianwei)",http://english.people.com.cn/n3/2022/0214/c90000-9957308.html,14,2,2022
