title,article,link,day,month,year
Explainer: What Chinese modernization would mean for the world? - People's Daily Online,"Explainer: What Chinese modernization would mean for the world? (Xinhua) 11:01, March 11, 2023-- ""China´s path to modernization reflects Chinese wisdom, Chinese civilization and history,"" said Keith Bennett, a long-term China specialist and vice chair of Britain´s 48 Group Club.-- China always keeps the world´s development and peace in mind in its modernization process. That is because Beijing fully understands that it will do well only if the world does well, and vice versa.-- The Chinese path to modernization serves as an ""example"" for developing countries, especially African countries, when they have been confronted with multiple crises that hinder their development in recent years, General Secretary of the Congolese Labor Party Pierre Moussa has said.BEIJING, March 10 (Xinhua) -- For a long time in history, the world was shrouded in the myth that modernization equals Westernization. The emergence of Chinese modernization dispels it, making modernization no longer a single-choice question, but a multiple-choice one.For the world, China´s task to modernize a country of 1.4 billion people, or nearly one-fifth of the global population, is unprecedented. The Herculean pursuit not only captures global attention, but also has global ramifications.Among a series of concepts and initiatives that China promotes in both state governance and global interactions, the Chinese path to modernization is the most popular keyword that people would like to know more about, according to an overseas survey conducted by Xinhua News Agency recently.WHAT ARE DIFFERENCES BETWEEN CHINESE AND WESTERN MODERNIZATION?China´s path to modernization is one of peace and development, win-win cooperation, and harmony between humanity and nature, rather than external expansion and plundering.""China´s path to modernization reflects Chinese wisdom, Chinese civilization and history,"" said Keith Bennett, a long-term China specialist and vice chair of Britain´s 48 Group Club.""The modernization of a small number of Western countries was based on the exploitation, oppression and colonization of almost the entire world. China is not developing by exploiting any other country; China is developing itself and modernizing itself, and at the same time helping other countries to develop and modernize,"" he said.China does not seek to exploit or control other nations, and it plays no role in inciting conflicts, said Mokhtar Gobashy, deputy chairman of the Cairo-based Arab Center for Political and Strategic Studies, adding that´s why China has gained respect and popularity in the Arab world.Meanwhile, Chinese modernization emphasizes both material and cultural-ethical advancement, which distinguishes it from Western modernization, said Chen Gang, assistant director of the East Asian Institute of the National University of Singapore.The coordination of material and cultural-ethical advancement leads the way to realize all-around material abundance as well as people´s well-rounded development, Chen said.WHAT CHINESE MODERNIZATION CAN OFFER FOR THE WORLD?China stands in the world as the second-largest economy and a responsible major country. It always keeps the world´s development and peace in mind in its modernization process. That is because Beijing fully understands that it will do well only if the world does well, and vice versa.Firstly, China is committed to making the world less poor and more equitable.By the end of 2020, China had lifted out of poverty all rural residents living below the current poverty line and met the poverty eradication target set out in the 2030 Agenda for Sustainable Development 10 years ahead of schedule.Commenting on China´s poverty reduction drive, UN Secretary-General Antonio Guterres said those achievements are ""the biggest contribution for dramatical reduction of poverty.""More than eradicating absolute poverty, Chinese modernization promotes common prosperity, thereby shrinking the enormous wealth gap and inequality that have risen in tandem with Western modernization.British scholar and political commentator Martin Jacques highlighted China´s pursuit of common prosperity, lamenting how Western countries have never taken it seriously.""For China to embrace common prosperity, to establish a society of greater fairness, greater equity, that is a very important message not only to China, Chinese people but to the world as well,"" he said.China, on its way toward modernization, has also been sharing its development dividends with the rest of the world.Take the Belt and Road Initiative (BRI). According to a World Bank forecast, if all Belt and Road transport infrastructure projects are carried out, the initiative would generate 1.6 trillion U.S. dollars of global revenues annually to 2030. Up to 90 percent of the revenues would go to partner countries.""The most important thing about the BRI is that developing nations could benefit from the great experience in the development of China. BRI gives them the opportunity to create an industrial society and join the modern age. This is something that in the long run would bode well for the future of humanity,"" said Khairy Tourk, professor of economics with the Stuart School of Business at the Illinois Institute of Technology in Chicago.Secondly, China is committed to making the world greener and more biodiverse.China ranks first globally in the area of planted forests and forest coverage growth, contributing a quarter of the world´s new forest area in the past decade.From 2012 to 2021, China´s carbon dioxide emissions per unit of GDP declined by 34.4 percent, and energy consumption per unit of GDP decreased by 26.4 percent, equivalent to saving of 1.4 billion tons of standard coal.So far, China has also emerged as a major proponent of renewable energy, and it is working hard to capitalize on the potential of a green BRI.UNFCCC (the United Nations Framework Convention on Climate Change) Executive Secretary Simon Stiell spoke highly of China´s firm and consistent stance on actively addressing climate change, as well as its efforts to translate climate commitments into concrete actions.At a time when the world is facing an energy crisis, China continues to make solid progress in dealing with climate change and plays an important role in advancing the global response to climate change, Stiell said.Meanwhile, under China´s presidency, the 15th meeting of the Conference of the Parties (COP15) to the UN Convention on Biological Diversity has adopted the global biodiversity framework ahead of schedule. China has shown leadership in global biodiversity protection, Inger Andersen, executive director of the United Nations Environment Programme, has said.Thirdly, China is committed to making the world more peaceful.For more than 70 years, China has never started a war, never occupied a single square mile of foreign territory, never engaged in proxy wars, and never been a member of or organized any military bloc.It is the only country that has incorporated peaceful development in its Constitution, and the only country among the five nuclear-weapon states to pledge no first use of nuclear weapons. China´s track record on peace can stand the scrutiny of history, and its peaceful rise is an unprecedented miracle in human history.Since China´s restoration of its lawful seat at the United Nations in 1971, China has actively participated in the political settlement of major regional hot issues, including the Korean Peninsula nuclear issue, the Iran nuclear issue, Afghanistan, Myanmar, and the Palestine-Israel issue.In response to mounting conflicts and security challenges in today´s world, Chinese President Xi Jinping proposed the Global Security Initiative (GSI) at the opening ceremony of the Boao Forum for Asia Annual Conference 2022.And in the GSI Concept Paper released last month, China further expounded the core ideas and principles of the initiative, identified the priorities, platforms and mechanisms of cooperation and demonstrated China´s sense of responsibility for safeguarding world peace and firm resolve to defend global security.""China´s idea of being a builder of world peace, contributor to global development, defender of the international order and provider of public goods are consistent with the ideals of the UN Charter,"" former UN Secretary-General Ban Ki-moon has said.People visit Jianchang ancient city during the Spring Festival holiday in Xichang, southwest China´s Sichuan Province, on Jan. 27, 2023. (Photo by Li Jieyi/Xinhua)AN ALTERNATIVE APPROACH?Chinese modernization is a new model for human advancement, and it dispels the myth that ""modernization is equal to Westernization,"" presents another picture of modernization, expands the channels for developing countries to achieve modernization, and provides a Chinese solution to aid the exploration of a better social system for humanity, Xi once said.China´s rise as a global economic power shattered the long-held notion that modernization means Westernization, said David Monyae, director of the Center for Africa-China Studies at the University of Johannesburg.The Chinese path to modernization serves as an ""example"" for developing countries, especially African countries, when they have been confronted with multiple crises that hinder their development in recent years, General Secretary of the Congolese Labor Party Pierre Moussa has said.""They could find in this model elements for the construction of a development path that can enable them to handle present and future challenges,"" he said.""Modernization has never been simply Westernization,"" Chen said, adding that ""Chinese modernization is a new development model, which can be used as a reference for other countries with similar national conditions or at a similar stage of development."" ",http://english.people.com.cn/n3/2023/0311/c90000-10220417.html,11,3,2023
Russia urges U.S. to prove innocence over Nord Stream incident - People's Daily Online,"Russia urges U.S. to prove innocence over Nord Stream incident (Xinhua) 11:13, February 18, 2023MOSCOW, Feb. 17 (Xinhua) -- The United States should try to prove its innocence of blowing up the Nord Stream gas pipelines, the Russian Embassy in the United States said on Thursday.The Russian side will not allow to simply turn the page on destroying critical energy infrastructure, especially given the fact that nothing is known about the remaining explosives on the bottom of the Baltic Sea, the embassy´s press secretary Igor Girenko said in a statement.""We qualify the incident as an act of international terrorism that requires a comprehensive and independent investigation. The United States, claiming to be the source of the 'ultimate truth,' should drop the baseless accusations against us and get down to business,"" Girenko said.In an article published last week, Pulitzer Prize winner Seymour Hersh revealed that the United States partnered with Norway in a top-secret operation in June 2022 to plant remotely triggered explosives that took out three of the four Nord Stream pipes three months later.",http://english.people.com.cn/n3/2023/0218/c90000-10209550.html,18,2,2023
U.S. foreign arms sales increase significantly in fiscal 2022 mainly due to military support for Ukraine - People's Daily Online,"U.S. foreign arms sales increase significantly in fiscal 2022 mainly due to military support for Ukraine (Xinhua) 13:56, January 28, 2023WASHINGTON, Jan. 27 (Xinhua) -- U.S. foreign arms sales grew significantly in fiscal year 2022, according to data released by the Department of State, which attributed the increase mainly to U.S. military support for Ukraine during the latter´s conflict with Russia.The total value of State Department-authorized government-to-government foreign military sales was 51.9 billion U.S. dollars in fiscal 2022, the 12-month period ending Sept. 30, 2022, up 49.1 percent from the previous fiscal year´s 34.8 billion dollars, the data showed.The so-called direct commercial sales, or sales of weapons and military equipment to foreign governments by U.S. defense contractors, also ticked up in fiscal 2022, increasing 48.6 percent to 153.7 billion dollars, compared to 103.4 billion dollars in fiscal 2021.At the end of fiscal 2022, 14,445 entities were registered with the Directorate of Defense Trade Controls to conduct defense trade activities, which is a slight increase from fiscal 2021, the department said in a press release dated Wednesday.The State Department attributed the spike to continuous U.S. provision of military assistance to Ukraine amid the ongoing conflict between Ukraine and Russia, while claiming that ""arms transfers and defense trade are important tools of U.S. foreign policy.""According to the Defense Department´s latest update released Wednesday, the United States has more than 27.1 billion dollars in security assistance for Ukraine since the Russia-Ukraine conflict broke out on Feb. 24, 2022.The 2022 arms sales numbers are potential deals the State Department has notified Congress, not the final sales, meaning some of the transactions may be refused by Congress, thus forcing the administration to engage in further negotiations.As far as the destinations of those sales are concerned, they cover U.S. allies and partners in Europe, as demands for U.S. weapons soared especially in NATO countries, and in the Asia Pacific and the Middle East regions.",http://english.people.com.cn/n3/2023/0128/c90000-10200122.html,28,1,2023
Chang'e-5 samples suggest exploitable water resources on the moon - People's Daily Online,"Chang'e-5 samples suggest exploitable water resources on the moon (Xinhua) 13:43, December 13, 2022BEIJING, Dec. 13 (Xinhua) -- By studying lunar samples retrieved by the Chang'e-5 mission, Chinese scientists found that lunar soil grains retain more solar wind-implanted water at the middle latitude region than previously thought.Based on this finding, the scientists predict that there is a large amount of water resources available for utilization at the high latitude region of the moon.Scientists had previously discovered the presence of surficial water on the moon. They believed that solar wind implantation, volcanic outgassing, and asteroid/comet impacts are likely to be important sources of surficial water on the moon.But how does water reach and remain on the moon? How much water is in the lunar soil? How is the water distributed spatially? A study of the lunar soil samples returned by China´s Chang'e-5 mission has shed new light on these questions.The research team, jointly led by scientists from the National Space Science Center (NSSC) and the Institute of Geology and Geophysics (IGG), both under the Chinese Academy of Sciences (CAS), published the new findings on Tuesday in the latest edition of the journal Proceedings of the National Academy of Sciences.Lin Yangting, a researcher at the IGG who led the study, explained that the water they refer to is not water in the usual sense, but the structural water found in soil grains. Since hydrogen is one of the main components of water, the hydrogen concentration is usually used to express the water content.The research team selected 17 lunar soil grains, including olivine, pyroxene, plagioclase and glass, from Chang'e-5 samples and carried out experimental analysis of the hydrogen content and isotopes using a newly-developed profiling technique on a nanoscale secondary ion mass spectrometer.The scientists found that the average water content in the topmost 0.1-micron zone of the lunar grains is 0.7 weight percent, rather high for nonaqueous minerals. They then proved through the deuterium-hydrogen ratios that the water on the lunar surface was solely derived from the solar wind.""The hydrogen ions emitted from the Sun reach at an average speed of 450 kilometers per second and they hit the surface of the lunar soil grains like bullets,"" said Tian Hengci, the paper´s co-first author, an associate professor at the IGG.Based on the analysis of heating experiments, the research team conducted the simulations on the preservation of hydrogen in lunar soils at different temperatures, and the results showed that the solar wind-originated water could be well preserved in the middle and high latitude regions of the lunar surface.Previously, scientists were unable to use the returned samples to study the possible influence of latitude on water content on the lunar surface, since the lunar samples collected by the Apollo missions of the United States and the Luna missions of the Soviet Union were all from the low latitude areas of the moon.China´s Chang'e-5 mission successfully retrieved 1,731 grams of lunar samples at the end of 2020. The probe landed at 43.06 degrees north latitude of the moon, higher than the latitudes of the landing sites of the Apollo and Luna missions. In addition, the crystallization age of the basalt in the Chang'e-5 landing area is about 2 billion years old, much younger than the sampling areas of the Apollo and Luna missions.""The Chang'e-5 samples provided us with the opportunity to study the evolution of solar wind, and the implantation and migration of water on the lunar surface,"" said Xu Yuchen, the co-first author of the paper from the NSSC.The research team built a dynamic equilibrium model between hydrogen implantation by solar wind and diffusion loss by heating, based on the analysis results of the Chang'e-5 samples and the experimental data of the Apollo samples.The model predicted that lunar grains in the high latitude region contain more solar wind-delivered water in their rims. The topmost 0.1-micron zone of the lunar grains could contain as much as 8.5 weight percent of water. And if the lunar soils are sorted by particle size, the water content in the particles less than 2 microns could reach 2 weight percent.""This discovery is of great significance for the future utilization of water resources on the moon. China plans to build a scientific research station in the south polar region of the moon. Our research shows that the south polar region of the moon may have more water than previously thought. And it is relatively easy to exploit and use the water contained in the lunar soil through particle size sorting and heating,"" said Lin.",http://english.people.com.cn/n3/2022/1213/c90000-10183513.html,13,12,2022
Commentary: China's improved anti-COVID measures a booster dose to global recovery - People's Daily Online,"Commentary: China´s improved anti-COVID measures a booster dose to global recoveryBy Xinhua writer Zhao Wencai (Xinhua) 08:29, December 14, 2022An elderly resident receives a shot of COVID-19 vaccine at home during a medical service for senior citizens in Dongcheng District of Beijing, capital of China, May 10, 2022. (Xinhua/Chen Zhonghao)- Three years on, with medical systems fortified, new variants getting tamer and 90 percent of the population armed with vaccines, China is better positioned to confront the virus and navigate out of the pandemic quagmire.- In a recent report on China´s economic outlook, Morgan Stanley predicted that China would stage a comeback from mid-2023, achieving a full-year growth of 5 percent.BEIJING, Dec. 13 (Xinhua) -- The Chinese government has rolled out a string of modified measures in line with the evolving pandemic situation and Beijing´s drive to better align anti-COVID efforts with economic and social development.The adjustments will give a much-needed booster shot to both the Chinese and global economies.China´s fight against the COVID pandemic has entered a new stage. Beijing is working to steer people´s lives back to normal after three years of rigorously managing the outbreak. It allows mild patients to quarantine at home and permits entry into some public places without a negative test result.Travel platforms showed that searches for air tickets to tourist spots like China´s Sanya and Harbin jumped as much as seven times after the new measures were released, with many people looking to travel around the Lunar New Year holiday in January.Restaurants are opening for dining in. More than 70 percent of the country´s cinemas have resumed operations. Advance tickets for James Cameron´s blockbuster ""Avatar: The Way of Water,"" scheduled to hit China´s theaters in mid-December, have already been snapped up.Unsurprisingly, some biased media outlets and pundits in the West have already rushed to question China´s latest adjustments, warning of darker times ahead. A closer look reveals that many of these skeptics previously criticized China for what they described as ""draconian"" COVID-19 measures over the years.A worker works at a factory of Harbin Electric Machinery Company Ltd. of Harbin Electric Corporation in Harbin, northeast China´s Heilongjiang Province, Sept. 3, 2022. (Xinhua/Wang Song)Actually, the improved measures are based on China´s efforts to suppress the pathogen since the beginning of the pandemic, an approach that puts people and their lives above everything else.For three years, China has kept the lowest infection and fatality rates among all major countries. According to data from Johns Hopkins University, the COVID infection rate in China is 2,883 per million people, while in the United States, it´s 299,595 per million. The fatality rate is 11 per million people in China and 3,267 per million in the United States.The increase in life expectancy during the pandemic also bespeaks China´s anti-COVID success. Over the past two years, China has increased life expectancy by 0.63 years, from 77.93 years in 2020 to 78.2 years in 2021. By contrast, primarily fueled by the pandemic, Americans' life expectancy dropped from 77 years in 2020 to 76.1 years in 2021.Models indicate that China would have suffered enormously, featuring millions of deaths, if it had adopted the U.S. strategy and opened up earlier when the previous variants were much more lethal.The decisive and responsive anti-COVID measures have delivered China a precious time window to brace its people for a showdown with the virus. While containing the virus throughout the pandemic, China built and reinforced a shield against the raging virus. In 2021 alone, China set up an additional 8,013 medical institutions, increased the number of hospital beds by 348,000 and trained 508,000 health workers.As a responsible member of the international community, China has never shied away from its commitment to the global fight against the pandemic.A batch of COVID-19 vaccines donated by China arrives at an airport in Tunis, Tunisia, Feb. 22, 2022. (Photo by Adel Ezzine/Xinhua)To strengthen global defenses, China provided anti-epidemic materials to 153 countries and 15 international organizations, sent medical expert groups to 34 countries, shared epidemic response knowledge with more than 180 countries and international organizations, and offered over 2.2 billion doses of COVID-19 vaccines to more than 120 countries and international organizations.To stabilize the global industrial and supply chains, China has been sharing its enormous market and continues providing industrial goods and consumer products for the world. In 2020, China was the only major economy to report positive economic growth. And last year, China accounted for more than 25 percent of global economic growth.Three years on, with medical systems fortified, new variants getting tamer and 90 percent of the population armed with vaccines, China is better positioned to confront the virus and navigate out of the pandemic quagmire.Analysts have predicted that China would leave the shadow of COVID-19 behind sooner than expected. In a recent report on China´s economic outlook, Morgan Stanley predicted that China would stage a comeback from mid-2023, achieving a full-year growth of 5 percent.As the largest locomotive of the global recovery, China will deliver more certainty to a shaky global economy.At a meeting earlier this month to plan economic work for 2023, China´s top leadership vowed to boost opening up at a higher level and attract further foreign investment. Optimizing pandemic response measures is one of the steps.Following the adjustments of anti-COVID measures, global markets were sent flying. U.S.-listed shares of Chinese companies rose. Strategists of investment banks raised their recommendation ratings for Chinese equities to overweight. The price of commodities, including copper and oil, climbed on the promise of increased demand from China, one of the world´s biggest consumers.Heads of major international organizations, including the World Bank and the International Monetary Fund, commended China´s return to normal, expecting a dynamic and resilient Chinese economy to continue shoring up international supply chains and galvanizing global growth.However, it´s worth remembering that the pandemic has not ended. Thousands of people worldwide are dying from it each day, billions have not received a single dose of a COVID-19 vaccine, and almost everyone´s life has been impacted by the virus, more or less. Putting the pandemic behind us needs more time and effort.",http://english.people.com.cn/n3/2022/1214/c90000-10183781.html,14,12,2022
