title,article,link,day,month,year
Chinese envoy calls for int'l discussion to address AUKUS-related proliferation risks - People's Daily Online,"Chinese envoy calls for int'l discussion to address AUKUS-related proliferation risks (Xinhua) 12:21, March 11, 2023VIENNA, March 10 (Xinhua) -- A Chinese envoy on Thursday called for advancing open, transparent, inclusive and sustainable intergovernmental discussion at the International Atomic Energy Agency (IAEA) to address the proliferation risks posed by the AUKUS nuclear submarine cooperation.Li Song, China´s permanent representative to the IAEA, said at a meeting of the agency´s Board of Governors that the AUKUS nuclear submarine collaboration poses serious nuclear proliferation risks, undermines the international non-proliferation regime, stimulates arms race, and threatens the peace and stability of the Asia-Pacific region.In September 2021, the United States, Britain and Australia announced the AUKUS deal, under which Washington and London will assist Canberra in acquiring nuclear-powered submarines. China and many other countries have repeatedly expressed concerns over the transfer of high purity uranium involved in the pact.The essence of the AUKUS cooperation is the transfer of tons of weapons-grade highly enriched uranium from the United States and Britain, both nuclear-weapon states and signatories to the Treaty on the Non-Proliferation of Nuclear Weapons (NPT), to Australia, a non-nuclear-weapon state, Li said.He added such a ""textbook case"" of nuclear proliferation violates NPT´s objectives and principles, and undermines the IAEA´s existing safeguard system and the international non-proliferation regime.He urged the AUKUS countries to abandon the Cold War mentality and zero-sum mindset, fulfill their international obligations and contribute more to regional peace and stability.It is up to all IAEA member states to seek proper solutions through intergovernmental discussions regarding whether and how to conduct safeguards on the AUKUS nuclear submarine collaboration, as the matter concerns the interests of all the member states and the integrity and effectiveness of the NPT, he said.Stressing that China respects the right of all other member states to express their views, Li said that China firmly opposes any country trying to impose its own views on others.""The U.S., the UK and Australia, while preaching the so-called 'highest non-proliferation standards,' are labeling normal intergovernmental discussions as 'politicized' and rejecting multilateral discussions. Is this what they call the 'rules-based international order?'"" he said.Noting it is essential to keep the intergovernmental discussion going at the IAEA as the AUKUS countries are about to announce concrete plans for their nuclear submarine cooperation, Li said that only true multilateralism can effectively safeguard the integrity and effectiveness of the international non-proliferation regime.Li called on the IAEA member states to actively participate in the intergovernmental discussion process to help safeguard the global non-proliferation regime.He said he believes IAEA Director General Rafael Grossi and the agency´s secretariat will play their due roles in the process and assist the member states in maintaining and advancing the process.He also urged the AUKUS countries not to settle on relevant safeguards arrangements with the IAEA secretariat or start nuclear submarine cooperation before a consensus is reached among the agency´s member states.The AUKUS countries should respond to the international community´s concerns with concrete actions, fulfill their non-proliferation obligations, and maintain candid and transparent communication with other member states on the basis of equality and mutual respect, he added.Representatives from Russia and other developing countries spoke in support of China´s position on the AUKUS issue at the IAEA board meeting. ",http://english.people.com.cn/n3/2023/0311/c90000-10220521.html,11,3,2023
Founder of crypto exchange FTX faces charges from multiple U.S. agencies - People's Daily Online,"Founder of crypto exchange FTX faces charges from multiple U.S. agencies (Xinhua) 09:48, December 14, 2022NEW YORK, Dec. 13 (Xinhua) -- Multiple U.S. agencies have filed charges against Sam Bankman-Fried, founder and former chief executive officer of cryptocurrency derivatives exchange FTX, which went into bankruptcy in November 2022.The U.S. Securities and Exchange Commission (SEC) on Tuesday charged Bankman-Fried with defrauding investors and customers in crypto asset trading platform FTX Trading Limited, the SEC said in a press release.""Bankman-Fried was orchestrating a massive, years-long fraud, diverting billions of dollars of the trading platform´s customer funds for his own personal benefit and to help grow his crypto empire,"" said a complaint by the SEC.Bankman-Fried, born in 1992 in California, improperly diverted customer assets to his privately-held crypto hedge fund Alameda Research LLC and then used the customer funds to make undisclosed venture investments, lavish real estate purchases, and large political donations, the complaint said.Though FTX had risk measures to protect customer assets, Bankman-Fried exempted Alameda from the risk mitigation measures and provided Alameda with significant special treatment on the FTX platform, including a virtually unlimited ""line of credit"" funded by the platform´s customers, according to the complaint.Bankman-Fried also misled investors in the months ahead of FTX´s bankruptcy so as to raise more money, according to the SEC.The SEC seeks to permanently enjoin Bankman-Fried from engaging in similar activities, order the defamed founder of FTX to disgorge his ill-gotten gains, impose civil money penalties and an officer and director bar on Bankman-Fried and prohibit him from participating in the offer or sales of securities including crypto asset securities.Bahamian authorities arrested Bankman-Fried on Monday at the request of the U.S. government, based on a sealed indictment filed by the U.S. Attorney´s Office for the South District of New York (SDNY), said SDNY on its social media account.U.S. federal prosecutors filed criminal charges against Bankman-Fried with eight counts including wire fraud on customers and lenders, and various conspiracy counts including conspiring to defraud the United States and violate campaign finance laws, according to the indictment unsealed Tuesday morning.The Commodity Futures Trading Commission also filed charges on Tuesday against Bankman-Fried for violations of federal commodities laws.Bankman-Fried planned to testify at a hearing by the U.S. House Committee on Financial Services virtually on Tuesday.Headquartered in the Bahamas, FTX once had a valuation of 32 billion U.S. dollars and suffered a liquidity squeeze after it was revealed that the exchange had a shortfall of around 8 billion dollars resulting from the misuse of client funds and losses in its trading arm Alameda Research Limited.FTX´s announcement for Chapter 11 bankruptcy in a U.S. court on Nov. 11 sent shockwaves across the crypto space and financial markets and triggered governmental probes.",http://english.people.com.cn/n3/2022/1214/c90000-10183871.html,14,12,2022
To ensure that the global economy grows on right track - People's Daily Online,"To ensure that the global economy grows on right trackBy Huan Yuping (People´s Daily) 13:58, February 18, 2023Recent reports issued by the United Nations (UN), the International Monetary Fund (IMF) and other organizations pointed out that the world economy will face greater downward pressure and increasing risks of recession because of the tightened monetary policies adopted by major economies such as the United States and Europe, geopolitical intentions, and continuous food and energy crises.Faced with challenges, the international society is in urgent need to improve the effectiveness of global economic governance. In particular, major economies should enhance macroeconomic policy coordination, jointly contribute to safeguarding an open world economy and make concerted efforts to maintain long-term and stable economic development in the post-pandemic era.To balance inflation control and stabilizing growth is a prominent challenge facing the world economy this year.Some reports believe that high inflation, which has bothered developed economies, is not likely to be completely coming down this year, so these economies' will keep tightening their monetary policies, which increases the risk of economic recession.The IMF attributed the possible slowing growth this year to advanced economies, whose growth is projected to decline from 2.7 percent in 2022 to 1.2 percent in 2023.Advanced economies' maintaining deflation would create negative spillover effects, which might bring higher debt and financial risks to emerging markets and developing countries.Growing trend of unilateralism and protectionist policies adopted by a few countries remain another major challenge facing the world economy.For political purposes, a few major countries that are of huge influence over the world economy, have long followed irresponsible policies and measures that are against the market law and hinder cooperation and development. It triggered concerns from the international community that the world economy, which is in sluggish recovery, may face higher risks if such practice continues.A severe fragmentation of the global economy after decades of increasing economic integration could reduce global economic output by up to 7 percent, but the losses could reach 8-12 percent in some countries, if technology is also decoupled, the International Monetary Fund said in a new staff report.IMF Managing Director Kristalina Georgieva noted that economic integration has helped billions of people become wealthier, healthier, and better educated. ""This peace and cooperation dividend should not be squandered"".Modern history reminds the world that major countries should practically take their responsibilities and enhance mutual coordination, which is of vital importance for the world economy to maintain stable progress amidst raging torrents.At present, it is widely expected around the world that a few major countries should reclaim their sense of responsibility and play a constructive role in promoting the strong, sustainable, balanced and inclusive growth of the world economy.The world economy has come to a crossroads. Only through enhanced coordination and cooperation can its anti-risk capability be raised.It´s important to see that this round of inflation has multiple reasons. Apart from the supply-side factors, the world needs to enhance international cooperation, address both the supply and demand sides, fix industrial and supply chains and pay close attention to energy and food security.While controlling inflation, advanced economies should work to reduce the negative spillover effects caused by their adjustment in monetary policies and practically safeguard the stability of the international financial system.Building an open world economy serves the common interests of the international society. All parties should build consensus and make joint efforts. Major countries, in particular, should maintain the stability of the global economic system, rules and foundation with concrete actions, rather than taking the lead to hinder international economic cooperation or divide global economy.Crises and opportunities always emerged simultaneously in the history of world economy.While effectively coping with risks, countries should take active and appropriate management measures to release more benefits of economic globalization and to rebalance the process of economic globalization.They should focus more on development issues, jointly work to make global development more inclusive, beneficial to all and resilient, and accelerate the implementation of UN 2030 Agenda for Sustainable Development.They should also strengthen international cooperation on tackling climate change and push for a comprehensive green transition in economic and social development.As the world´s largest economy, China is picking up speed in its own economic recovery and committed to improving global economic governance. The country will keep injecting confidence and positive energy into global economic development.The historical trend of openness and development will not reverse course, and the world´s shared desire to meet challenges together through cooperation will remain as strong as ever.All parties should join hands with each other and proceed with confidence, so as to ensure that the global economy grows on the right track.",http://english.people.com.cn/n3/2023/0218/c90000-10209587.html,18,2,2023
Nasdaq celebrates Chinese New Year with in-person opening bell - People's Daily Online,"Nasdaq celebrates Chinese New Year with in-person opening bell (Xinhua) 14:46, January 26, 2023Chinese Consul General in New York Huang Ping (6th R) participates in an opening bell ceremony in New York, the United States, on Jan. 25, 2023. Nasdaq, a major stock exchange in the world, celebrated the Chinese Lunar New Year on Wednesday morning by holding an in-person opening bell ceremony in partnership with the Chinese Consulate General in New York. (Xinhua/Liu Yanan)NEW YORK, Jan. 25 (Xinhua) -- Nasdaq, a major stock exchange in the world, celebrated the Chinese Lunar New Year on Wednesday morning by holding an in-person opening bell ceremony in partnership with the Chinese Consulate General in New York.As part of a multi-year tradition, Huang Ping, the Chinese consul general in New York, rang the opening bell at the Nasdaq MarketSite in Times Square, New York, the most populous city in the United States.Meanwhile, a billboard outside the Nasdaq building played videos in celebration of the Year of the Rabbit.""Today marks another example of a pledge that we have to companies around the world that list on our market. Moreover, Nasdaq´s commitment to China remains very strong,"" said Robert H. McCooey, Jr., vice chairman of Nasdaq, at the ceremony.""We're extremely proud to be the home for over 175 Chinese companies, innovative and iconic companies who embody the entrepreneurial spirit that help our two nations continue to grow,"" said McCooey.McCooey added that after all the difficult and tumultuous times over the past few years, 2023 is for cultivating peace and patience.""China is very clear that we're going to open our door and open wider to work with the international community, to realize our goal, to reach our destination and to share the fruits with everyone,"" said Huang at the ceremony.""As we are now heading into the Year of the Rabbit,"" Huang said, ""we should move as quickly as the rabbit and work together to implement the consensus reached by our two presidents to make this relationship more productive and more delivering to benefit our people and the people all around the world.""He also announced that the Chinese Consulate General in New York became fully open starting Wednesday, and extended his welcome to overseas visitors to China.Huang said it´s time to apply for visas and make plans to visit China. ""I'm sure you will be amazed and thrilled by China´s beauty of nature and also the diversity and ... abundant chances of opportunity to do business.""""We're very optimistic about 2023 for Chinese initial public offerings (IPOs) to come back to normalization of the market,"" McCooey told Xinhua on the sidelines of the event.With the recent decision of the Public Company Accounting Oversight Board (PCAOB), the understanding and cooperation with Chinese regulatory bodies and a clear understanding of how the account principles and practices will be implemented going forward, ""we're very excited about the opportunity for companies in 2023,"" said McCooey.According to McCooey, many Chinese companies continue to want to come to the U.S. markets in 2023. ""I've seen everything up and down. Markets are cyclical. I certainly think we're gonna have more IPOs from China than we had last year, but there was a very, very small base to work off,"" he said.McCooey added that Huang´s announcement on the full openness of the Chinese Consulate General in New York is very important.""We're very encouraged by that. And we're quite honored that he took the opportunity and the opening bell this morning to make this important announcement,"" said McCooey.For the previous two years, Nasdaq celebrated the Chinese Lunar New Year with virtual bell ringing ceremonies due to the COVID-19 pandemic. An animation program about Chinese Lunar New Year traditions is seen on Nasdaq´s outdoor display in New York, the United States, on Jan. 25, 2023. Nasdaq, a major stock exchange in the world, celebrated the Chinese Lunar New Year on Wednesday morning by holding an in-person opening bell ceremony in partnership with the Chinese Consulate General in New York. (Xinhua/Liu Yanan)An animation program about Chinese Lunar New Year traditions is seen on Nasdaq´s outdoor display in New York, the United States, on Jan. 25, 2023. Nasdaq, a major stock exchange in the world, celebrated the Chinese Lunar New Year on Wednesday morning by holding an in-person opening bell ceremony in partnership with the Chinese Consulate General in New York. (Xinhua/Liu Yanan)Chinese Consul General in New York Huang Ping (9th R) participates in an opening bell ceremony in New York, the United States, on Jan. 25, 2023. Nasdaq, a major stock exchange in the world, celebrated the Chinese Lunar New Year on Wednesday morning by holding an in-person opening bell ceremony in partnership with the Chinese Consulate General in New York. (Xinhua/Liu Yanan)",http://english.people.com.cn/n3/2023/0126/c90000-10199723.html,26,1,2023
Omicron subvariant XBB.1.5 accounts for nearly 90 pct new COVID-19 cases in U.S. - People's Daily Online,"Omicron subvariant XBB.1.5 accounts for nearly 90 pct new COVID-19 cases in U.S. (Xinhua) 13:38, March 04, 2023LOS ANGELES, March 3 (Xinhua) -- The highly transmissible Omicron subvariant XBB.1.5 now accounts for nearly 90 percent of all COVID-19 cases reported in the United States, according to the latest estimates released Friday by the U.S. Centers for Disease Control and Prevention (CDC).The prevalence of XBB.1.5 has kept increasing since late last year, and it is estimated to account for 89.2 percent of new COVID-19 cases in the country this week, up from 85.4 percent last week and 79.7 percent two weeks prior.The second most prevalent strain BQ.1.1 accounts for 6.7 percent.The CDC first started tracking XBB.1.5 in November last year, when it accounted for less than 1 percent of cases nationwide. Since then, the strain is spreading quickly in the United States.Early study suggests XBB.1.5 has a couple of concerning mutations that suggest it is even more contagious than other strains, possibly the most transmissible one so far.While XBB.1.5 is spreading easier, scientists said it does not seem to cause more severe disease.",http://english.people.com.cn/n3/2023/0304/c90000-10216052.html,04,3,2023
