title,article,link,day,month,year
"Fair, objective probe urged into alleged U.S. involvement in Nord Stream blasts - People's Daily Online","Fair, objective probe urged into alleged U.S. involvement in Nord Stream blasts (Xinhua) 08:21, March 01, 2023BEIJING, Feb. 28 (Xinhua) -- Twenty days into Pulitzer Prize winner Seymour Hersh´s bombshell report on U.S. involvement in the Nord Stream blasts, Washington is still dismissing the disclosure, the majority of Europe remains secretive, and Western mainstream media outlets stay as yet blind to the revelations.The chilling details brought to light in the report, however, have caused misgivings and grave concerns among the international community. Calling Hersh´s report something that should not be glossed over, more people around the world now demand an objective, fair and professional probe into the incident, and a speedup in truth-telling.NEEDLE OF SUSPICIONOn Sept. 26, 2022, a series of clandestine bombings and subsequent underwater gas leaks occurred on the Nord Stream 1 and Nord Stream 2 pipelines, which carry gas from Russia to Europe. Soon afterwards, Washington and some European countries pointed an accusing finger at Russia.This file photo provided by the Swedish Coast Guard on Sept. 28, 2022 shows a gas leak on the Nord Stream 1 pipeline. (The Swedish Coast Guard/Handout via Xinhua)But independent thinkers have reckoned the other way around. Days after the blasts, Jeffrey Sachs, director of the Center for Sustainable Development at Columbia University, told Bloomberg in a TV show that the United States, rather than Russia, could be behind the attack, leading TV hosts to abruptly taking him off the air.Hersh´s account on Feb. 8 adds weight to Sachs' assertions. In a 5,200-word article published on the U.S. portal Substack, Hersh revealed how the United States partnered with Norway in a top-secret operation in June 2022 to plant remotely triggered explosives that took out three of the four Nord Stream pipelines three months later.In response, Washington has denied the accusation on various occasions. Speaking to Fox News on Feb. 19, U.S. National Security Council spokesperson John Kirby called Hersh´s report ""a completely false story.""However, not everyone bought Washington´s version. In an emailed interview with Xinhua, Sachs perceived Hersh´s report as ""credible"" and consistent with several existing facts.Former U.S. National Security Agency employee and whistleblower Edward Snowden tweeted earlier this month that the United States is wasting time and money to shoot down ""unidentified flying objects"" above U.S. and Canadian soil to ensure that national security reporters get assigned to investigate balloon nonsense ""rather than (U.S.) budgets or bombings (of Nord Stream).""""The U.S. had the motive, means, and opportunity and spent many months confessing to the plot and then to the crime after it took place,"" noted the Black Agenda Report website, citing U.S. President Joe Biden´s pledge in February 2022 to stop the Nord Stream 2 project and U.S. Under Secretary of State Victoria Nuland´s remarks in January this year that Washington is ""gratified"" to know the Nord Stream 2 is now ""a hunk of metal at the bottom of the sea.""There are ""ample reasons"" why the United States would be involved in the Nord Stream blasts, Sevim Dagdelen, a parliamentarian of Germany´s Left Party, was quoted as saying by Canadian website Western Standard in a report published on Feb. 13.""Many European capitals put the finger against Russia and said, 'it was Russia that blew up its own pipeline,' which was nonsense,"" former Austrian Foreign Minister Karin Kneissl told Sputnik in an interview. ""For me, one thing was clear ever since 2018 that the U.S. was very much determined to make sure that this pipeline system would never ever become operative.""The now-deleted ""Thank you, USA"" tweet posted by former Polish Foreign Minister Radek Sikorski offered fresh insight into how much some European officials are convinced of U.S. culpability.COLLECTIVE SILENCEWhen the needle of suspicion points towards the United States, European governments have fallen into collective silence.Denmark, Germany and Sweden are investigating the destruction, but all remain tight-lipped over who blew holes in the pipelines.Last week, the three countries told the UN Security Council in a joint letter that investigations are ""ongoing."" Nothing was said about who is responsible. They only stated that ""investigations have not yet been concluded"" and ""it is not possible to say when they will be concluded.""Not even allowing access to members of the German Bundestag, all information on the matter has been classified as ""highly confidential"" because of the so-called third-party rule that prevents conflicts with the interests of allied states or their intelligence services.""Even if the Germans, Swedes or Danes themselves found some evidence of U.S. involvement in the explosions, they would hardly talk about them because they would not be able to take such responsibility,"" said Igor Yushkov, a leading analyst of Russia´s National Energy Security Fund.Besides, U.S. corporate media have overwhelmingly brushed aside Hersh´s report. A study by independent watchdog journalism MintPress News analyzed the 20 most influential publications in the United States, and found only four mentions of the report.""What´s most strange in this case is that U.S. mainstream media with political and social influence, such as The New York Times and The Washington Post, have deliberately remained indifferent and silent when Hersh, a veteran journalist who has proved his credibility in his investigations in the past, published his latest investigation of the Nord Stream blasts,"" wrote Singapore´s Chinese-language newspaper Lianhe Zaobao on Feb. 11.""When we see this kind of thing (the Nord Stream blasts) going on, we go to somebody who might be able to protect us and might be able to get the word out. Now, this was two weeks ago. Has The New York Times mentioned Seymour Hersh´s article? Or has it even reported the denials? No, not yet. This is quite (as what) the Germans would say, merkwurdig (strange),"" former CIA analyst Ray McGovern addressed the UN Security Council recently.This file photo released by the Danish Ministry of Defense on Sept. 27, 2022 shows a Nord Stream gas pipeline leak site. (Danish Defense Ministry/Handout via Xinhua)WHO BENEFITS MOST?A recent report by Indian news website Firstpost quoted Hersh as saying that the United States saw energy alternatives for Europe as a ""threat,"" and the Biden administration feared that Europe would ""walk away"" from the Ukraine crisis if it felt the need for Russian fuel carried by the pipeline, which was under sanctions.""The fear of losing European support in the Ukraine conflict made the U.S. to take out the only option Europe had should it want to restart buying fuel from Russia,"" Hersh argued.Just like Hersh, many others believing in U.S. sabotage also noted its strategic and economic motives behind the scenes.""The U.S. did not like the close economic relations between Germany and Russia. They are doing something or they could try to do something that could break these relations,"" Gunnar Beck, a member of the European Parliament, said in an interview with Russian newspaper Izvestia on Feb. 12.Washington was guided by strategic reasons to close Russia´s energy and economic ties with Germany and most countries in Western and Eastern Europe, Beck said.From the political and economic perspective, the United States is the major beneficiary of the incident, former Advisor to the French Defense Ministry Alain Corvez told the China Global Television Network on Feb. 14.Italian journalist Gilberto Trombetta also said that Hersh´s report is credible because the only one who would certainly benefit from the blasts is the United States.Hersh´s disclosure is ""not impossible"" because the United States has benefited the most from the incident as it can sell gas to Europe at a much higher price, in addition to exerting pressure on Russia, Croatian security expert Mirko Vukobratovic told Xinhua on Feb. 21.Meanwhile, calls for a thorough probe into the incident to restore truth have mounted across the world. For example, Sachs told the UN Security Council in a briefing on Feb. 21 that an investigation by the Security Council into the explosions is a high global priority.Noting the Nord Stream pipelines are major transboundary infrastructure and energy transportation arteries, Chinese Foreign Ministry Spokesperson Wang Wenbin said Wednesday that China supports speeding up the investigation into the blasts to swiftly find out the truth.Applauding China´s call, Vukobratovic said: ""The Chinese position that the investigation must be objective and impartial is the only correct one. Only when it is carried out professionally can we talk about the intentions of those who caused the explosion.""In her tweet on Wednesday, UN Under-Secretary-General for Political and Peacebuilding Affairs Rosemary A. DiCarlo also stressed the importance of ""search for the truth"" regarding the matter.",http://english.people.com.cn/n3/2023/0301/c90000-10214166.html,01,3,2023
U.S. wins maiden freestyle skiing mixed team aerials gold at Beijing 2022 - People's Daily Online,"U.S. wins maiden freestyle skiing mixed team aerials gold at Beijing 2022 (Xinhua) 08:12, February 11, 2022Gold medalists Ashley Caldwell, Christopher Lillis and Justin Schoenefeld (L to R) of the United States celebrate during the flower ceremony of the freestyle skiing mixed team aerials final at Genting Snow Park in Zhangjiakou, north China´s Hebei Province, Feb. 10, 2022. (Xinhua/Xue Yubin)CHONGLI, Zhangjiakou, Feb. 10 (Xinhua) -- The United States edged host China to win the freestyle skiing mixed team aerials gold thanks to a big jump by Christopher Lillis here on Thursday.The Americans trailed China by 17.17 points after the first run. But Lillis turned the tides with a perfect back double full-full-double full jump which earned Team USA 135 points, after China´s Jia Zongyang fell on his jump in the second run.China´s Qi Guangpu produced a great effort in the final run scoring 122.17 points, but Justin Schoenefeld wrapped up the victory for the United States with a 114.48-point jump.China bagged silver with 324.22 points and Canada took bronze with 290.98. Jia Zongyang of China reacts after the freestyle skiing mixed team aerials final at Genting Snow Park in Zhangjiakou, north China´s Hebei Province, Feb. 10, 2022. (Xinhua/Wu Zhuang)Jia Zongyang of China reacts during the freestyle skiing mixed team aerials final at Genting Snow Park in Zhangjiakou, north China´s Hebei Province, Feb. 10, 2022. (Xinhua/Zhu Zheng)Jia Zongyang of China reacts after the freestyle skiing mixed team aerials final at Genting Snow Park in Zhangjiakou, north China´s Hebei Province, Feb. 10, 2022. (Xinhua/Xue Yubin)Jia Zongyang of China competes during the freestyle skiing mixed team aerials final at Genting Snow Park in Zhangjiakou, north China´s Hebei Province, Feb. 10, 2022. (Xinhua/Wu Zhuang)Jia Zongyang of China reacts during the freestyle skiing mixed team aerials final at Genting Snow Park in Zhangjiakou, north China´s Hebei Province, Feb. 10, 2022. (Xinhua/Zhu Zheng)Jia Zongyang of China competes during the freestyle skiing mixed team aerials final at Genting Snow Park in Zhangjiakou, north China´s Hebei Province, Feb. 10, 2022. (Xinhua/Wang Haofei)Jia Zongyang of China competes during the freestyle skiing mixed team aerials final at Genting Snow Park in Zhangjiakou, north China´s Hebei Province, Feb. 10, 2022. (Xinhua/Zhu Zheng)Jia Zongyang of China reacts during the freestyle skiing mixed team aerials final at Genting Snow Park in Zhangjiakou, north China´s Hebei Province, Feb. 10, 2022. (Xinhua/Zhu Zheng)Xu Mengtao of China reacts after the freestyle skiing mixed team aerials final at Genting Snow Park in Zhangjiakou, north China´s Hebei Province, Feb. 10, 2022. (Xinhua/Xue Yubin)Jia Zongyang of China reacts after the freestyle skiing mixed team aerials final at Genting Snow Park in Zhangjiakou, north China´s Hebei Province, Feb. 10, 2022. (Xinhua/Wu Zhuang)Qi Guangpu of China reacts during the freestyle skiing mixed team aerials final at Genting Snow Park in Zhangjiakou, north China´s Hebei Province, Feb. 10, 2022. (Xinhua/Zhu Zheng)Justin Schoenefeld of the United States competes during the freestyle skiing mixed team aerials final at Genting Snow Park in Zhangjiakou, north China´s Hebei Province, Feb. 10, 2022. (Xinhua/Xue Yubin)Qi Guangpu (R) of China reacts during the freestyle skiing mixed team aerials final at Genting Snow Park in Zhangjiakou, north China´s Hebei Province, Feb. 10, 2022. (Xinhua/Zhu Zheng)Qi Guangpu of China competes during the freestyle skiing mixed team aerials final at Genting Snow Park in Zhangjiakou, north China´s Hebei Province, Feb. 10, 2022. (Xinhua/Xue Yubin)Qi Guangpu of China reacts during during the freestyle skiing mixed team aerials final at Genting Snow Park in Zhangjiakou, north China´s Hebei Province, Feb. 10, 2022. (Xinhua/Wu Zhuang)Qi Guangpu of China competes during the freestyle skiing mixed team aerials final at Genting Snow Park in Zhangjiakou, north China´s Hebei Province, Feb. 10, 2022. (Xinhua/Wu Zhuang)Qi Guangpu of China reacts during the freestyle skiing mixed team aerials final at Genting Snow Park in Zhangjiakou, north China´s Hebei Province, Feb. 10, 2022. (Xinhua/Xiao Yijiu)Xu Mengtao of China reacts during the freestyle skiing mixed team aerials final at Genting Snow Park in Zhangjiakou, north China´s Hebei Province, Feb. 10, 2022. (Xinhua/Fei Maohua)Xu Mengtao of China reacts during the freestyle skiing mixed team aerials final at Genting Snow Park in Zhangjiakou, north China´s Hebei Province, Feb. 10, 2022. (Xinhua/Zhu Zheng)Xu Mengtao of China reacts during the freestyle skiing mixed team aerials final at Genting Snow Park in Zhangjiakou, north China´s Hebei Province, Feb. 10, 2022. (Xinhua/Fei Maohua)Qi Guangpu of China competes during the freestyle skiing mixed team aerials final at Genting Snow Park in Zhangjiakou, north China´s Hebei Province, Feb. 10, 2022. (Xinhua/Fei Maohua)Qi Guangpu of China competes during the freestyle skiing mixed team aerials final at Genting Snow Park in Zhangjiakou, north China´s Hebei Province, Feb. 10, 2022. (Xinhua/Wang Haofei)Qi Guangpu of China competes during the freestyle skiing mixed team aerials final at Genting Snow Park in Zhangjiakou, north China´s Hebei Province, Feb. 10, 2022. (Xinhua/Fei Maohua)Qi Guangpu of China reacts during the freestyle skiing mixed team aerials final at Genting Snow Park in Zhangjiakou, north China´s Hebei Province, Feb. 10, 2022. (Xinhua/Fei Maohua)Team of China (front) react after the freestyle skiing mixed team aerials final at Genting Snow Park in Zhangjiakou, north China´s Hebei Province, Feb. 10, 2022. (Xinhua/Zhu Zheng)Silver medalist team of China, gold medalist team of the USA and bronze medalist team of Canada (from L to R) celebrate during the flower ceremony after the freestyle skiing mixed team aerials final at Genting Snow Park in Zhangjiakou, north China´s Hebei Province, Feb. 10, 2022. (Xinhua/Fei Maohua)Team of China (R)and Team of the United States react after the freestyle skiing mixed team aerials final at Genting Snow Park in Zhangjiakou, north China´s Hebei Province, Feb. 10, 2022. (Xinhua/Fei Maohua)",http://english.people.com.cn/n3/2022/0211/c90000-9956215.html,11,2,2022
New event of Beijing 2022 -- Mixed team aerials of free skiing - People's Daily Online,"New event of Beijing 2022 -- Mixed team aerials of free skiing (Xinhua) 13:53, February 11, 2022Xu Mengtao of China competes during the freestyle skiing mixed team aerials final at Genting Snow Park in Zhangjiakou, north China´s Hebei Province, Feb. 10, 2022. (Xinhua/Xu Chang)BEIJING, Feb. 11 (Xinhua) -- Seven new events have been added to the Beijing 2022 Olympic Winter Games.Today let´s take a look at mixed team aerials of free skiing.Mixed team aerials has been part of the World Cup circuit since the 2014/15 season, and the World Championships since 2019. Teams consist of three skiers, with at least one from each gender.Ilia Burov of ROC competes during the freestyle skiing mixed team aerials final at Genting Snow Park in Zhangjiakou, north China´s Hebei Province, Feb. 10, 2022. (Xinhua/Xue Yubin)Qi Guangpu of China competes during the freestyle skiing mixed team aerials final at Genting Snow Park in Zhangjiakou, north China´s Hebei Province, Feb. 10, 2022. (Xinhua/Yang Shiyao)Qi Guangpu of China competes during the freestyle skiing mixed team aerials final at Genting Snow Park in Zhangjiakou, north China´s Hebei Province, Feb. 10, 2022. (Xinhua/Xiao Yijiu)Xu Mengtao (front L) of China hugs Alexandra Baer (front R) of Switzerland during the freestyle skiing mixed team aerials final at Genting Snow Park in Zhangjiakou, north China´s Hebei Province, Feb. 10, 2022. (Xinhua/Zhu Zheng)Jia Zongyang, Xu Mengtao and Qi Guangpu (L to R) of China celebrate during the flower ceremony for the skiing mixed team aerials final at Genting Snow Park in Zhangjiakou, north China´s Hebei Province, Feb. 10, 2022. (Xinhua/Fei Maohua)Silver medalist team of China, gold medalist team of the USA and bronze medalist team of Canada (from L to R) celebrate during the flower ceremony after the freestyle skiing mixed team aerials final at Genting Snow Park in Zhangjiakou, north China´s Hebei Province, Feb. 10, 2022. (Xinhua/Fei Maohua)",http://english.people.com.cn/n3/2022/0211/c90000-9956536.html,11,2,2022
US society wrong to unleash anti-Asia hate - People's Daily Online,"US society wrong to unleash anti-Asia hate (China Daily) 15:04, February 24, 2023This photo shows the White House and a stop sign in Washington DC, the United States. [Photo/Xinhua]Just in the recent past, two new anti-Chinese hate incidents have been identified with the left in the United States. The cases are different, but the bias is not. One stems from liberal educators who kept secret the notifications of students who had attained National Merit Scholar status in order to advance equity (dictated by the deep state and opposed to the equality of opportunity that is an American tradition).The second is the case of Asians killed during the Chinese New Year celebrations in Los Angeles.The first involved mostly Asian students — 75 percent of the victims are of Asian origin with the majority of them being Chinese — who excelled in their high school in Virginia. Left-leaning schoolteachers and principals withheld news of the merit scholar list ostensibly to not offend students who were not high achievers and to advance equity.Many of the students who were kept in the dark about their merit status were cheated out of money in the form of a scholarship and/or an accolade that would have helped them get admission to a good university and likely a scholarship. The students were not informed on time to meet university application deadlines as the official merit lists were kept at the school or were with teachers or school officials for a week or more.The students were ""robbed"" and their academic career scarred. Most were discriminated against because of their race and because they are intelligent, hardworking and driven to excel.Critics argue that this policy is not only racist, but also demeans the US and puts the country at a disadvantage in global competition against China and other countries at a time when the US is in decline and fast losing its status as a great power.Some even compare it to Hitler´s pogroms of Jews during World War II, which forced many Jewish scientists to migrate to the US where they helped build the atomic bomb, which brought the war to an end, and later played a crucial role in the US' space program that led to American astronauts landing on the moon. Similarly, many Chinese scientists have returned home in recent times because of the anti-Chinese hate crimes and the Biden administration´s anti-China policies.What the school administrations and teachers did is said to have advanced the American Teachers Association´s liberal ideas. Yet the incident came to light only after students at Thomas Jefferson High School in northern Virginia, the top high school in the US according to the US News and World Reports, complained to the higher authorities about the discrimination. But many say that this has been happening in schools elsewhere in the US for some time now.However, Virginia Governor Glenn Youngkin, a conservative Republican just elected to office, took measures to make the practice unconstitutional, for which he has been widely applauded so much that some people have said he has a chance of becoming the Republican Party´s candidate for president in 2024.The second anti-Asian hate incident occurred in Los Angeles. In a violent attack on a Lunar New Year event, 11 people were killed and nine injured. Since the perpetrator was a person of Vietnamese origin who subsequently killed himself, details about his motives are not certain.The history of anti-Asian killings and racial discrimination against Asians in Los Angeles is legend. According to the Los Angeles Times, anti-Asian hate crimes increased 177 percent in Los Angeles in 2021, with some California officials calling it an ""epidemic of hate"". The Center for the Study of Hate and Extremism says Los Angeles is the number one city in the US when it comes to the number of hate crimes.Many crime suspects in Los Angeles are not prosecuted owing to the extremely liberal policies of the city government under district attorney George Gascon, who was elected with the help of George Soros, a financier with leftist views who contributed $2 million to Gascon´s election campaign.Gascon´s policy of going soft on many perpetrators of hate crimes has hit Asians hard, with many protesting against him and his administration. Defending the police, to many Asians, has become an excuse for not enforcing the law when the victims of hate crimes are Asians with people of Chinese origin being at the top of the list.USA Today reported that Monterey Park, the small suburb of Los Angeles County sometimes called the Chinese Beverly Hills, where the incident occurred, was the site of a disproportionate number of incidents of anti-Asian violence and crimes.Monterey Park is known in Los Angeles as an Asian haven, with two-thirds of its residents being Asians, almost 50 percent of whom are Chinese. The mayor is Chinese as are a number of other city officials. Many say a large share of business in the city is conducted in Mandarin. Monterey is a prosperous place, and eschews teaching woke and following leftist ideals, provoking the left in Los Angeles.The media often reports that hate against Asians intensified after previous US president Donald Trump said the novel coronavirus originated in China, and called COVID-19 the ""kung flu"" and launched the trade war with China. A Pew Foundation poll, however, showed this is not a serious concern to Americans.No wonder students at Harvard, led by Chinese students, sued the university for racial bias, alleging that the number of Asian students would be double in the university if it were not for the racial bias in the admission policy. While Trump supported their suit when he was in office, in a similar suit filed by students at Yale during Biden´s tenure, the Department of Justice refused to hear the case.Behind the anti-Asian, anti-Chinese in particular, hate crimes is the ill-will espoused by the mainstream media toward China, alleging that China is trying to destroy the liberal world order, spying on the US, stealing US technology, and perpetrating human rights abuses. This is blatant provocative propaganda, aimed at inciting anti-Chinese sentiments in the US which must be exposed for what it is.The author is the Stanley J. Buckman professor (emeritus) of International Studies at Rhodes College in Memphis, Tennessee. He is the author of more than 35 books on the Asia policy of China and the US.The opinions expressed here are those of the writer and do not necessarily represent the views of China Daily and China Daily website.",http://english.people.com.cn/n3/2023/0224/c90000-10212617.html,24,2,2023
