title,article,link,day,month,year
"US, a self-proclaimed human rights defender, fails to protect its children - People's Daily Online","US, a self-proclaimed human rights defender, fails to protect its childrenBy Chen Zi (People´s Daily Online) 17:08, March 10, 2023(Cartoon by Tan Xiguang)Touting itself as a ""human rights defender"", the United States has wantonly pointed fingers at the human rights situations in other countries. Human rights protection is a pretense of the U.S., which covers a ""black hole"" of the human rights situation in the U.S.The U.S. Department of Labor announced that it found that Packers Sanitation Services Inc. (PSSI), one of the nation’s largest food safety sanitation services providers, employed over 100 children in hazardous occupations, and had them working overnight shifts at meat processing facilities. The minors were working with hazardous chemicals and cleaning meat processing equipment, and suffered injuries while working for PSSI.Child labor is a chronic illness of U.S. society. The country has not ratified the United Nations Convention on the Rights of the Child yet, and has been criticized by the International Labor Organization many times. The Guardian reported that child labor law violations have increased in the U.S., with a 37 percent increase in fiscal year 2022, including 688 children working in hazardous conditions. Estimates by the Association of Farmworker Opportunity Programs suggest that there are 500,000 to 800,000 child farmworkers in the U.S. These facts are a sharp reminder that the U.S., a self-proclaimed human rights defender, can hardly protect the legitimate rights of children. ",http://english.people.com.cn/n3/2023/0310/c90000-10220276.html,10,3,2023
"Full text: Joint Trilateral Statement by the People's Republic of China, the Kingdom of Saudi Arabia, and the Islamic Republic of Iran - People's Daily Online","Full text: Joint Trilateral Statement by the People´s Republic of China, the Kingdom of Saudi Arabia, and the Islamic Republic of Iran (Xinhua) 11:45, March 11, 2023BEIJING, March 10 (Xinhua) -- The following is the full text of a joint statement released by the People´s Republic of China, the Kingdom of Saudi Arabia, and the Islamic Republic of Iran on Friday.Joint Trilateral Statement by the People´s Republic of China, the Kingdom of Saudi Arabia, and the Islamic Republic of IranIn response to the noble initiative of His Excellency President Xi Jinping, President of the People´s Republic of China, of China´s support for developing good neighborly relations between the Kingdom of Saudi Arabia and the Islamic Republic of Iran;And based on the agreement between His Excellency President Xi Jinping and the leaderships of the Kingdom of Saudi Arabia and the Islamic Republic of Iran, whereby the People´s Republic of China would host and sponsor talks between the Kingdom of Saudi Arabia and the Islamic Republic of Iran;Proceeding from their shared desire to resolve the disagreements between them through dialogue and diplomacy, and in light of their brotherly ties;Adhering to the principles and objectives of the Charters of the United Nations and the Organization of Islamic Cooperation (OIC), and international conventions and norms;The delegations from the two countries held talks on 6-10 March 2023 in Beijing - the delegation of the Kingdom of Saudi Arabia headed by His Excellency Dr. Musaad bin Mohammed Al-Aiban, Minister of State, Member of the Council of Ministers, and National Security Advisor, and the delegation of the Islamic Republic of Iran headed by His Excellency Admiral Ali Shamkhani, Secretary of the Supreme National Security Council of the Islamic Republic of Iran.The Saudi and Iranian sides expressed their appreciation and gratitude to the Republic of Iraq and the Sultanate of Oman for hosting rounds of dialogue that took place between both sides during the years 2021-2022. The two sides also expressed their appreciation and gratitude to the leadership and government of the People´s Republic of China for hosting and sponsoring the talks, and the efforts they placed towards its success.The three countries announce that an agreement has been reached between the Kingdom of Saudi Arabia and the Islamic Republic of Iran, that includes an agreement to resume diplomatic relations between them and re-open their embassies and missions within a period not exceeding two months, and the agreement includes their affirmation of the respect for the sovereignty of states and the non-interference in internal affairs of states. They also agreed that the ministers of foreign affairs of both countries shall meet to implement this, arrange for the return of their ambassadors, and discuss means of enhancing bilateral relations. They also agreed to implement the Security Cooperation Agreement between them, which was signed on 22/1/1422 (H), corresponding to 17/4/2001, and the General Agreement for Cooperation in the Fields of Economy, Trade, Investment, Technology, Science, Culture, Sports, and Youth, which was signed on 2/2/1419 (H), corresponding to 27/5/1998.The three countries expressed their keenness to exert all efforts towards enhancing regional and international peace and security.Issued in Beijing on 10 March 2023.The statement was co-signed by Representative for the People´s Republic of China Wang Yi, Member of the Political Bureau of the Communist Party of China (CPC) Central Committee and Director of the Foreign Affairs Commission of the CPC Central Committee, Representative for the Kingdom of Saudi Arabia Musaad bin Mohammed Al-Aiban, Minister of State, Member of the Council of Ministers, and National Security Advisor, and Representative for the Islamic Republic of Iran Ali Shamkhani, Secretary of the Supreme National Security Council. ",http://english.people.com.cn/n3/2023/0311/c90000-10220500.html,11,3,2023
Explainer: What Chinese modernization would mean for the world? - People's Daily Online,"Explainer: What Chinese modernization would mean for the world? (Xinhua) 11:01, March 11, 2023-- ""China´s path to modernization reflects Chinese wisdom, Chinese civilization and history,"" said Keith Bennett, a long-term China specialist and vice chair of Britain´s 48 Group Club.-- China always keeps the world´s development and peace in mind in its modernization process. That is because Beijing fully understands that it will do well only if the world does well, and vice versa.-- The Chinese path to modernization serves as an ""example"" for developing countries, especially African countries, when they have been confronted with multiple crises that hinder their development in recent years, General Secretary of the Congolese Labor Party Pierre Moussa has said.BEIJING, March 10 (Xinhua) -- For a long time in history, the world was shrouded in the myth that modernization equals Westernization. The emergence of Chinese modernization dispels it, making modernization no longer a single-choice question, but a multiple-choice one.For the world, China´s task to modernize a country of 1.4 billion people, or nearly one-fifth of the global population, is unprecedented. The Herculean pursuit not only captures global attention, but also has global ramifications.Among a series of concepts and initiatives that China promotes in both state governance and global interactions, the Chinese path to modernization is the most popular keyword that people would like to know more about, according to an overseas survey conducted by Xinhua News Agency recently.WHAT ARE DIFFERENCES BETWEEN CHINESE AND WESTERN MODERNIZATION?China´s path to modernization is one of peace and development, win-win cooperation, and harmony between humanity and nature, rather than external expansion and plundering.""China´s path to modernization reflects Chinese wisdom, Chinese civilization and history,"" said Keith Bennett, a long-term China specialist and vice chair of Britain´s 48 Group Club.""The modernization of a small number of Western countries was based on the exploitation, oppression and colonization of almost the entire world. China is not developing by exploiting any other country; China is developing itself and modernizing itself, and at the same time helping other countries to develop and modernize,"" he said.China does not seek to exploit or control other nations, and it plays no role in inciting conflicts, said Mokhtar Gobashy, deputy chairman of the Cairo-based Arab Center for Political and Strategic Studies, adding that´s why China has gained respect and popularity in the Arab world.Meanwhile, Chinese modernization emphasizes both material and cultural-ethical advancement, which distinguishes it from Western modernization, said Chen Gang, assistant director of the East Asian Institute of the National University of Singapore.The coordination of material and cultural-ethical advancement leads the way to realize all-around material abundance as well as people´s well-rounded development, Chen said.WHAT CHINESE MODERNIZATION CAN OFFER FOR THE WORLD?China stands in the world as the second-largest economy and a responsible major country. It always keeps the world´s development and peace in mind in its modernization process. That is because Beijing fully understands that it will do well only if the world does well, and vice versa.Firstly, China is committed to making the world less poor and more equitable.By the end of 2020, China had lifted out of poverty all rural residents living below the current poverty line and met the poverty eradication target set out in the 2030 Agenda for Sustainable Development 10 years ahead of schedule.Commenting on China´s poverty reduction drive, UN Secretary-General Antonio Guterres said those achievements are ""the biggest contribution for dramatical reduction of poverty.""More than eradicating absolute poverty, Chinese modernization promotes common prosperity, thereby shrinking the enormous wealth gap and inequality that have risen in tandem with Western modernization.British scholar and political commentator Martin Jacques highlighted China´s pursuit of common prosperity, lamenting how Western countries have never taken it seriously.""For China to embrace common prosperity, to establish a society of greater fairness, greater equity, that is a very important message not only to China, Chinese people but to the world as well,"" he said.China, on its way toward modernization, has also been sharing its development dividends with the rest of the world.Take the Belt and Road Initiative (BRI). According to a World Bank forecast, if all Belt and Road transport infrastructure projects are carried out, the initiative would generate 1.6 trillion U.S. dollars of global revenues annually to 2030. Up to 90 percent of the revenues would go to partner countries.""The most important thing about the BRI is that developing nations could benefit from the great experience in the development of China. BRI gives them the opportunity to create an industrial society and join the modern age. This is something that in the long run would bode well for the future of humanity,"" said Khairy Tourk, professor of economics with the Stuart School of Business at the Illinois Institute of Technology in Chicago.Secondly, China is committed to making the world greener and more biodiverse.China ranks first globally in the area of planted forests and forest coverage growth, contributing a quarter of the world´s new forest area in the past decade.From 2012 to 2021, China´s carbon dioxide emissions per unit of GDP declined by 34.4 percent, and energy consumption per unit of GDP decreased by 26.4 percent, equivalent to saving of 1.4 billion tons of standard coal.So far, China has also emerged as a major proponent of renewable energy, and it is working hard to capitalize on the potential of a green BRI.UNFCCC (the United Nations Framework Convention on Climate Change) Executive Secretary Simon Stiell spoke highly of China´s firm and consistent stance on actively addressing climate change, as well as its efforts to translate climate commitments into concrete actions.At a time when the world is facing an energy crisis, China continues to make solid progress in dealing with climate change and plays an important role in advancing the global response to climate change, Stiell said.Meanwhile, under China´s presidency, the 15th meeting of the Conference of the Parties (COP15) to the UN Convention on Biological Diversity has adopted the global biodiversity framework ahead of schedule. China has shown leadership in global biodiversity protection, Inger Andersen, executive director of the United Nations Environment Programme, has said.Thirdly, China is committed to making the world more peaceful.For more than 70 years, China has never started a war, never occupied a single square mile of foreign territory, never engaged in proxy wars, and never been a member of or organized any military bloc.It is the only country that has incorporated peaceful development in its Constitution, and the only country among the five nuclear-weapon states to pledge no first use of nuclear weapons. China´s track record on peace can stand the scrutiny of history, and its peaceful rise is an unprecedented miracle in human history.Since China´s restoration of its lawful seat at the United Nations in 1971, China has actively participated in the political settlement of major regional hot issues, including the Korean Peninsula nuclear issue, the Iran nuclear issue, Afghanistan, Myanmar, and the Palestine-Israel issue.In response to mounting conflicts and security challenges in today´s world, Chinese President Xi Jinping proposed the Global Security Initiative (GSI) at the opening ceremony of the Boao Forum for Asia Annual Conference 2022.And in the GSI Concept Paper released last month, China further expounded the core ideas and principles of the initiative, identified the priorities, platforms and mechanisms of cooperation and demonstrated China´s sense of responsibility for safeguarding world peace and firm resolve to defend global security.""China´s idea of being a builder of world peace, contributor to global development, defender of the international order and provider of public goods are consistent with the ideals of the UN Charter,"" former UN Secretary-General Ban Ki-moon has said.People visit Jianchang ancient city during the Spring Festival holiday in Xichang, southwest China´s Sichuan Province, on Jan. 27, 2023. (Photo by Li Jieyi/Xinhua)AN ALTERNATIVE APPROACH?Chinese modernization is a new model for human advancement, and it dispels the myth that ""modernization is equal to Westernization,"" presents another picture of modernization, expands the channels for developing countries to achieve modernization, and provides a Chinese solution to aid the exploration of a better social system for humanity, Xi once said.China´s rise as a global economic power shattered the long-held notion that modernization means Westernization, said David Monyae, director of the Center for Africa-China Studies at the University of Johannesburg.The Chinese path to modernization serves as an ""example"" for developing countries, especially African countries, when they have been confronted with multiple crises that hinder their development in recent years, General Secretary of the Congolese Labor Party Pierre Moussa has said.""They could find in this model elements for the construction of a development path that can enable them to handle present and future challenges,"" he said.""Modernization has never been simply Westernization,"" Chen said, adding that ""Chinese modernization is a new development model, which can be used as a reference for other countries with similar national conditions or at a similar stage of development."" ",http://english.people.com.cn/n3/2023/0311/c90000-10220417.html,11,3,2023
U.S. CDC lifts COVID-19 testing requirements for travelers from China - People's Daily Online,"U.S. CDC lifts COVID-19 testing requirements for travelers from China (Xinhua) 11:36, March 11, 2023LOS ANGELES, March 10 (Xinhua) -- The U.S. Centers for Disease Control and Prevention (CDC) on Friday lifted mandatory COVID-19 test requirements for travelers from China.The decision takes effect for flights departing to the United States from the Chinese mainland, Hong Kong, Macau, and designated airports at or after 3:00 p.m. Eastern Time Friday, according to an announcement on the CDC website.This means that starting Friday afternoon, air passengers will no longer need to get tested and show a negative COVID-19 test result, or show documentation of recovery from COVID-19, prior to boarding a flight to the United States from those places, according to the CDC.Designated airports include Incheon International Airport in Seoul of the Republic of Korea; Toronto Pearson International Airport in Canada; and Vancouver International Airport in Canada, according to the CDC. ",http://english.people.com.cn/n3/2023/0311/c90000-10220490.html,11,3,2023
"Saudi Arabia, Iran ink deal to resume diplomatic relations, reopen embassies - People's Daily Online","Saudi Arabia, Iran ink deal to resume diplomatic relations, reopen embassies (Xinhua) 13:05, March 11, 2023Wang Yi, a member of the Political Bureau of the Communist Party of China (CPC) Central Committee and director of the Office of the Foreign Affairs Commission of the CPC Central Committee, presides over the closing meeting of the talks between a Saudi delegation and an Iranian delegation in Beijing, capital of China, March 10, 2023. (Xinhua/Luo Xiaoguang)BEIJING, March 10 (Xinhua) -- As announced by China, Saudi Arabia and Iran on Friday, the latter two have reached a deal which includes the agreement to resume diplomatic relations and reopen embassies and missions within two months.Musaad bin Mohammed Al-Aiban, Saudi Arabia´s Minister of State, Member of the Council of Ministers, and National Security Advisor, led the Saudi delegation, and Admiral Ali Shamkhani, Secretary of the Supreme National Security Council of Iran, led the Iranian delegation during talks in Beijing from March 6 to 10, according to a trilateral statement from China, Saudi Arabia and Iran.Saudi Arabia and Iran held the talks to solve their differences through dialogue and diplomatic means, to abide by the purposes and principles of the Charters of the United Nations and the Organization of Islamic Cooperation, and to follow international regulations and practices, according to the joint statement.Both Saudi Arabia and Iran extended their appreciation and thanks to Iraq and Oman for hosting multiple rounds of dialogue between 2021 and 2022, and to Chinese leaders and the Chinese government for hosting, supporting and contributing to the success of the talks, the statement said.Saudi Arabia and Iran have agreed to restore diplomatic relations and reopen their embassies and missions within a period not exceeding two months, and agreed to hold talks between foreign ministers to arrange for the exchange of ambassadors and explore ways to strengthen bilateral relations, it said.While congratulating the two sides on taking a historical step forward, Wang Yi, director of the Office of the Foreign Affairs Commission of the Communist Party of China (CPC) Central Committee, said China supports the two sides in making firm strides as agreed in the deal to work for the common bright future with patience and wisdom.""As a reliable friend of the two countries, China will continue to play a constructive role,"" said Wang, also a member of the Political Bureau of the CPC Central Committee.He said the improvement of ties between Saudi Arabia and Iran has opened a path leading to regional peace and stability in the Middle East, and has set an example of settling divergences and differences among countries via dialogue and consultation.Al-Aiban and Shamkhani expressed their willingness to continue constructive dialogues, fully implement their consensus, and enhance good neighborliness to jointly safeguard regional security. Wang Yi (C), a member of the Political Bureau of the Communist Party of China (CPC) Central Committee and director of the Office of the Foreign Affairs Commission of the CPC Central Committee, attends a closing meeting of the talks between the Saudi delegation led by Musaad bin Mohammed Al-Aiban (L), Saudi Arabia´s Minister of State, Member of the Council of Ministers and National Security Advisor, and Iranian delegation led by Admiral Ali Shamkhani (R), Secretary of the Supreme National Security Council of Iran, in Beijing, capital of China, March 10, 2023. Wang Yi presided over the closing meeting here on Friday. (Xinhua/Luo Xiaoguang)",http://english.people.com.cn/n3/2023/0311/c90000-10220548.html,11,3,2023
