title,article,link,day,month,year
"Chinese embassy, U.S. museum virtually celebrate Chinese New Year with American families - People's Daily Online","Chinese embassy, U.S. museum virtually celebrate Chinese New Year with American families (Xinhua) 15:46, February 09, 2022WASHINGTON, Feb. 8 (Xinhua) -- Chinese Ambassador to the United States Qin Gang has joined more than 400 American families in the Virtual Chinese New Year Family Day, co-hosted by the Chinese Embassy in the United States and the Smithsonian American Art Museum.In a video message delivered on Feb. 5, Qin first sent Chinese New Year greetings to the audience, and then underlined the 2022 Olympic Winter Games underway in Beijing.Athletes from all over the world, including members of Team USA, ""are giving their best performances while experiencing the Lunar New Year in China,"" he said, noting that the audience were also able to celebrate the traditional Chinese festival by enjoying performances by both Chinese and American artists.Stephanie Stebich, director of the Smithsonian American Art Museum, thanked the Chinese embassy for supporting the Family Day event, the eighth of its kind jointly hosted by the two sides, saying that she looks forward to many more cultural exchange programs in the future.The Chinese embassy provided the event with demonstration videos on Beijing Opera, traditional Chinese paper-cutting, and clay modeling.Local American Chinese arts groups also created and shared videos of lion dancing, Chinese diabolo playing, and calligraphy writing, giving the audience a rich experience of Chinese New Year celebration.The Smithsonian American Art Museum, part of the Smithsonian Institution, is home to one of the largest and most inclusive collections of American art in the world. ",http://english.people.com.cn/n3/2022/0209/c90000-9955431.html,09,2,2022
U.S. witnesses bloodiest weekend of gun violence so far in 2023 - People's Daily Online,"U.S. witnesses bloodiest weekend of gun violence so far in 2023 (Xinhua) 13:29, February 24, 2023NEW YORK, Feb. 24 (Xinhua) -- Nine mass shootings took place in the United States over the weekend, resulting in 13 deaths and over 40 injuries, according to the data from Gun Violence Archive, making it the bloodiest weekend of gun violence so far in 2023.On the heels of several high-profile mass shootings in California last month and an attack at Michigan State University on Feb. 13, nine mass shootings in a single weekend is ""certainly high for this time of year,"" according to local media.As of Feb. 19, there have been 81 mass shootings so far this year, compared to 59 during the same period last year.Mark Bryant, executive director of the Gun Violence Archive, was quoted in a USA Today article as saying that ""the number of shootings over the weekend is unusual for mid-February in the U.S.""Daniel Webster, director of the Johns Hopkins Center for Gun Policy and Research, told USA Today that mass shootings underscored ongoing inaction from state and federal lawmakers. Almost all states witnessing mass shootings over the weekend don't require a license to carry concealed loaded guns.""Instead, state lawmakers have pushed Right to Carry laws that either eliminate the need to get a license to carry concealed guns or make getting such a license very easy,"" Webster said. ""But the 'more guns everywhere' approach has been found to increase violent crime and does nothing to reduce mass shootings.""Researchers on gun violence say legislative disorder in the United States has fueled gun violence severity. A case in point was the U.S. Supreme Court decision in June 2022 to strike down a New York state law that limits gun-carrying in public.The high court´s ruling that set new standards for evaluating gun laws left many open questions, resulting in an increasing number of conflicting decisions as lower court judges need help figuring out how to apply it, the Associated Press reported.In several instances, judges looking at the same laws have come down on opposite sides on whether they are constitutional in the wake of the conservative Supreme Court´s majority ruling, it reported, calling the phenomenon ""legal turmoil,"" for which the Supreme Court needs to step in soon to provide more guidance for judges.The weekend also put a 3-billion-U.S.-dollar industry of companies working to ""protect children or employees"" into the limelight, as gun violence particularly ravaged U.S. schools in recent months, like the attack at the elementary school in Uvalde, Texas, last year, and the tragedy at Michigan State University last week.As the New York Times listed, the offerings are numerous: automatically locking doors, bullet-resistant tables, Kevlar backpacks, artificial intelligence that detects guns and countless types of training exercises, like breathing techniques to avoid panic during an attack or strategies for how to use a pencil to pierce a shooter´s eyes.However, the effectiveness of such products and services must still be proven.Calling it an entire industry that capitalizes on school shootings, Odis Johnson, the executive director of the Johns Hopkins Center for Safe and Healthy Schools, said that these companies have very little evidence that what they are selling works. ",http://english.people.com.cn/n3/2023/0224/c90000-10212544.html,24,2,2023
"Latest Nord Stream theory ""politically suits"" West: Danish military expert - People's Daily Online","Latest Nord Stream theory ""politically suits"" West: Danish military expert (Xinhua) 13:04, March 09, 2023This aerial photo released by the Danish Ministry of Defense on Sept. 27, 2022 shows the Nord Stream gas pipeline leak site. (Danish Defense Ministry/Handout via Xinhua)According to Nielsen, the latest theory is a timely and ""reasonable solution"" for the North Atlantic Treaty Organization (NATO).COPENHAGEN, March 8 (Xinhua) -- A Danish military analyst on Wednesday called into question the claim made by U.S. and German media that a non-state actor was responsible for last September´s Nord Stream gas pipeline explosions.""It is a demanding operation to get down and dive at that depth and place so much explosive, so it would be a bit ridiculous to me if someone did it from a rented yacht,"" Danish news agency Ritzau quoted Anders Puck Nielsen from the Defense Academy as saying.According to Nielsen, the latest theory is a timely and ""reasonable solution"" for the North Atlantic Treaty Organization (NATO).This photo taken in Arlington of Virginia, the United States, shows a screen displaying U.S. President Joe Biden (R) and German Chancellor Olaf Scholz attending a press conference at the White House in Washington, D.C. on Feb. 7, 2022. (Xinhua/Liu Jie)""If you look at it politically, it suits the USA, NATO and Ukraine very well if you can point to a non-state actor as some kind of terrorist organization or saboteurs. It takes the focus away from themselves and Russia,"" Nielsen told Ritzau.The New York Times has cited new intelligence suggesting that a pro-Ukrainian group carried out the attack on the pipelines that run under the Baltic Sea from Russia to Germany.However, the paper failed to identify a source for the claim that a rented yacht was used to perpetrate the act.Aerial photo provided by the Swedish Coast Guard on Sept. 27, 2022 shows the gas leak from Nord Stream in the Baltic Sea. (The Swedish Coast Guard/Handout via Xinhua)",http://english.people.com.cn/n3/2023/0309/c90000-10219359.html,09,3,2023
FBI gun seizure orders over failures of background check hit historic rates: USA Today - People's Daily Online,"FBI gun seizure orders over failures of background check hit historic rates: USA Today (Xinhua) 13:21, March 07, 2023A man holds up a sign denouncing gun violence during a memorial for victims of a mass shooting at Monterey Park City Hall, California, the United States, on Jan. 23, 2023. (Photo by Zeng Hui/Xinhua)The numbers follow years of surging firearm sales. Yet they also underscore a longstanding tension in the system.NEW YORK, March 6 (Xinhua) -- The FBI has been issuing more seizure orders for guns sold to suspected prohibited buyers than at any time in the history of the U.S. federal firearm background check system, USA Today reported on Sunday.More than 6,300 such referrals were transmitted to the Bureau of Alcohol Tobacco Firearms and Explosives in 2020 to take back weapons from buyers when background checks later determined they may have been ineligible because of criminal records, mental health histories, disqualifying military service records and other bans, said the report, citing the most recent data compiled by the FBI.An additional 5,200 directives were issued in 2021, adding to the largest two-year total by far since the National Instant Criminal Background Check System began publishing data in 1998.The numbers follow years of surging firearm sales. Yet they also underscore a longstanding tension in the system: Federally licensed dealers are permitted to proceed with weapons sales in cases when background checks are not completed within the required three business days, according to the report.Daniel Webster, director of the Johns Hopkins Center for Gun Violence Solutions, was quoted as saying that the historic surge in firearm purchases in the United States was ""spurred by the combination of the onset of a scary pandemic, concerns about disruptions to the economy and social order, widespread protests against police violence, some violent and destructive, talks of defunding the police, historic increases in murders and one of the most hostile political environments in our nation´s history.""""The FBI likely did not have the human resources needed to keep up with the surge in background checks for firearm purchases. So it´s a lot more people buying guns and insufficient resources to complete the background checks and deny prohibited persons,"" he said.Seizure orders are issued when analysts later conclude that buyers likely should have been barred. The FBI noted that the retrieval orders represent a fraction of the millions of gun checks processed in 2020 and 2021. The 2022 data is not yet available, according to the report.",http://english.people.com.cn/n3/2023/0307/c90000-10217920.html,07,3,2023
Foreign journalists covering Beijing 2022 invited to experience Chinese culture - People's Daily Online,"Foreign journalists covering Beijing 2022 invited to experience Chinese culture (Ecns.cn) 09:44, February 17, 2022(ECNS) -- As the Beijing 2022 Winter Olympics continue, journalists covering the Games were invited to experience Chinese culture Tuesday.During a tour to the Juyong Pass of the Great Wall organized by the Beijing Organizing Committee for the 2022 Olympic and Paralympic Winter Games (BOCWOG), about 40 registered journalists witnessed the grand view from the Great Wall, one of the symbols of Chinese culture.""There are many Chinese cultures in such a big country compared to where we're from in Europe. It´s a very rich culture. It´s very diverse. It´s something to discover for everyone in the world,"" said a Winter Olympics journalist from Europe after visiting the magnificent structure.Japanese journalist Ryota Hasebe tweeted in celebration of the Chinese New Year on Jan. 31st. (Photo from a screenshot on Twitter)Many other journalists felt the same way.""That´s fun for me, and I really enjoy it,"" said Ute Maag, a freelance journalist from Germany, ""I have also covered the Olympics of 2008, but I didn't have enough time to come here. So it´s great to experience it now.”Croatia´s HRT journalist Martina Valid i said she grew interested in traditional Chinese medicine and Tai Chi back at the Main Media Center for the Beijing 2022 Winter Olympics. The tour of the Great Wall also impressed her.""I'm really excited to be a part of this tour,"" she said.Apart from the tour of the Great Wall, foreign journalists were also invited to taste Chinese food.Adam Wood, a journalist from USA Today, barely knew Chinese New Year before. But after he came to Beijing, he knew that this year is the Year of the Tiger and there are 12 zodiacs in Chinese culture, according to China Daily.Brazilian journalist Arlene Pravenik said the Beijing 2022 Winter Olympics gave the media an opportunity to learn more about traditional Chinese festivals and culture. ""We can't visit many places due to COVID-19, but we can have the chance to better understand Chinese culture here in Beijing,"" she told China Daily.Ryota Hasebe, a journalist from Japan’s Jiji Press, told China Dailythat he never knew how Chinese people celebrate the Spring Festival before he came to Beijing. “This is the first time I’ve ever celebrated the Spring Festival,” he added. He also said ""Happy Chinese New Year"" in fluent Chinese.",http://english.people.com.cn/n3/2022/0217/c90000-9959202.html,17,2,2022
Highlights of ISU World Speed Skating Championships - People's Daily Online,"Highlights of ISU World Speed Skating Championships (Xinhua) 15:02, March 03, 2023Yang Binyu of China competes during women´s 3000m on the Day 1 of the ISU World Speed Skating Championships in Heerenveen, the Netherlands, March 2, 2023. (Xinhua/Zheng Huansong)Han Mei of China competes during women´s 3000m on the Day 1 of the ISU World Speed Skating Championships in Heerenveen, the Netherlands, March 2, 2023. (Xinhua/Zheng Huansong)Han Mei of China competes during women´s 3000m on the Day 1 of the ISU World Speed Skating Championships in Heerenveen, the Netherlands, March 2, 2023. (Xinhua/Zheng Huansong)Ragne Wiklund of Norway reacts after women´s 3000m on the Day 1 of the ISU World Speed Skating Championships in Heerenveen, the Netherlands, March 2, 2023. (Xinhua/Zheng Huansong)Irene Schouten of the Netherlands competes during women´s 3000m on the Day 1 of the ISU World Speed Skating Championships in Heerenveen, the Netherlands, March 2, 2023. (Xinhua/Zheng Huansong)Irene Schouten of the Netherlands reacts during women´s 3000m on the Day 1 of the ISU World Speed Skating Championships in Heerenveen, the Netherlands, March 2, 2023. (Xinhua/Zheng Huansong)Gold medalist Ragne Wiklund (C) of Norway, silver medalist Irene Schouten of the Netherlands (L) and bronze medalist Martina Sablikova of the Czech Republic pose for photos during the awarding ceremony for women´s 3000m on the Day 1 of the ISU World Speed Skating Championships in Heerenveen, the Netherlands, March 2, 2023. (Xinhua/Zheng Huansong)Patrick Roest of the Netherlands competes during men´s 5000m on the Day 1 of the ISU World Speed Skating Championships in Heerenveen, the Netherlands, March 2, 2023. (Xinhua/Zheng Huansong)Patrick Roest of the Netherlands celebrates after men´s 5000m on the Day 1 of the ISU World Speed Skating Championships in Heerenveen, the Netherlands, March 2, 2023. (Xinhua/Zheng Huansong)Gold medalist team Canada (C), silver medalist team USA (L) and bronze medalist team China pose for photos during the awarding ceremony after women´s team sprint on the Day 1 of the ISU World Speed Skating Championships in Heerenveen, the Netherlands, March 2, 2023. (Xinhua/Zheng Huansong)Wang Shiwei (front) of China competes during men´s team sprint on the Day 1 of the ISU World Speed Skating Championships in Heerenveen, the Netherlands, March 2, 2023. (Xinhua/Zheng Huansong)Wang Shiwei (front) of China competes during men´s team sprint on the Day 1 of the ISU World Speed Skating Championships in Heerenveen, the Netherlands, March 2, 2023. (Xinhua/Zheng Huansong)Gold medalist team Canada, sivler medalist team the Netherlands and bronze medalist team Norway pose for photos during the awarding ceremony after men´s team sprint on the Day 1 of the ISU World Speed Skating Championships in Heerenveen, the Netherlands, March 2, 2023. (Xinhua/Zheng Huansong)Ning Zhongyan (R) of China reacts after men´s team sprint on the Day 1 of the ISU World Speed Skating Championships in Heerenveen, the Netherlands, March 2, 2023. (Xinhua/Zheng Huansong)",http://english.people.com.cn/n3/2023/0303/c90000-10215770.html,03,3,2023
Interview: China women's basketball coach aims high at Paris 2024 Olympics - People's Daily Online,"Interview: China women´s basketball coach aims high at Paris 2024 Olympics (Xinhua) 13:33, March 09, 2023BEIJING, March 9 (Xinhua) -- Making the move from player to head coach in women´s basketball is no easy feat, to say nothing of making it to the final of a World Cup as both a player and a head coach.So Zheng Wei has many reasons to be proud of herself.The current head coach of China´s women´s basketball team steered her squad to second place at the FIBA Women´s World Cup last year, tying the country´s best record in the tournament. She was also part of the China team which reached the final of the World Championships in 1994.In an exclusive interview with Xinhua, Zheng told her story of getting over regrets during a career spanning 28 years.UNFORGETTABLE FIBA 2022 WORLD CUPDuring the last Olympic cycle, China were widely considered serious medal contenders at major world competitions, but failed to prove their prowess at the Tokyo Olympics in 2021.""In Tokyo, we were rallied past and eliminated by Serbia,"" Zheng recalled.What made the year 2021 even more poignant for Zheng´s team was that they were defeated by Japan in the Asian Cup final.""Because of these setbacks my players really wanted to move a step forward and reach a new level,"" said Zheng.For Zheng, the underperformance was somehow reminiscent of the 1994 World Championships, where China missed out on the title after losing to Brazil in the final.""It was the closest China´s women´s basketball team had ever come to winning the world title. We defeated Australia to set up a final showdown with Brazil,"" said Zheng.""We had never lost to Brazil in previous games, so we felt like we were already the world champions.""But because we were mentally unprepared and too eager for success, we didn't play our best in that game and left with regrets,"" she added.28 years later, Zheng made up for her regrets, even though the young China side she coached also finished runners-up at the World Cup after losing to the United States in the final.Speaking of last year´s World Cup journey, Zheng mentioned the quarterfinal against France and the semifinal against Australia as the two most unforgettable games, as the former represented a breakthrough for the team, while the latter showcased her players' tenacity and resilience.""It was the best game that France played throughout the World Cup. Their shooting percentage was very high, and it was tough,"" said Zheng.""But our players had prepared for that moment for years. Everyone held their breath and didn't want to leave with regrets.""After breaking through this barrier, the players became more confident,"" she added.In the match against hosts Australia, China withstood pressure even though they were playing without top scorer Li Meng.""When the opportunity came, everyone´s determination to move forward did not change. Although Li Meng did not play, everyone else stepped up and took responsibility,"" Zheng noted.""I think it was willpower that helped us. Australia were a more experienced team, but by the fourth quarter, they couldn't keep up with us.""From the group stage to the final, Zheng´s players kept surprising her with fantastic performances. ""Maybe after breaking through that window, they couldn't be stopped. They did their best to present both technique and spirit on the court. I think there was no regret this time,"" said Zheng.CHINA MOVING TO THE TOPBasking in World Cup glory, Zheng urged her players to stay calm and work harder.""We only made it to the final in this tournament. It might come just by chance,"" said Zheng.""But if we are a genuinely top team like the USA, Australia, France and Spain, we need to prove ourselves in every competition.""A lack of experience is China´s biggest weakness, which often led to inconsistent play in the knockout stages, said Zheng.To change the situation, she stressed the importance of building up a more competitive professional league in China and scheduling more high-quality international friendlies for the national team.Zheng summarized the trend of women´s basketball as ""a more physical game with more vaguely defined positions, fiercer defense, more intensive body contact and better individual techniques.""""I believe we are approaching our goals on the right track through training,"" she said.TEAMWORK IS CHINA'S TRADITIONHaving served as an assistant coach of China´s national team for 12 years before taking charge as the head coach, Zheng is deeply impressed by the team´s tradition of teamwork.""Unity, cooperation, selfless dedication, and never giving up are the glorious traditions of China´s women´s basketball team,"" Zheng said.""Shao Ting and Sun Mengran have passed them on to Yang Liwei and Li Meng, and the latter are passing onto the next generation.""Zheng said that she also had good cooperation with her predecessors and learned a lot from them.""I had been analyzing opponents' strategies for the team before, so I am very familiar with both our players and our main opponents. What I can do is bring out the players' strength and make them more confident,"" she said.BALANCING PERSONAL DEVELOPMENT AND NATIONAL TEAMThe 2022-2023 WCBA league season is set to conclude in mid-March. Zheng confirmed that the national team will assemble at the end of March to begin preparations for this year´s two main events - the Asian Cup and the Asian Games.""We will play the Asian Cup in June, but some of the players who were in last year´s World Cup may not join the team because they have contracts with WNBA teams, so the mission will be tough for us,"" Zheng said.According to Zheng, four or five players, including center Han Xu and veteran Yang Liwei, have contacts with the WNBA. Zheng said she hopes that they can refine themselves in a more competitive league and return to perform better for the national team.Zheng revealed that the Asian Cup and the Asian Games are China´s short-term goal, while their long-term goal is the Paris Olympics in 2024.""We need to combine our preparations with the two goals,"" she said.""We may recruit more young players who can compete in international events. They are eager to play for the national team. We want to observe them and help them grow.""We hope to add one backup to every position. The national team´s roster will include 16 to 18 players this time.""Asked about their prospects at Paris 2024, Zheng said: ""We aim to match our World Cup performance in every major competition in the future. Hopefully we can achieve it.""",http://english.people.com.cn/n3/2023/0309/c90000-10219392.html,09,3,2023
Afghan central bank calls for reversal of U.S. decision on splitting assets - People's Daily Online,"Afghan central bank calls for reversal of U.S. decision on splitting assets (Xinhua) 14:53, February 13, 2022KABUL, Feb. 13 (Xinhua) -- Afghan central bank on Sunday issued a statement, calling for the reversal of U.S. government´s decision on splitting the frozen Afghan assets in the United States.The Da Afghanistan Bank (DAB)´s statement came after U.S. President Biden signed an executive order on Friday to free 7 billion U.S. dollars out of more than 9 billion frozen Afghan assets, splitting the money between humanitarian aid for cash-strapped Afghanistan and a fund for 9/11 victims.""DAB considers the latest decision of USA on blocking Foreign Exchange (FX) Reserves and allocating them to irrelevant purposes, injustice to the people of Afghanistan and will never accept if the FX reserves of Afghanistan is paid under the name of compensation or humanitarian assistance to others and wants the reversal of the decision and release of all FX reserves of Afghanistan,"" the bank said.""As per the law and relevant regulations, FX reserves of Afghanistan are used to implement monetary policy, facilitate international trade and stabilize financial sector,"" the statement read.The real owners of these reserves are people of Afghanistan. These reserves were not the property of governments, parties and groups and is never used as per their demand and decisions, the bank´s statement added.Mohammad Naeem, the spokesman of the Taliban political office in Qatar, on Friday criticized the decision on splitting the frozen Afghan assets in the United States.""Stealing the blocked funds of Afghan nation by the United States and its seizure is indicative of the lowest level of human and moral decay of a country and a nation,"" Naeem wrote on Twitter. ",http://english.people.com.cn/n3/2022/0213/c90000-9957173.html,13,2,2022
