title,article,link,day,month,year
Ukraine war: Russia's Wagner boss suggests 'betrayal' in Bakhmut battle - BBC News,"Ukraine war: Russia´s Wagner boss suggests ´betrayal´ in Bakhmut battle - BBC NewsBBC HomepageSkip to contentAccessibility HelpYour accountHomeNewsSportReelWorklifeTravelFutureMore menuMore menuSearch BBCHomeNewsSportReelWorklifeTravelFutureCultureMusicTVWeatherSoundsClose menuBBC NewsMenuHomeWar in UkraineCoronavirusClimateVideoWorldUKBusinessTechScienceMoreStoriesEntertainment & ArtsHealthWorld News TVIn PicturesReality CheckNewsbeatLong ReadsWorldAfricaAsiaAustraliaEuropeLatin AmericaMiddle EastUS & CanadaUkraine war: Russia´s Wagner boss suggests ´betrayal´ in Bakhmut battlePublished4 days agoShareclose panelShare pageCopy linkAbout sharingRelated TopicsRussia-Ukraine warImage source, ReutersImage caption, Yevgeny Prigozhin, head of the Wagner group, speaking in Bakhmut in a video released on 3 MarchBy Aoife WalshBBC NewsThe head of Russia´s Wagner private army says it is not getting the ammunition it needs from Moscow, as it seeks to gain control of Bakhmut. The eastern city has seen months of intense fighting, as Wagner and regular Russian troops try to seize it. But Wagner boss Yevgeny Prigozhin says his army´s lack of ammunition could be ""ordinary bureaucracy or a betrayal"".Ukraine´s president and military commanders have agreed to strengthen their defence of Bakhmut. Russia has appeared determined to capture the city for months, but many analysts say it has become a symbolic prize in the war and has little strategic value.An apparent rivalry between the mercenaries and the regular Russian army seems to have intensified in recent weeks, and this is not the first time Mr Prigozhin has accused the Russian defence ministry of withholding the ammunition it needs. In a social media post on Sunday, Mr Prigozhin said documents had been signed on 22 February, with ammunition expected to be sent to Bakhmut the next day.But most had not been shipped, he said, before suggesting it could be deliberate.And in a further sign of the rift, on Monday Mr Prigozhin said his representative was unable to access the headquarters of Russia´s military command. It is unclear where the headquarters is located. Mr Prigozhin said it came after he wrote to the chief of Russia´s ""special military operation"", Valery Gerasimov, about the ""urgent necessity to give us ammunition"".Separately, in a video uploaded on Saturday - but seemingly filmed in February - Mr Prigozhin said his men feared that they were being ""set up"" as scapegoats in case Russia lost its war in Ukraine. ""If we step back, we will go down in history as the people who took the main step to lose the war,"" he said.""And this is precisely the problem with the shell hunger [ammunition shortage]. This is not my opinion, but that of ordinary fighters... ""What if they [the Russian authorities] want to set us up, saying that we are scoundrels - and that´s why they are not giving us ammunition, not giving us weapons, and not letting us replenish our personnel, including [recruiting] prisoners?""In Saturday´s video, Mr Prigozhin also said Russia´s front line would collapse without his troops.He suggested Wagner fighters were taking on the ""entire Ukrainian army... destroying it"" and depriving it of the chance to concentrate on other parts of the front.What is Russia´s Wagner Group of mercenaries in Ukraine?Ukraine´s troops were probably conducting a ""limited fighting withdrawal"" in eastern Bakhmut, the Institute for the Study of War (ISW) said on Monday. But it added Ukraine was ""continuing to inflict high casualties"" on Russian forces.Ukrainian President Volodymyr Zelensky said his country´s military commanders supported continuing operations to defend and strengthen positions in Bakhmut. In a statement, President Zelensky´s office said he had held a meeting with Valery Zaluzhny, the head of Ukraine´s armed forces, and Oleksandr Syrsky, commander of the country´s ground forces.They spoke ""in favour of continuing the defensive operation and further strengthening our positions in Bakhmut"". On Saturday, the deputy mayor of Bakhmut told the BBC that there was street fighting between Russian and Ukrainian forces.However Oleksandr Marchenko said Russian troops had not yet gained control.""They have no goal to save the city... their only goal is killing people and the genocide of the Ukrainian people,"" Mr Marchenko told the Today programme.Separately, Moscow´s Mr Shoigu has visited the occupied city of Mariupol during a trip to eastern Ukraine - a year after his troops besieged the city. The defence ministry said he was inspecting work carried out to ""restore infrastructure in the Donbas"" - words that are likely to grate in Ukraine, given Russia´s responsibility for the destruction.Related TopicsRussia-Ukraine warUkraine",https://www.bbc.co.uk/news/world-europe-64859780,6,3,2023
Ukraine in maps: Tracking the war with Russia - BBC News,"Ukraine in maps: Tracking the war with Russia - BBC NewsBBC HomepageSkip to contentAccessibility HelpYour accountHomeNewsSportReelWorklifeTravelFutureMore menuMore menuSearch BBCHomeNewsSportReelWorklifeTravelFutureCultureMusicTVWeatherSoundsClose menuBBC NewsMenuHomeWar in UkraineCoronavirusClimateVideoWorldUKBusinessTechScienceMoreStoriesEntertainment & ArtsHealthWorld News TVIn PicturesReality CheckNewsbeatLong ReadsWorldAfricaAsiaAustraliaEuropeLatin AmericaMiddle EastUS & CanadaUkraine in maps: Tracking the war with RussiaPublished1 day agoShareclose panelShare pageCopy linkAbout sharingRelated TopicsRussia-Ukraine warBy The Visual Journalism Team  BBC NewsRussia has targeted cities across Ukraine in a new wave of missile strikes.Here are the latest developments:Cities including Kyiv, Kharkiv, Lviv and Odesa have been hit by Russian missilesPower at the Zaporizhzhia nuclear power plant was lost for several hoursHeavy fighting continues around Bakhmut in the east of the countryFront lines in the south around Kherson are largely stableMissile strikes across UkraineOn Thursday, Russian missiles struck targets in cities across Ukraine, killing at least nine people.Buildings and infrastructure were hit in Kyiv, Odesa and Kharkiv, with power blackouts in several areas.Ukraine said Russia had fired 81 missiles, the largest number in a single wave for several weeks.Five people were killed in Lviv, while other targets included Dnipro, Kherson and Zhytomyr.Russia said Kinzhal hypersonic missiles were launched in the attacks.A strike at the Zaporizhzhia nuclear power station cut the plant off from the Ukrainian power system for several hours, according to the nuclear energy operator Euratom.For the sixth time since it was taken over by Russia a year ago, the facility operated on diesel generators, which have enough supplies to last at least 10 days.The head of the UN nuclear watchdog, the IAEA, has issued an urgent warning about safety at the plant. ""How can this be allowed to happen... One day our luck will run out,"" said Rafael Grossi. Fighting rages around Bakhmut in the eastUkrainian forces are holding on in the eastern city of Bakhmut, under intense pressure from regular Russian troops and Wagner group mercenaries fighting on the Russian side.On Wednesday, the Wagner group leader Yevgeny Prigozhin said that his forces had captured all of eastern Bakhmut.The Institute for the Study of War (ISW) said that the claim was ""consistent with available visual evidence"".Why Bakmut matters for Russia and UkraineHas Putin´s war failed?Many military analysts say the city is of limited strategic significance. ""Russian forces remain unlikely to rapidly exploit a breakthrough beyond Bakhmut if Russian forces capture the city,"" says the ISW. The UK Ministry of Defence noted in December that capturing the city ""would potentially allow Russia to threaten the larger urban areas of Kramatorsk and Slovyansk"".Western officials estimate between 20,000 and 30,000 Russian troops have been killed or injured so far in and around Bakhmut.The fighting is part of a Russian spring offensive, which many analysts say is now under way.Michael Kofman, of the US-based Center for Naval Analysis, says that, so far, Russia´s gains have been ""underwhelming"".But, he adds, Ukraine may struggle to find weaknesses in Russia´s defences to mount a counter-attack, as Russian troop positions have been heavily reinforced. Front lines in the south stableIn the south of the country, artillery strikes continue around Kherson.Russian troops withdrew to the left bank, or eastern side, of the Dnipro River in November. Strikes by Ukrainian forces equipped with US-supplied Himars multiple rocket launchers had made Russian positions unsustainable.On Wednesday, Ukraine said its forces had destroyed a Russian ammunition depot to the west of Kherson.But many analysts assess that the front lines around the city are unlikely to change in the short term as Russia has built strong defences for its troops and equipment in the area.More than a year of fightingRussia´s invasion began with dozens of missile strikes on cities all over Ukraine before dawn on 24 February 2022. Russian ground troops moved in quickly and within a few weeks were in control of large areas of Ukraine. They had advanced to the suburbs of Kyiv, and controlled much of the north-east of the country around Sumy. Russian forces were bombarding Kharkiv, and they had taken territory in the east and south as far as Kherson, and surrounded the port city of Mariupol. But, they hit very strong Ukrainian resistance almost everywhere and faced serious logistical problems with poorly motivated Russian troops suffering shortages of food, water and ammunition.Ukrainian forces were also quick to deploy Western supplied arms such as the Nlaw anti-tank system, which proved highly effective against the Russian advance.More Western arms followed and by October the picture had changed dramatically - having failed to take Kyiv, Russia had withdrawn completely from the north. Ukraine had its first major success, pushing Russia back from Kharkiv, and counter-attacking around Kherson.One year since the invasion, Ukraine is in control of Kherson and largely containing, for now, the Russian advance in the east.By David Brown, Bella Hurrell, Dominic Bailey, Mike Hills, Lucy Rodgers, Paul Sargeant, Alison Trowsdale, Tural Ahmedzade, Mark Bryson, Zoe Bartholomew, Sean Willmott, Sana Dionysiou, Joy Roxas, Gerry Fletcher, Jana Tauschinsk, Debie Loizou, Simon Martin and Prina Shah.About these mapsTo indicate which parts of Ukraine are under control by Russian troops we are using daily assessments published by the Institute for the Study of War with the American Enterprise Institute´s Critical Threats Project. To show key areas where advances are taking place we are also using daily updates from the UK Ministry of Defence and BBC research.The situation in Ukraine is fast moving and it is likely there will be times when there have been changes not reflected in the maps.Related TopicsRussia-Ukraine warVolodymyr ZelenskyRussiaVladimir PutinUkraineTop StoriesDeadly shooting at Hamburg Jehovah´s Witness hallPublished1 hour agoVideo appears to show Hamburg suspect firing through window. VideoVideo appears to show Hamburg suspect firing through windowPublished16 hours agoMexican cartel turns in own men over US deathsPublished14 hours agoFeaturesMichelle Yeoh eyes an Oscar for ´unseen´ communitiesHow the US power grid is a target for the far right Quiz of the week: Why was cheese in the news?The true story behind Libianca´s ´more alcohol´ songThe woman using education in India to defy the TalibanAfrica´s top shots: Cool frames and gold nuggetsThe false claims fuelling Tunisia migrant tensionCan VR influencers save the metaverse?The driver of the ´insect apocalypse´Elsewhere on the BBCThe effect of TikTok´s beauty filtersThe 1991 video game phenomenonThe return of the US´ lost languageMost Read1Deadly shooting at Hamburg Jehovah´s Witness hall2Trump invited to testify in Stormy Daniels case3Prince Edward named as new Duke of Edinburgh4Mexico cartel turns in own men over US kidnappings5Knighthood for Johnson´s dad not wise - minister6Financial shares hit by Silicon Valley Bank slump7Tiger Woods´ ex says she was tricked into eviction8US man, 81, survives week in snowbank on biscotti9Chinese city draws backlash with flu lockdown idea10Actor Robert Blake, once tried for murder, dies at 89BBC News ServicesOn your mobileOn smart speakersGet news alertsContact BBC NewsHomeNewsSportReelWorklifeTravelFutureCultureMusicTVWeatherSoundsTerms of UseAbout the BBCPrivacy PolicyCookiesAccessibility HelpParental GuidanceContact the BBCGet Personalised NewslettersWhy you can trust the BBCAdvertise with usAdChoices / Do Not Sell My Info© 2023 BBC. The BBC is not responsible for the content of external sites. Read about our approach to external linking",https://www.bbc.co.uk/news/world-europe-60506682,9,3,2023
Russia country profile - BBC News,"Russia country profile - BBC NewsBBC HomepageSkip to contentAccessibility HelpYour accountHomeNewsSportReelWorklifeTravelFutureMore menuMore menuSearch BBCHomeNewsSportReelWorklifeTravelFutureCultureMusicTVWeatherSoundsClose menuBBC NewsMenuHomeWar in UkraineCoronavirusClimateVideoWorldUKBusinessTechScienceMoreStoriesEntertainment & ArtsHealthWorld News TVIn PicturesReality CheckNewsbeatLong ReadsWorldAfricaAsiaAustraliaEuropeLatin AmericaMiddle EastUS & CanadaRussia country profilePublished4 days agoShareclose panelShare pageCopy linkAbout sharingRussia - the largest country on earth - emerged from a decade of post-Soviet economic and political turmoil to seek to reassert itself as a world power.Income from vast natural resources, above all oil and gas, helped Russia overcome the economic collapse of 1998, but the oil price slump of 2014 ended the long run of prosperity. The state-run gas monopoly Gazprom still supplies a large share of Europe´s needs.Vladimir Putin - Russia´s dominant political figure since 2000 - has enhanced his control over state institutions and the media - a process supplemented more recently by an emphasis on fierce nationalism and hostility to the West.This led to his invasion of Ukraine in February 2022, in an attempt to re-assert Russian control over the neighbouring country. This was the largest conventional war in Europe since World War Two and has been met with widespread international condemnation.Read more country profiles - Profiles by BBC MonitoringRUSSIAN FEDERATION: FACTSCapital: MoscowArea: 17,098,246 sq kmPopulation: 147.1 millionLanguages: Russian, plus regional and local languagesLife expectancy: 66 years (men) 76 years (women)LEADERPresident: Vladimir PutinImage source, Getty ImagesVladimir Putin has been Russia´s dominant political figure since his election as president in 2000, serving two terms and then a four-year stint as prime minister, before resuming the presidency in 2012 and winning re-election in 2018.Since his re-election against only token opposition, Russia´s authorities have further tightened control over the media, thereby muffling an embryonic opposition movement. He has also and adopted a stridently nationalist course and appealed to memories of Soviet-era power to shore up domestic support.The president presents himself as a strong leader who took Russia out of the economic, social and political crisis of the 1990s, and defends Russia´s national interests, particularly against alleged Western hostility. Opponents and critics at home and abroad accuse him of undermining Russia´s institutions, halting democratic development, and entrenching rule by a narrow, wealthy elite.MEDIAImage source, Getty ImagesSince the start of the invasion of Ukraine in February 2022 nearly all independent media outlets in Russia have shut down, been forced to close, or have left the country to operate from exile. Top state-controlled domestic TV channels have cleared their schedules for current affairs programmes spreading anti-Ukrainian, anti-Western material.The authorities have also extended their control over the online world and are keen to curb the influence of global internet giants.Read full media profileTIMELINEImage source, Getty ImagesImage caption, Soldiers line up for a parade on Moscow´s Red SquareSome key dates in Russia´s history:1547 - Grand Prince Ivan IV of Moscow (Ivan the Terrible) is the first ruler to be proclaimed Tsar of Russia. 1689-1725 - Peter the Great introduces far-reaching reforms. 1798-1815 - Russia takes part in the European coalitions against Revolutionary and Napoleonic France, defeating Napoleon´s invasion in 1812 and contributing to his overthrow.1853-57 - Russia suffers setback in attempt to seize territory from declining Ottoman Empire through its defeat in Crimean War.1904-05 - Russian expansion in Manchuria leads to war with Japan - and the 1905 revolution, which forced Tsar Nicholas II to grant a constitution and establish a parliament, the Duma.1914 - Russian-Austrian rivalry in Balkans contributes to outbreak of World War One, in which Russia fights alongside Britain and France.Image source, Getty ImagesImage caption, Church of the Saviour on Spilled Blood in St Petersburg1917 - Nicholas II abdicates. Bolshevik revolutionaries led by Lenin topple the provisional government and take power. 1918-22 - Civil war between Red Army and anti-communist White Russians. 1922 - Bolsheviks reorganise remnants of Russian Empire as Union of Soviet Socialist Republics.1945 - Allied victory over Nazi Germany is followed by swift establishment of Soviet hegemony in Central and Eastern Europe, and Balkans. The end of the war sees the start of decades of Cold War rivalry with the West. Image source, Getty ImagesImage caption, Lenin and Stalin share a banner at a pro-Communist party rally in Moscow1953 - Death of dictator Joseph Stalin ushers in less repressive rule at home, although Communist Party political dominance is firmly upheld.1991 - Russia becomes independent as the Soviet Union collapses and, together with Ukraine and Belarus, forms the Commonwealth of Independent States, which is eventually joined by most former Soviet republics.2000 - Prime Minister Vladimir Putin takes over as president on the resignation of Boris Yeltsin, begins steady re-orientation of Russia away from democracy and cooperation with the West towards a more nationalist and authoritarian politics.2014 - Russia seizes Ukrainian region of Crimea. 2015 - Russia begins armed intervention in Syria to support ally President Bashar al-Assad.2022 - Russia invades Ukraine, prompting the biggest East-West showdown since the Cold War.Image source, Getty ImagesImage caption, A column of Russian tanks in eastern Ukraine in March 2022Related TopicsAsiaRussiaVladimir Putin",https://www.bbc.co.uk/news/world-europe-17839672,6,3,2023
Ukraine war: Russia fires hypersonic missiles in new barrage - BBC News,"Ukraine war: Russia fires hypersonic missiles in new barrage - BBC NewsBBC HomepageSkip to contentAccessibility HelpYour accountHomeNewsSportReelWorklifeTravelFutureMore menuMore menuSearch BBCHomeNewsSportReelWorklifeTravelFutureCultureMusicTVWeatherSoundsClose menuBBC NewsMenuHomeWar in UkraineCoronavirusClimateVideoWorldUKBusinessTechScienceMoreStoriesEntertainment & ArtsHealthWorld News TVIn PicturesReality CheckNewsbeatLong ReadsWorldAfricaAsiaAustraliaEuropeLatin AmericaMiddle EastUS & CanadaUkraine war: Russia fires hypersonic missiles in new barragePublished17 hours agoShareclose panelShare pageCopy linkAbout sharingRelated TopicsRussia-Ukraine warThis video can not be playedTo play this video you need to enable JavaScript in your browser.Media caption, Watch: Wave of Russian strikes leaves destruction across UkraineBy Henri AstierBBC NewsAt least nine people have died in a new wave of strikes across Ukraine in which Russia used powerful weapons, including rare hypersonic missiles.Russia had reportedly not fired Kinzhal hypersonic missiles - which can evade air defences - since the early months of the conflict.The latest barrage was the most severe to hit Ukraine for weeks.It cut power to the Zaporizhzhia nuclear plant - Europe´s biggest - although it was later restored.On Thursday Russian defence ministry spokesman Igor Konashenkov said: ""High-precision long-range air, sea and land-based weapons, including the Kinzhal hypersonic missile system, hit key elements of Ukraine´s military infrastructure.""It was the biggest day of Russian strikes on Ukraine since the end of January,The Ukrainian military claimed it had successfully shot down 34 cruise missiles and four Iranian-made Shahed drones.But it also said it had been unable to intercept the six Kinzhal ballistic missiles - nor was it able to destroy older weapons, such as Kh-22 anti-ship missiles and S-300 anti-aircraft missiles.""This was a major attack and for the first time with so many different types of missiles,"" the Reuters news agency quoted a Ukrainian air force spokesperson as saying. ""It was like never before.""President Vladimir Putin has highlighted Russia´s investment in ballistic hypersonic missiles, which can travel at more than five times the speed of sound.How risky is stand-off over Ukraine´s nuclear plant?Ukraine in maps: Tracking the war with RussiaNuclear energy operator Energoatom said the strike at the Zaporizhzhia plant had cut off the link between the facility and the Ukrainian power system. For the sixth time since it was taken over by Russia a year ago, the facility operated on diesel generators until the link was restored later on Thursday.Electricity is needed for cooling radioactive material present at the plant. ""Today´s loss of all external power once again demonstrated how fragile and dangerous the situation is for the Zaporizhzhya Nuclear Power Plant,"" said Rafael Grossi, the head of the International Atomic Energy Agency (IAEA).Earlier on Thursday he had called for an international commitment to protect the plant, following a series of strikes since the invasion began.""Each time we are rolling a dice. And if we allow this to continue time after time then one day our luck will run out,"" Mr Grossi said.In the capital Kyiv, emergency services attended the scenes of blasts in western and southern districts.A missile also hit an energy facility in the port city of Odesa, triggering power cuts, its governor Maksym Marchenko said. Residential areas were also hit but no casualties were reported.Elsewhere, Ukraine´s military says it has pushed back intense Russian attacks on the embattled eastern city of Bakhmut despite Russian forces claiming to have taken control of its eastern half.Moscow has been trying to take Bakhmut for months, as both sides suffer heavy losses in a grinding war of attrition.""The enemy continued its attacks and has shown no sign of a let-up in storming the city of Bakhmut,"" the general staff of the Ukrainian armed forces said. ""Our defenders repelled attacks on Bakhmut and on surrounding communities.""Between 20,000 and 30,000 Russian troops have been killed or wounded in the battle for the Ukrainian city of Bakhmut since it began last summer, Western officials say. The figures cannot be verified independently.Related TopicsRussia-Ukraine warKyivRussiaZaporizhzhia nuclear power plantUkraine",https://www.bbc.co.uk/news/world-europe-64903202,9,3,2023
